title,date
It’s easy to hate the rich but harder to justify it,2020-10-13
"UK lawyers and accountants risk losing in EU deal, warns report ",2020-10-12
Poor nations appeal for greater debt relief support,2020-10-12
Act now to prevent a tragic economic ending,2020-10-12
India unveils ‘underwhelming’ $10bn stimulus for pandemic-hit economy,2020-10-12
Airbus-Boeing and the bright side of endless litigation,2020-10-12
FirstFT: Today’s top stories,2020-10-12
Nobel Prize in economics awarded to duo for work on auction theory,2020-10-12
BoE asks banks how ready they are for negative rates,2020-10-12
OECD drafts principles for $100bn global corporate tax revolution,2020-10-12
EU’s new trade commissioner pledges more ‘assertive’ posture ,2020-10-12
Emerging economies plead for more ambitious debt relief programmes,2020-10-12
Informal Saudi ban on Turkish goods hits global fashion retailers,2020-10-12
The Great Wall (Street) of China,2020-10-12
EU leaders to insist on tough enforcement powers in Brexit deal,2020-10-12
Tesco drops avocado supplier after allegations of rights abuse ,2020-10-11
Global recovery from Covid is fragile and patchy,2020-10-11
"IMF meetings, Wall St bank results, US retail data",2020-10-11
UK retail body steps up calls for government action on illegal pay,2020-10-11
Dawn breaks on a new age of economic thinking,2020-10-11
Brussels calls on US to drop tariffs in Airbus-Boeing dispute,2020-10-11
Fed’s Powell is chief cheerleader for fiscal stimulus,2020-10-11
East-west divide: winners and losers in the Covid economy,2020-10-11
"Intergenerational conflict: not OK, boomer",2020-10-11
Serbia cultivates both US and China in Balkans tug of war,2020-10-11
Pelosi rejects increased US stimulus offer,2020-10-10
Coronavirus: US cases jump by the most in two months on Midwest surge — as it happened,2020-10-09
Stopping the descent into a new cold war,2020-10-09
Brussels looks to divvy up old UK fishing rights in Brexit deal,2020-10-09
Covid-19 is really a syndemic — and that shows us how to fight it ,2020-10-09
Rise in Italian industrial output points to strong economic rebound,2020-10-09
FirstFT: Today’s top stories,2020-10-09
Testing offers a way back to the skies  ,2020-10-09
Domestic travel over Golden Week boosts China’s economic recovery,2020-10-09
"Thousands of UK businesses not prepared for Brexit, MPs told",2020-10-08
Pelosi rules out airline bailout without wider stimulus deal,2020-10-08
China blurs lines between private and state business,2020-10-08
Can the UK and EU finally net that trade deal?,2020-10-08
"Further euro rise would hit growth and inflation, ECB policymakers warned",2020-10-08
"US jobless claims remained elevated at 840,000 last week  ",2020-10-08
Impending row over Covid vaccine patents at WTO,2020-10-08
FirstFT: Today’s top stories,2020-10-08
Nigerian and Korean candidates face off to lead WTO,2020-10-08
It is time to move beyond a flawed G20,2020-10-08
"Borrow to fight economic impact of pandemic, says World Bank’s chief economist",2020-10-08
A digital euro is on its way,2020-10-08
Logisticians grapple to map out ‘cold chain’ for vaccine campaign,2020-10-08
Democracy faces bigger threats than Vladimir Putin or Xi Jinping ,2020-10-08
‘This is a guy who is a thug’: how US elite became hawks on Xi’s China,2020-10-08
Covid forces rewrite of academic textbooks on supply chains and logistics,2020-10-08
Future of Logistics,2020-10-08
Supply shocks prompt carmakers to review fragile business models,2020-10-08
Telematics extend ‘co-opetition’ to keep wheels of industry turning,2020-10-08
Chocolate groups gain ground on bean-to-bar tracing,2020-10-08
Booming demand for Chinese assets boosts renminbi’s global role ,2020-10-07
Fed minutes leave room for manoeuvre on interest rate policy  ,2020-10-07
World Economic Forum drops Davos for 2021 meeting,2020-10-07
Barnier and Frost hint at space for compromises in Brexit trade talks,2020-10-07
"Covid-19 will push millions into poverty, warns World Bank",2020-10-07
Hopes fade for US stimulus with Washington in stalemate,2020-10-07
Donald Trump creates confusion over US stimulus package,2020-10-07
Central banks flip to gold sales after record rally,2020-10-07
US probe into Vietnamese currency masks Trump’s real trade target ,2020-10-07
FirstFT: Today’s top stories,2020-10-07
Colombia chases Mexico’s lead in nearshoring,2020-10-07
"Foreign investment in Colombia holds firm, says trade minister",2020-10-07
Hidden joblessness threatens recovery in US and Europe,2020-10-07
From AI to facial recognition: how China is setting the rules in new tech,2020-10-07
"US stimulus talks end, Macy’s buys stake in Swedish fintech",2020-10-07
SE Asia set to overtake China as world’s top notebook PC producer,2020-10-06
Brussels resists plan to safeguard post-Brexit share trading,2020-10-06
Powell says too little stimulus is worse than too much,2020-10-06
US trade deficit in August was widest in 14 years ,2020-10-06
"Coronavirus ‘calamity far from over’, says IMF head",2020-10-06
FirstFT: Today’s top stories,2020-10-06
UK cheesemongers could find mould on tasty trade treaty with Japan,2020-10-06
Liberal democracies have a creeping loyalty problem,2020-10-06
Eurozone’s uneven recovery needs attention ,2020-10-06
France to notch another victory in scramble for European top jobs ,2020-10-06
"The great uncoupling: one supply chain for China, one for everywhere else",2020-10-06
New Cold War,2020-10-06
"Trump returns to White House, a fight over lithium batteries",2020-10-06
Long road lies ahead for UK-US trade talks,2020-10-06
Markets boosted over rising hopes for US economic stimulus,2020-10-05
Time is right for a new international debt architecture,2020-10-05
IMF calls on rich nations to boost public investment,2020-10-05
Indonesia’s parliament passes sweeping reform bill,2020-10-05
Spanish services woe threatens eurozone economic recovery,2020-10-05
Why the world’s richest countries are not all rich   ,2020-10-05
FirstFT: Today’s top stories,2020-10-05
SMIC shares fall as Chinese chipmaker warns of hit from US curbs,2020-10-05
The ECB struggles to address its gender imbalance ,2020-10-05
The end of the dollar’s exorbitant privilege,2020-10-05
"A new cold war: Trump, Xi and the escalating US-China confrontation",2020-10-05
Thousands of companies sue US over China tariffs,2020-10-05
Fraying ECB consensus poses diplomatic challenge for Lagarde,2020-10-05
How to make business fix supply chain flaws,2020-10-05
TechMet wins US backing for Brazilian mining project,2020-10-04
Barnier to hold fisheries talks in bid to break Brexit deadlock ,2020-10-04
Trump calls for deal on new fiscal stimulus,2020-10-04
Covid recovery will stem from digital business,2020-10-04
China’s geopolitics are pumped up by its economic success,2020-10-04
"Trump’s prognosis, PMI data, Johnson seeks party unity",2020-10-04
Global goods sector drives economic recovery,2020-10-04
Will increased US political uncertainty boost the dollar?,2020-10-04
Johnson and von der Leyen agree to ‘intensified’ trade talks,2020-10-03
Pace of US jobs growth slowed in September,2020-10-02
Chill descends on two continents divided by common appliances,2020-10-02
FirstFT: Today’s top stories,2020-10-02
The jobs market is far bleaker than the headline stats show ,2020-10-02
Foreigners rush into China’s policy bank bonds at record pace,2020-10-01
IMF calls for urgent action to prevent debt crisis in emerging economies,2020-10-01
China’s net-zero target is a giant step in fight against climate change,2020-10-01
Central bankers have been relegated to second division,2020-10-01
FirstFT: Today’s top stories,2020-10-01
Capitalists unite! You have nothing to lose but your supply chains,2020-10-01
Brussels launches legal action against UK over Brexit deal breach,2020-10-01
ECB gets ready to target the ‘green spread’,2020-10-01
The ECB begins its shift to a new inflation goal,2020-10-01
Brexit talks: what are the main obstacles to a deal? ,2020-10-01
Long-term thinking proves vital to Singapore ‘remaking itself’,2020-09-30
"‘Contagious pessimism’ hitting recovery, warns Bank of England economist",2020-09-30
Falling business investment scars UK’s long-term growth potential,2020-09-30
BoE economist warns against pessimism after record drop in GDP ,2020-09-30
HSBC should concentrate on Asia,2020-09-30
FirstFT: Today’s top stories,2020-09-30
"ECB to consider allowing inflation to exceed target, Lagarde says",2020-09-30
Why Washington’s clampdown on Chinese chipmakers could backfire,2020-09-30
"EU won’t grant preferential trade terms to UK car industry, admits Frost",2020-09-30
Cuba on edge as government readies landmark currency devaluation,2020-09-30
The perils of life in Beijing’s backyard,2020-09-30
Coronavirus-induced ‘reshoring’ is not happening,2020-09-30
Singapore: Charting The Future,2020-09-29
A three-pronged plan to secure Singapore’s role in SE Asia,2020-09-29
Singapore weathers year of transition for politics and business,2020-09-29
BoE ‘mixed messages’ keep everyone guessing on negative rates,2020-09-29
Coronavirus global death toll passes 1m mark,2020-09-29
UK mortgage approvals soar to 13-year high in August,2020-09-29
How likely is a US-Taiwan trade deal?,2020-09-29
FirstFT: Today’s top stories,2020-09-29
Further reading,2020-09-29
Food industry warns on post-Brexit trade with N Ireland ,2020-09-28
Travel restriction fears hit London bankers’ EU relocation plans,2020-09-28
EU and UK dig in over Johnson’s internal market bill,2020-09-28
US conducts semi trade war,2020-09-28
"Eurozone deflation will persist in coming months, Lagarde warns",2020-09-28
BoE deputy governor opposes negative interest rates,2020-09-28
Cockamamie TikTok deal fails on every measure,2020-09-28
SMIC: wrong bargaining chip,2020-09-28
Biden presidency won’t be a quick fix for EU-US trade tensions,2020-09-28
FirstFT: Today’s top stories,2020-09-28
Stranded crews pose a risk to supply chains,2020-09-28
Shares in China’s top chipmaker SMIC fall after US blacklisting,2020-09-28
Emerging economies tap debt markets but risks pile up ahead,2020-09-28
The new gold rush: western investors offset soft eastern demand  ,2020-09-28
Argentina bonds ‘back in hot water’ just weeks after restructuring deal  ,2020-09-28
Brexit red tape set to create weeks of delay for patients awaiting drugs,2020-09-28
US dollar remains world’s currency of choice despite slide,2020-09-28
US-China tensions put Kioxia’s $3.2bn IPO on ice,2020-09-28
Judge blocks Trump’s app store ban on TikTok ,2020-09-28
In charts: Singapore’s trade,2020-09-27
Singapore charts its way to digital future for trade,2020-09-27
A business graduate’s race to trace PPE in the pandemic,2020-09-27
Brexit teams race against clock as trade talks enter final straight,2020-09-27
"Trump vs Biden, Brexit talks, US labour data ",2020-09-27
Complacent insiders sow the seeds of their own demise ,2020-09-27
"EU companies warned of 700,000 job losses in no-deal Brexit",2020-09-27
China’s biggest chipmaker SMIC hit by US sanctions,2020-09-27
EU recovery fund should endure beyond the crisis ,2020-09-27
Will US jobs growth continue to weaken?,2020-09-27
"After the revolution, Sudan battles ‘disastrous’ economy",2020-09-27
Europeans return to workplace but reduce leisure activity,2020-09-27
"Boohoo has ‘significant issues’ in its supply chain, review finds",2020-09-25
Why investors should be troubled by two French corporate dramas,2020-09-25
FirstFT: Today’s top stories,2020-09-25
France rejects UK ‘intimidation’ on post-Brexit deal,2020-09-25
Why loneliness fuels populism,2020-09-25
The next financial crisis may be coming soon,2020-09-24
Why EU’s big plans for supply chain resilience are unlikely to be big enough,2020-09-24
An African at the WTO’s helm would fit its free trade instincts,2020-09-24
FirstFT: Today’s top stories,2020-09-24
"Covid-19 has exposed the world’s fragile, complex food supply chains",2020-09-24
Strategic indecisiveness is fatal in a pandemic,2020-09-24
Switzerland ready to hold down franc with sharper interventions,2020-09-24
How the pandemic deepened the poverty pit,2020-09-24
US warns Turkey over failure to pay foreign healthcare debts,2020-09-23
Avoiding post-Brexit chaos on the UK border,2020-09-23
Pandemic knocks a tenth off incomes of workers worldwide,2020-09-23
UK risks losing top trade prize if it ignores US feeling on Ireland,2020-09-23
FirstFT: Today’s top stories,2020-09-23
UK business activity growth slows as new Covid-19 restrictions take effect,2020-09-23
ECB calls on Brussels to make recovery fund permanent,2020-09-23
Wirecard’s deceit went beyond its fraudulent Asian operations ,2020-09-23
China is escalating its punishment diplomacy,2020-09-23
China has the upper hand in corporate proxy wars with US,2020-09-22
Confidence rises among Europe’s cash-rich consumers,2020-09-22
Brussels renews legal threat over UK internal market bill,2020-09-22
"Biden will end ‘artificial trade war’ with EU, adviser says",2020-09-22
First TikTok then gaming as a crucible of US-China rivalry,2020-09-22
ECB faces uphill struggle in efforts to talk down the euro,2020-09-22
Why US-Kenya trade deal matters for world’s poorest continent,2020-09-22
FirstFT: Today’s top stories,2020-09-22
Virus prompts rethink of developing economies’ urban planning,2020-09-22
What Trump’s TikTok deal learnt from China’s approach to apps,2020-09-22
We must put our greenbacks behind our green rhetoric,2020-09-22
Investors are getting pickier in emerging markets,2020-09-22
Lawyers offer Johnson help to break state aid impasse in EU talks,2020-09-21
Global stocks sink on fears of new Covid lockdowns,2020-09-21
"European banks load up on government bonds, raising concerns over ‘doom loop’",2020-09-21
"Seconds out, round two at the World Trade Organization",2020-09-21
Beware the long arms of American and Chinese law,2020-09-21
FirstFT: Today’s top stories,2020-09-21
Should we bring it home?,2020-09-21
"China’s pork reserves running out as prices soar, analysts say",2020-09-21
It’s time to end the male monopoly in international trade | Free to read,2020-09-21
China’s export machine comes roaring back to life,2020-09-20
Expect long-term economic scarring from Covid-19,2020-09-20
ECB to review flagship bond-buying tool in fighting Covid crisis,2020-09-20
Argentina’s economic woes send companies fleeing,2020-09-20
"Covid restrictions, Labour party conference, flash PMIs",2020-09-20
Stephan Crétier: the security boss with his eyes on the G4S prize,2020-09-18
Tech stocks drag Wall Street lower to end volatile week ,2020-09-18
Brussels rejects Johnson’s changes to internal market bill,2020-09-18
Trump’s TikTok dance: the politicisation of American business,2020-09-18
UK’s Liam Fox and Saudis gain toehold in race for WTO top job,2020-09-18
FirstFT: Today’s top stories,2020-09-18
China’s assertiveness is against its economic interests,2020-09-18
Why China’s recovery is not what it seems,2020-09-18
UK retail sales rise for fourth consecutive month ,2020-09-18
Forced labour is the price of a cheap cotton T-shirt ,2020-09-18
Fed mulls extension of bank dividend and buyback curbs,2020-09-17
ByteDance proposes US IPO for TikTok to woo White House,2020-09-17
Global equities slip after Fed comes up short on QE plans,2020-09-17
Von der Leyen ‘convinced’ EU-UK trade deal is still possible,2020-09-17
Support people rather than jobs for a more resilient post-Covid economy,2020-09-17
Bank of England warns coronavirus resurgence threatens UK economic recovery,2020-09-17
Rare earths and a decade of failure to diversify,2020-09-17
FirstFT: Today’s top stories,2020-09-17
Covid crisis has accelerated big trends in China’s favour,2020-09-17
EU poised to rebuff UK’s market access push for electric cars,2020-09-17
There is no trade-off between quality and quantity of jobs,2020-09-17
Trump flags concerns about Oracle-TikTok deal ,2020-09-17
China-US investment falls to lowest in almost a decade,2020-09-17
Diverging fortunes for Europe’s two-speed economy,2020-09-17
Coronavirus and globalisation: the surprising resilience of container shipping,2020-09-17
Fed fleshes out new monetary policy — to mixed reviews,2020-09-17
Fed signals rock-bottom rates until at least end of 2023 ,2020-09-17
Why Germany should be wary of a catch-all car industry bailout ,2020-09-17
Equity investors should raise a glass to low rates,2020-09-17
BoE to play for time as darker clouds loom over UK economy,2020-09-17
Wall Street stocks slip even as Fed promises low rates,2020-09-16
US retail sales slowdown points to effect of stimulus withdrawal ,2020-09-16
World Bank piles pressure on private creditors for EM debt relief ,2020-09-16
"Beijing unlikely to block ByteDance deal with Oracle, say experts",2020-09-16
FirstFT: Today’s top stories,2020-09-16
WTO ruling on China tariffs sparks anger in Washington,2020-09-16
South Africa must break ANC taboos to lift growth ,2020-09-16
OECD calls for change of tack on state support during pandemic,2020-09-16
Dine-out scheme helped drive sharp fall in UK inflation,2020-09-16
Five things to watch at the Federal Reserve meeting,2020-09-16
Ditch the zombies and embrace the entrepreneurs,2020-09-16
US stocks rise on signs of global economic recovery,2020-09-15
WTO rules US tariffs on Chinese imports broke global trade rules,2020-09-15
When lawmakers approve lawbreaking,2020-09-15
Chinese exports benefit from west’s Covid stimulus response,2020-09-15
FirstFT: Today’s top stories,2020-09-15
Coronavirus risks critical blow to Argentina’s ailing economy,2020-09-15
Chinese retail sales grow for first time since coronavirus outbreak,2020-09-15
Economists warn of US ‘wasteland’ without stimulus deal,2020-09-15
Asian developing economies set to shrink for first time in six decades,2020-09-15
Trump administration to review Oracle’s TikTok deal this week,2020-09-14
Arm deal is drawing UK into damaging US-China tech war         ,2020-09-14
Reunified Pakistani Taliban threatens China’s Belt and Road project,2020-09-14
FirstFT: Today’s top stories,2020-09-14
Brexit Britain in a preferential tangle,2020-09-14
Fed urged to back up new dovish policy with action,2020-09-14
Revenue raising divides EU governments ,2020-09-14
US-China trade war threatens passive investors,2020-09-14
Johnson faces mounting resistance to Brexit move,2020-09-13
"Fed, BoE and Japan meet, biggest week for IPOs since Uber",2020-09-13
Japan trade deal commits UK to stricter state aid curbs than in EU talks,2020-09-13
UK-Japan trade deal shows need for EU pact,2020-09-13
The next subprime crisis could be in food,2020-09-13
China bans pork imports from Germany,2020-09-13
"Covid-era experience vital for leading WTO, says Korean candidate ",2020-09-13
Coronavirus latest: US coronavirus cases rise by the most in a week,2020-09-11
Johnson was given warnings on effect of Irish protocol ,2020-09-11
US inflation ticks higher but with scant sign of reaching Fed goal,2020-09-11
Is China the closest thing to investing normality now? ,2020-09-11
State aid is the wrong Brexit hill to die on,2020-09-11
UK strikes ‘historic’ trade deal with Japan,2020-09-11
FirstFT: Today’s top stories,2020-09-11
UK economy grows 6.6% in July as coronavirus restrictions eased,2020-09-11
Why be a hero? Sell ’em all,2020-09-11
Senate Republicans fail to pass economic stimulus bill,2020-09-10
Boris Johnson’s government is right to protect integrity of UK,2020-09-10
Johnson’s lawbreaking Brexit plan leaves trade talks in balance ,2020-09-10
Time to kill the US trade deficit delusion,2020-09-10
FirstFT: Today’s top stories,2020-09-10
How to get a Brexit deal (if the UK wants one),2020-09-10
Euro strength raises ECB alarms ,2020-09-10
Central banks will win the tug of war in markets ,2020-09-10
Johnson under fire over plans to reshape Brexit deal ,2020-09-09
UK will not finalise state aid plan until 2021,2020-09-09
US companies defy Trump’s threats about ‘decoupling’ from China ,2020-09-09
Could there be an unlikely Lighthizer-Biden alliance on US trade?,2020-09-09
FirstFT: Today’s top stories,2020-09-09
Further reading,2020-09-09
French trade minister warns UK on Brexit level playing field,2020-09-09
EV supply chains seek clearer visibility with blockchain,2020-09-09
Start-ups in Austria risk falling behind European rivals,2020-09-09
China’s Middle East strategy comes at a cost to the US,2020-09-09
Huawei says Japan ‘extremely important’ after 50% rise in procurement,2020-09-08
Why Boris Johnson is considering a no-deal Brexit for a bruised economy,2020-09-08
Global trade rebound fuels rise in German and French exports,2020-09-08
The corporate zombies stalking Europe,2020-09-08
We need a new asset class of healthy soils and pollinators,2020-09-08
Cheese drives a wedge between UK and Japan in trade talks,2020-09-08
FirstFT: Today’s top stories,2020-09-08
Valdis Dombrovskis chosen as EU’s trade chief ,2020-09-08
China offers Taliban road network in exchange for peace,2020-09-08
Bank battle stirs tensions between European capitals,2020-09-08
Food inflation threatens lives and economic recovery,2020-09-08
Trump raises prospect of ‘decoupling’ US economy from China,2020-09-07
The perils of Britain’s Brexit brinkmanship,2020-09-07
UK bid to circumvent Brexit deal risks far-reaching consequences,2020-09-07
Luis Alberto Moreno: next Latin American decade need not be a bust,2020-09-07
Robert Lighthizer’s big ideas for the WTO,2020-09-07
FirstFT: Today’s top stories,2020-09-07
SMIC shares tumble after reports US will blacklist Chinese chipmaker,2020-09-07
Chinese exports beat expectations with 9.5% jump in August,2020-09-07
European parliament frets as clock ticks down EU-UK trade talks ,2020-09-07
"Cost risks of hosting Olympics similar to natural disasters, study warns",2020-09-07
"China wants to decouple from US tech, too",2020-09-06
"Brexit talks, ECB meeting, Japan leadership race",2020-09-06
Hopes of US stimulus deal fade after strong jobs report,2020-09-06
ECB should ignore latest central bank inflation fad,2020-09-06
France set to close GDP gap on Germany with public sector rebound,2020-09-06
The Fed risks higher inflation to boost jobs,2020-09-06
Covid-19 curbs ‘not worth economic pain’ for low-income countries,2020-09-06
Will the ECB’s Lagarde try to talk down the euro?,2020-09-06
Daimler rules out expanding production in Germany,2020-09-06
Covid-19 restrictions threaten shipping lanes and crew ,2020-09-06
"Assar Lindbeck, economist, 1930-2020",2020-09-05
US unemployment rate drops to 8.4% as labour market rebounds further,2020-09-04
Brussels trade role up for grabs as Ireland puts forward EU candidates,2020-09-04
US and Taiwan to work on reshaping supply chains away from China,2020-09-04
"UK’s economic recovery unlikely to last, BoE rate setters warn",2020-09-04
FirstFT: Today’s top stories,2020-09-04
The Fed’s quest for higher inflation looks doomed without Congress,2020-09-04
Fed official warns partisan politics ‘endangers’ US recovery,2020-09-03
US trade deficit swells in July to highest level since 2008 ,2020-09-03
A plan to revive France and Emmanuel Macron’s fortunes,2020-09-03
Brussels’ challenge to fill ‘Big Phil’ Hogan’s big shoes,2020-09-03
UK businesses slash investment as coronavirus crisis bites ,2020-09-03
Eurozone retail sales run out of steam as north-south split emerges,2020-09-03
Déjà vu as Brexit talks hit deadlock,2020-09-03
FirstFT: Today’s top stories,2020-09-03
The Fed abandons the idea low unemployment stokes inflation,2020-09-03
How to be a dove,2020-09-03
Rising euro stokes ECB worries over falling prices,2020-09-03
Macron’s revival plan ,2020-09-03
Only a level playing field will end Europe’s metals malaise  ,2020-09-03
"Strong euro woes, DHL on Vaccine access, KKR eyes Japan",2020-09-03
Bundesbank chief calls for scaling-back of crisis aid,2020-09-02
"Europe’s ‘zombie’ recovery will fall behind US, Deutsche Bank warns",2020-09-02
FirstFT: Today’s top stories,2020-09-02
Phil Hogan’s departure leaves EU/US trade relations in doubt,2020-09-02
Further reading,2020-09-02
Covid-19 ends Australia’s 28-year run without a recession,2020-09-02
Equity bulls spur IPO markets into action,2020-09-02
How western democracies can help Taiwan,2020-09-01
Eurozone slides into deflation for the first time in four years,2020-09-01
German government bullish on prospect of economic rebound ,2020-09-01
Coronavirus tips Brazil into recession ,2020-09-01
UK mortgage approvals jump as consumers resume spending,2020-09-01
FirstFT: Today’s top stories,2020-09-01
Medical equipment boost for Chinese exports could be shortlived,2020-09-01
Why Trump no longer talks about the trade deficit with China,2020-09-01
FT 1000: Europe’s Fastest Growing Companies 2020,2020-09-01
Argentina clinches near-unanimous backing for debt restructuring,2020-08-31
India’s economy contracts 24% during coronavirus lockdown,2020-08-31
What China’s new export rules mean for TikTok’s US sale,2020-08-31
Turkey’s economy suffers historic contraction in second quarter,2020-08-31
ECB must follow the Fed’s embrace of a second mandate,2020-08-31
Shinzo Abe and his struggle with Xi Jinping,2020-08-31
FirstFT: Today’s top stories,2020-08-31
Trump ban on Chinese drone parts risks worsening wildfires,2020-08-31
Domestic demand drives China's post-pandemic recovery,2020-08-31
Global economy unlikely to benefit from falling dollar,2020-08-31
Tata: transforming a conglomerate for India and the world ,2020-08-31
Bond investors cast doubt on Fed’s power to push up inflation,2020-08-31
Only a shift in labour’s bargaining power can light up US inflation,2020-08-31
"Dynamism, by Edmund Phelps",2020-08-31
