title,date
Coronavirus: Italy bars fans from sporting events - as it happened,2020-03-04
Bonds and equities paint a contrasting picture,2020-03-04
IMF sets aside $50bn for coronavirus-hit countries,2020-03-04
"US companies tell Fed coronavirus has hit manufacturing, tourism",2020-03-04
Regulatory equivalence with EU could risk US deal,2020-03-04
What bond markets tell us about Lagarde’s next move,2020-03-04
US services sector bucks coronavirus fears to hit one-year high,2020-03-04
Bank of Canada cuts interest rates in face of coronavirus,2020-03-04
UK seeks to convince EU to talk financial services,2020-03-04
Coronavirus leads to sharp fall in China’s emissions,2020-03-04
UK business activity improves before potential coronavirus hit,2020-03-04
Will the US roll back China tariffs if the coronavirus crisis grows?,2020-03-04
Fed’s coronavirus cut is first move in dance with markets,2020-03-04
Coronavirus damps Indian hopes of economic upturn,2020-03-04
"Latin America must curb inequality, IADB chief warns",2020-03-04
Further reading,2020-03-04
Coronavirus brings global shipping to brink of paralysis,2020-03-04
The seeds of the next debt crisis,2020-03-04
H&M opens up global supply chain to rivals in green push,2020-03-04
Fed cut piles pressure on Lagarde to take action,2020-03-04
New data paint grim picture of coronavirus fallout,2020-03-04
Coronavirus raises risk of trouble in corporate bonds,2020-03-04
Virus exposes cracks in south-east Asia economies ,2020-03-04
China’s stranded workers drag down coronavirus-hit economy,2020-03-04
Coronavirus: World Bank to provide $12bn to boost virus response — as it happened,2020-03-03
World Bank to provide up to $12bn to boost countries’ virus response,2020-03-03
FOMC member Mester cuts US forecasts on coronavirus impact,2020-03-03
Fed rate cut is no cure-all for coronavirus woes,2020-03-03
Fed cuts rates a half-percentage point in face of coronavirus ,2020-03-03
"Powell: cut no panacea, but will boost confidence",2020-03-03
Fed rate cut sends strong coronavirus signal,2020-03-03
Globalisation spreads contagion of many kinds,2020-03-03
There is green gold in re-shoring rubbish,2020-03-03
Finance ministers ‘ready to take action’ on coronavirus,2020-03-03
Waiting for the golden age of Brexit trade deals,2020-03-03
Rice prices show coronavirus is hurting North Korea,2020-03-03
FirstFT: Today’s top stories ,2020-03-03
Coronavirus delays PC and smartphone shipments for weeks,2020-03-03
Currency sell-off threatens emerging market response to coronavirus,2020-03-03
ECB ready to take ‘appropriate and targeted measures’,2020-03-02
OECD warns coronavirus could halve global growth,2020-03-02
Wall Street closes sharply higher on hopes of central bank action,2020-03-02
US trade deal to boost UK economy 0.16% over 15 years,2020-03-02
US places new restrictions on Chinese journalists,2020-03-02
Harley-Davidson: running on empty,2020-03-02
Coronavirus calls for more global co-operation,2020-03-02
US factory rebound cools as coronavirus hits supply chains,2020-03-02
Hardening UK language leaves EU perplexed,2020-03-02
US supply chains and ports under strain from coronavirus,2020-03-02
The whistle blows and the big EU-UK match gets under way,2020-03-02
Extraordinary complacency: the coronavirus and emerging markets ,2020-03-02
US election may turn on voters’ view of inequality,2020-03-02
Italy manufacturing adds to gloom as recession fears mount,2020-03-02
New orders help rise in February factory activity,2020-03-02
How big a risk is a wave of sovereign defaults? ,2020-03-02
Further reading,2020-03-02
BoJ spurs Asia markets rebound with vow to fight coronavirus,2020-03-02
Shipping costs provide clues on coronavirus impact,2020-03-02
Britain to set out mandate for post-Brexit US deal,2020-03-01
"Week ahead: Super Tuesday, US jobs, Opec meeting",2020-03-01
There is a landing zone for a UK-EU trade deal,2020-03-01
"UK-EU talks, Super Tuesday, Israel elections, Opec meeting",2020-03-01
Calls for policymakers to act to prevent ‘doom loop’,2020-03-01
Fed should not try to fight the coronavirus,2020-03-01
Xinjiang forced labour reported in multinational supply chains,2020-03-01
Corporate margins are going to be squeezed,2020-03-01
Italy unveils €3.6bn stimulus to tackle coronavirus,2020-03-01
The UK’s threat to walk out of EU trade talks is real,2020-03-01
European companies warned over lack of Brexit planning,2020-03-01
Ireland’s central banker rejects homes spending spree,2020-03-01
What can macro policymakers do about coronavirus?,2020-03-01
Coronavirus unmasks vulnerability of bull run,2020-03-01
What will ‘Super Tuesday’ mean for US investors?,2020-03-01
China factory index hits record low on coronavirus,2020-02-29
Waiting for a receding tide to turn,2020-02-28
Coronavirus prompts crisis for travel industry,2020-02-28
Coronavirus: how the outbreak is changing global politics,2020-02-28
How the coronavirus shattered market complacency,2020-02-28
Buying the coronavirus dip would be bold indeed,2020-02-28
France warns UK over ‘artificial’ Brexit deadlines,2020-02-28
German inflation and jobless figures boost eurozone,2020-02-28
FT Future Forum,2020-02-28
How to navigate the US-China trade war,2020-02-28
"The political, ideological and commercial logic of Brexit",2020-02-28
"Introducing, Markets Live(ish)",2020-02-28
FirstFT: Today’s top stories ,2020-02-28
World must wake up to challenge of longer lifespans,2020-02-28
Mark Carney warns coronavirus will hit the UK economy,2020-02-28
Turkish economic growth accelerates in fourth quarter,2020-02-28
Coronavirus: Doubts cast on Fed’s ability to handle a pandemic,2020-02-28
China issues record number of force majeure certificates,2020-02-28
"Snap AV: S&P slump  fastest correction ever, says Deutsche ",2020-02-27
"Border red tape will mean 50,000 new form-fillers after Brexit",2020-02-27
Johnson to threaten to walk away from Brexit trade talks,2020-02-27
EU-UK trade talks: four key battle lines,2020-02-27
Lagarde says virus yet to cause ‘long-lasting shock’,2020-02-27
Underlying gauge of business investment bounces back in January,2020-02-27
UK-EU: a question of trust,2020-02-27
President Sanders and President Trump: how similar on trade?,2020-02-27
FirstFT: Today’s top stories ,2020-02-27
Coronavirus and market falls: why the arithmetic doesn’t make sense,2020-02-27
Markets shake-out spurs bets on interest rate cuts,2020-02-27
Don’t fret about the big build-up in emerging market debt,2020-02-27
Coronavirus/tech stocks: issue warning ,2020-02-27
"Prepare for pain, hope for relief",2020-02-26
German finance minister eyes plan to ease strict ‘debt brake’,2020-02-26
Johnson goes back on trade deal pledges to Brussels,2020-02-26
Serco: rocket man,2020-02-26
WHO must learn from the IMF to stop pandemics ,2020-02-26
European companies face coronavirus hit to supply chains,2020-02-26
The highest hurdle to a UK-EU trade deal,2020-02-26
EU hopes to whet Trump’s appetite with market access offer,2020-02-26
Hong Kong offers cash handouts to ease coronavirus impact,2020-02-26
EU trade chief says US ‘mini deal’ is within reach,2020-02-26
Nouriel Roubini: Markets are too complacent about virus,2020-02-26
Why coronavirus is pushing up ginger and garlic prices,2020-02-26
Asia can overtake the west in sustainable investing,2020-02-26
Coronavirus opens new front in Hong Kong-Singapore rivalry,2020-02-26
In no mood for catching a falling knife,2020-02-25
Barnier irritated by UK stance ahead of trade talks,2020-02-25
UK-EU trade talks: the problems — and potential solutions,2020-02-25
Global goods trade rose as US-China tensions eased,2020-02-25
David Davis: France wedded to ‘lunatic mythology’,2020-02-25
Mexico’s economy shrank in fourth quarter of 2019,2020-02-25
Coronavirus: the economic risk of overreaction,2020-02-25
Piketty’s ‘Capital and Ideology’: scholarship without solutions,2020-02-25
Markets must listen to central bankers’ green conversion,2020-02-25
Fed policymaker says more evidence needed for rate cut,2020-02-24
UK lays down red line for Brexit trade talks,2020-02-24
US 10-year Treasury yield nears record low,2020-02-24
Trump presses Modi to bolster US ties amid trade frictions,2020-02-24
Coronavirus/drugmakers: nil pill,2020-02-24
Why lawyers and architects could be losers in UK-EU trade deal,2020-02-24
Coronavirus deals fresh blow to Italy’s struggling economy,2020-02-24
The US needs a coherent policy on Africa,2020-02-24
Snap AV: Singapore’s sinking air cargo,2020-02-24
Further reading,2020-02-24
Is Europe over (central)banked? ,2020-02-24
Global inventories at 7-year low prior to coronavirus hit ,2020-02-24
Coronavirus outbreak causes supply problem for India’s drugmakers,2020-02-24
Coronavirus: Chinese carmakers struggle with disruption,2020-02-24
The Chinese super-regulator taking on the coronavirus,2020-02-24
"Week ahead: South Carolina primary, coronavirus, Trump in India",2020-02-23
"Trump visits India, Assange extradition, South Africa budget",2020-02-23
EU set for final push to toughen post-Brexit trade stance,2020-02-23
Chinese carmakers accelerate drive into India,2020-02-23
Coronavirus is speeding up decoupling,2020-02-23
US: don’t give China control of intellectual property group   ,2020-02-23
Rishi Sunak’s fiscal expansion is long overdue,2020-02-23
EU looks to toughen position ahead of UK trade talks,2020-02-23
Rishi Sunak should abandon arbitrary fiscal rules,2020-02-22
It is too much to hope for a big bounce in EM,2020-02-22
Virus fears push yields on long-dated US Treasuries to new low,2020-02-21
The virus crisis and the decoupling of global trade,2020-02-21
Fed governor backs temporarily higher inflation target,2020-02-21
UK manufacturers feel heat as EU trade battles loom,2020-02-21
Deere profits boosted by relaxation of US-China trade spat,2020-02-21
FirstFT: Today’s top stories,2020-02-21
Eurozone’s manufacturing slump eases despite coronavirus ,2020-02-21
The under appreciated importance of non-woven markets,2020-02-21
Government bonds rally as concerns drip back into market,2020-02-21
Pinn’s illustration of the week: Supply and demand,2020-02-21
Economists should learn lessons from meteorologists,2020-02-21
ECB tone upbeat on eurozone growth before coronavirus struck,2020-02-20
EU and UK have lost any shared vision of their future,2020-02-20
Four ideas for IMF head Kristalina Georgieva,2020-02-20
FirstFT: Today’s top stories ,2020-02-20
Why no one knows the source of every car part — and why it matters,2020-02-20
How to agree an EU budget on time,2020-02-20
Coronavirus: Apple supplier Foxconn warns over revenue hit,2020-02-20
Why Sweden ditched its negative rate experiment,2020-02-20
Chinese government bond yields hit four-year low,2020-02-20
PBoC will help China recover quickly from coronavirus,2020-02-20
IMF to Argentina’s creditors: you must share the pain,2020-02-19
Boeing asks to give up tax break to avert EU tariffs,2020-02-19
Fed sees ‘more favourable’ US economic outlook,2020-02-19
Brussels and UK trade accusations ahead of Brexit talks,2020-02-19
Turkey lowers borrowing costs again in push to reboot growth,2020-02-19
Why is UK arguing about a matter that is already agreed?,2020-02-19
How a Democrat might worsen the US-China feud,2020-02-19
Can Trump and Modi reach a mini-trade deal?,2020-02-19
FirstFT: Today’s top stories,2020-02-19
Boeing’s small suppliers plagued by uncertainty over 737 Max,2020-02-19
EU to seek UK promise on illegal trade in historical objects,2020-02-18
Apple’s coronavirus sales warning hits global stocks,2020-02-18
EU nations prepare tougher conditions on Brexit trade talks,2020-02-18
Singapore’s empty airport highlights coronavirus impact on Asia,2020-02-18
The World Bank paper at the centre of a controversy,2020-02-18
Japan’s problem is not enough Abenomics,2020-02-18
Coronavirus impact causes sentiment to darken in Germany,2020-02-18
Wage growth slows despite robust labour market,2020-02-18
South Korea warns of economic ‘emergency’ from coronavirus,2020-02-18
IMF chief: we are rethinking our advice to emerging markets,2020-02-18
Coronavirus gives China get-out clause for buying US energy,2020-02-18
Hunt for yield makes havens of Italy and Greece,2020-02-18
Germany’s minimum wage boosted productivity but hit small companies,2020-02-18
Coronavirus forces Apple to warn over iPhone sales,2020-02-17
UK Brexit chief rejects EU’s ‘level playing field’,2020-02-17
How to rewrite the rules for UK public finances,2020-02-17
Global stocks rally on stimulus hopes,2020-02-17
Sabres rattled as EU-UK trade talks loom,2020-02-17
FirstFT: Today’s top stories ,2020-02-17
Argentina needs a plan for investment-led growth,2020-02-17
"Inside the IMF’s outrageous, improbably successful Jamaican programme (Pt. 2)",2020-02-17
Samsung flies phone parts to Vietnam after coronavirus hits supply chain,2020-02-17
Central banks’ influence on economies is diminishing,2020-02-17
Why corporate schmoozing will survive coronavirus,2020-02-17
"Japan on course for technical recession, economists warn",2020-02-17
"Week ahead: Fed minutes, Iran election, EU budget",2020-02-16
"Iran elections, Saudi Arabia G20 summit, coronavirus",2020-02-16
French minister warns UK-EU will ‘rip each other apart’,2020-02-16
A crossover of fiscal and monetary policy,2020-02-16
Indian IT industry head accuses US of discrimination over worker visas,2020-02-16
Chinese developers hit by coronavirus sales ban,2020-02-16
Trump to raise tariffs on European aircraft imports,2020-02-15
China: an economy in quarantine,2020-02-14
"Inside the IMF’s outrageous, improbably successful Jamaican programme (Pt. 1)",2020-02-14
"US industrial production falls on warm weather, Boeing woes",2020-02-14
Eurozone economy suffers slowest growth in 7 years,2020-02-14
US retail sales edge upwards in January,2020-02-14
FirstFT: Today’s top stories ,2020-02-14
"More: The 10,000-Year Rise of the World Economy",2020-02-14
Me and Roger Stone,2020-02-14
Eurozone weakness is a test for post-crisis policy,2020-02-14
On CBDCs and sorcerers ,2020-02-14
Mexico’s central bank cuts interest rates to three-year low,2020-02-13
JCB to cut UK production as virus hits supply chain,2020-02-13
Coronavirus set to knock oil demand growth to slowest since 2011,2020-02-13
Boris Johnson’s promise to ‘level up’ hard to keep,2020-02-13
Global shipping market reels from coronavirus,2020-02-13
FirstFT: Today’s top stories ,2020-02-13
The EU’s battle against China subsidies is being played out in Egypt,2020-02-13
The bigger lessons of the coronavirus shock,2020-02-13
John Major warns rushed UK-EU trade deal will be ‘flimsy’,2020-02-13
Fed’s Daly says US job market still has room to run,2020-02-12
Macron presses on with pension reform despite political cost,2020-02-12
US trade adviser seeks to replace Chinese drug supplies,2020-02-12
FirstFT: Today’s top stories,2020-02-12
Eurozone outlook dented by industrial output drop,2020-02-12
Coronavirus sparks US concern over medical supplies,2020-02-12
China leads dramatic pan-Asian wealth surge,2020-02-12
Drugmakers braced for coronavirus disruption to supplies,2020-02-12
Do Europe’s champions need help in 5G tech battle?,2020-02-12
Coronavirus sends ripples through global economy,2020-02-12
Argentina seeks IMF and congress support for debt plan,2020-02-12
Trump official emerges as IMF deputy replacement,2020-02-12
Fed ‘closely monitoring’ coronavirus outbreak: Powell,2020-02-11
Britain could seal Asian trade deal by adopting a fresh attitude to palm oil ,2020-02-11
Mastercard wins approval to enter Chinese payments market,2020-02-11
Thomas Piketty: why we need a radical new wealth tax,2020-02-11
FirstFT: Today’s top stories,2020-02-11
Why traditional freeports won’t work in the UK,2020-02-11
UK economy stagnates in final quarter of 2019,2020-02-11
Coronavirus threatens Australia’s record growth run,2020-02-11
Coronavirus: WHO warns of ‘concerning’ transmissions in Europe — as it happened,2020-02-10
"Prepare for Brexit trade costs and red tape, says Gove",2020-02-10
US charges Chinese military officers over Equifax hack,2020-02-10
World economy/stocks: Piketty is right,2020-02-10
Coronavirus/food stocks: theme pork,2020-02-10
China struggles to return to work after coronavirus shutdown,2020-02-10
FirstFT: Today’s top stories ,2020-02-10
Britain needs to work out its priorities in trade negotiations,2020-02-10
Where to find the value in emerging markets,2020-02-10
Salmon farmers fear being caught in Brexit net,2020-02-10
Further reading,2020-02-10
"Joseph Stiglitz, ‘Rewriting the Rules of the European Economy’",2020-02-10
The threats to energy security have changed,2020-02-10
"Democracy is under threat, we must add a D to ESG",2020-02-10
Alibaba leads Chinese retreat from Silicon Valley,2020-02-10
"Week ahead: Powell, earnings, New Hampshire primary",2020-02-09
"New Hampshire primary, coronavirus, UK cabinet reshuffle",2020-02-09
Cambodia faces losing EU trade preferences,2020-02-09
America’s go-it-alone economy,2020-02-09
Britain and EU are negotiating at cross purposes,2020-02-09
The Fed’s new inflation regime,2020-02-09
"Spain will consult business on labour law, says economy chief",2020-02-09
US stocks post best week since June in global rebound,2020-02-07
IMF’s David Lipton to step down after nine-year tenure,2020-02-07
Australian dollar hits lowest level in nearly 11 years,2020-02-07
Coronavirus outbreak weighs heavily on global economy,2020-02-07
FirstFT: Today’s top stories ,2020-02-07
Chinese copper traders declare force majeure,2020-02-07
Serbia’s embrace of Chinese FDI raises questions of transparency,2020-02-07
US to begin trade talks with Kenya,2020-02-06
Trade minister vows to drive hard bargain with US,2020-02-06
Global shares rally after China pledges tariff cuts on US goods,2020-02-06
Fiat Chrysler warns coronavirus might shut European plant,2020-02-06
FirstFT: Today’s top stories ,2020-02-06
Trade deals are an awkward tool to improve human rights,2020-02-06
White men most likely to feel better off under Trump — poll,2020-02-06
We have seen this Brexit movie before,2020-02-06
West Africa needs to be prudent after CFA franc,2020-02-06
Philippine central bank cuts rates in response to coronavirus,2020-02-06
How Japan has coped with Japanification,2020-02-06
Coronavirus casts a shadow over markets ,2020-02-06
The Fed is not doing QE. Here’s why that matters,2020-02-06
Climbing back to the peaks,2020-02-05
US trade deficit shrinks for first time in six years,2020-02-05
Coronavirus shakes centre of global tech supply chain,2020-02-05
Coronavirus: will the US show leniency to China over trade?,2020-02-05
FirstFT: Today’s top stories,2020-02-05
Restructuring Argentina’s debt will require IMF support,2020-02-05
Private sector rises at fastest rate since September 2018,2020-02-05
Trade is Not a Four-Letter Word — pros and cons of globalisation,2020-02-05
Spain’s central bank urges Madrid to stick with labour reform,2020-02-05
Dollarisation would not save Argentina,2020-02-05
"Central banks ‘hesitant’ on digital currencies, says ex-governor",2020-02-05
Investors need to position for a clash of civilisations,2020-02-05
Poll reveals public distrust for big tech’s digital money plans,2020-02-05
EU and US carmakers warn over China parts shortage,2020-02-04
Coronavirus may delay China purchase of US goods,2020-02-04
The UK is about to shoot itself in both feet,2020-02-04
Deal or no deal?,2020-02-04
FirstFT: Today’s top stories,2020-02-04
Russia faces economic hit after shutting border with China,2020-02-04
Trump to tout blue-collar boom in State of the Union,2020-02-04
Decline in UK construction activity slows in January,2020-02-04
What the other side of the coin tells us about local economies,2020-02-04
Interdependence is a double-edged sword for the US and China,2020-02-04
Johnson’s trade vision hits familiar sticking points,2020-02-04
Global junk bond issuance hits monthly record,2020-02-04
Wall Street boosted by US manufacturing and China stimulus,2020-02-03
Javid’s surplus goal at risk as coffers face £12bn black hole,2020-02-03
Johnson ready to spurn EU deal over rule-setting,2020-02-03
Goldman warns coronavirus to dent 2020 global economic growth,2020-02-03
Coronavirus/China stocks: supply chain reaction ,2020-02-03
FirstFT: Today’s top stories ,2020-02-03
How to measure the climate impact of business,2020-02-03
Britain’s directionless army of trade negotiators is a problem,2020-02-03
Pound drops after Brexit concerns resurface,2020-02-03
Does the Swamp still matter?,2020-02-03
Coronavirus has put globalisation into reverse,2020-02-03
Coronavirus should snap investors out of ‘buy the dip’,2020-02-03
The challenges facing UK-US trade talks,2020-02-03
UK and EU begin sparring with bruising talks ahead ,2020-02-02
"Week ahead: Iowa caucus, State of the Union, US jobs",2020-02-02
ECB urged to give weight to housing in inflation fight,2020-02-02
"Iowa caucuses, State of the Union address, Brexit, Irish election",2020-02-02
Can Argentina escape a debt default?,2020-02-02
US and Kenya to start talks on ‘model’ trade deal for Africa,2020-02-02
Coronavirus will hit global growth,2020-02-02
Steven Mnuchin is wrong about climate economics,2020-02-02
Johnson to reject regulatory alignment in EU trade talks,2020-02-02
What next for the pound after the UK quits the EU?,2020-02-02
Britain finally breaks away from EU after 47 years,2020-01-31
Closing the book on a testing January,2020-01-31
The buck stops with Johnson now Britain is out of EU,2020-01-31
Coronavirus sends Asian stock markets into a spiral,2020-01-31
S&P 500 wipes out gain for the year on coronavirus fear,2020-01-31
EU warns Britain about the price of Brexit,2020-01-31
FirstFT: Today’s top stories ,2020-01-31
"Talks over global digital tax are back on track, says OECD",2020-01-31
Eurozone grows just 0.1 per cent as France and Italy shrink,2020-01-31
The UK is leaving the EU. Now the hard work begins,2020-01-31
Closure of Russia-China border sparks trade fears,2020-01-31
What will India do to revive its stuttering growth?,2020-01-31
The challenge of thinking a couple of steps ahead,2020-01-30
Gove warns UK business of trade frictions with EU,2020-01-30
US yield curve inversion raises growth concerns,2020-01-30
Bank of England drops its optimism on productivity,2020-01-30
Lebanese banks shed bonds in ‘prisoner’s dilemma’,2020-01-30
"The Fed’s bill-buying is not QE, but it looks shifty",2020-01-30
Diplomats warn over heady vision of future UK-EU relationship,2020-01-30
Coronavirus wreaks havoc on tech supply chain,2020-01-30
Ireland warns no special favours for UK in EU trade talks ,2020-01-30
This will be Africa’s century,2020-01-30
Reasons to worry about our addiction to loose money,2020-01-30
US economy grows at slowest annual pace since 2016,2020-01-30
Eurozone jobless rate slides to 12-year low as sentiment improves,2020-01-30
The UK’s employment and productivity puzzle,2020-01-30
Mexican economy stagnates in fourth quarter,2020-01-30
FirstFT: Today’s top stories ,2020-01-30
Bank of England holds rates but cuts growth forecast,2020-01-30
"Cute timing, as Britain tilts towards Europe over 5G",2020-01-30
The kind of fiscal-monetary co-operation worth having,2020-01-30
Analysts fear the market is hooked on Fed support,2020-01-30
Europe’s Green Deal must reach beyond its borders,2020-01-30
Trump weaponises dollar to put America first,2020-01-30
Trade Secrets: Sanctions,2020-01-30
Trump leans on sanctions to shape foreign policy,2020-01-30
British businesses face disruption if London diverges from EU sanctions,2020-01-30
Companies caught in EU-US sanctions crossfire,2020-01-30
Export controls emerge as yet another lever to curb China’s rise,2020-01-30
Banks adopt AI to manage sanctions and compliance risk,2020-01-30
Investors should get set for tougher macro tools,2020-01-30
Will the Bank of England cut interest rates?,2020-01-30
Coronavirus outbreak hits mining shares after iron ore falls,2020-01-30
UK car output at 10-year low as EU exit fears hit production,2020-01-30
Pompeo urges Britain to rethink Huawei 5G decision,2020-01-29
Shanghai traders brace for return to work after outbreak,2020-01-29
Coronavirus crisis hits global businesses in China,2020-01-29
Federal Reserve stands firm on interest rates,2020-01-29
The Bank of England should hold fire on rates,2020-01-29
Is the UK set for a Brexit bounce?,2020-01-29
European Parliament gives its blessing to Brexit deal,2020-01-29
Trump signs trade deal with Mexico and Canada,2020-01-29
Germany says economic recovery reaches turning point,2020-01-29
Huawei decision highlights dilemmas of surveillance age,2020-01-29
Brexit Britain trapped between superpowers,2020-01-29
Coronavirus/gold: lustrous haven,2020-01-29
Donald Trump makes a grab for US trade power,2020-01-29
Central banks swim against tide on inflation,2020-01-29
EU’s carbon border tax plan is risky but needed,2020-01-29
Growth in ‘south-south’ trade grinds to a halt,2020-01-29
German car sector’s electric awakening to jump start economy,2020-01-29
Checks on Irish Sea trade loom as next flashpoint,2020-01-29
How China is shaking up its interest-rate regime,2020-01-28
"Britain after Brexit will not be alone, but it will be lonelier",2020-01-28
US scotches idea of Wilbur Ross trip to China,2020-01-28
South Korea and Japan: will tensions flare?,2020-01-28
FirstFT: Today’s top stories,2020-01-28
Investors seek clarity from Fed on balance sheet expansion,2020-01-28
Microsoft and Dell donate to fight coronavirus outbreak,2020-01-28
Abe nominates dovish economist to Bank of Japan,2020-01-28
Further reading,2020-01-28
What if economists are all wrong on productivity?,2020-01-28
