title,date
"Coronavirus latest: US one-day death rate jumps back above 1,000",2020-06-05
Trump targets EU and China over US lobster tariffs,2020-06-05
Stocks rally and bonds drop after ‘incredible’ US payroll data,2020-06-05
A 10 million upside surprise  ,2020-06-05
How the jobs report managed to surprise almost everyone,2020-06-05
Small signs of life return to US economy,2020-06-05
"Germany’s €130bn stimulus will boost recovery, says Bundesbank",2020-06-05
Unemployment rate in US falls unexpectedly to 13.3%,2020-06-05
Australia adds national security test to foreign investment rules ,2020-06-05
FirstFT: Today’s top stories,2020-06-05
China’s Belt and Road urged to take green route,2020-06-05
Coronavirus and Logistics,2020-06-05
Trump seeks ways to curb US-listed Chinese companies,2020-06-05
N Ireland business calls for 6-month delay in Brexit trade plan,2020-06-04
"Coronavirus: US one-day death rate back below 1,000 — as it happened",2020-06-04
Eurozone bond prices jump after ECB move,2020-06-04
German stimulus aims to kick-start recovery ‘with a ka-boom’ ,2020-06-04
Merkel leads a bolder eurozone crisis response,2020-06-04
ECB boosts bond-buying stimulus package by €600bn,2020-06-04
UK leaves door open to imports of US chlorine-washed chicken,2020-06-04
Have the US and China passed the point of no return?,2020-06-04
EU could face internal resistance to Chinese takeover rules,2020-06-04
FirstFT: Today’s top stories,2020-06-04
"Pandemic hits black voters’ incomes hardest, FT poll shows",2020-06-04
UK-EU talks trawl for solution in battle over fishing rights,2020-06-04
The case for realistic engagement with China,2020-06-04
ECB ponders pandemic firepower limits,2020-06-04
Three compass points for an EU-China policy,2020-06-04
Airbus veterans called up to rescue aviation supply chain,2020-06-04
Pandemic exposes Europe’s reliance on imports ,2020-06-04
Covid crisis likely to mask economic fallout of no-deal Brexit,2020-06-04
Investors should prepare for a welcome return of inflation,2020-06-04
"Coronavirus: US daily death toll remains above 1,000 — as it happened",2020-06-03
Surfing the endless summer for risk sentiment,2020-06-03
Airlines hit out at UK quarantine measures,2020-06-03
US threatens to bar Chinese airlines,2020-06-03
Unemployment rises in Europe as coronavirus ends labour market recovery,2020-06-03
A divided America cannot compete in a superpower duel,2020-06-03
US digital tax probe raises threat of yet more tariffs ,2020-06-03
FirstFT: Today’s top stories,2020-06-03
Covid-19 ends Australia’s run of record growth  ,2020-06-03
Are we heading into another Depression?,2020-06-03
Zambia feels the way for distressed nations in seeking debt talks ,2020-06-03
Coronavirus: UK farmers face brutal test ahead of Brexit ,2020-06-03
The outsourcers hoping to gain from the crisis,2020-06-03
"Coronavirus latest: US daily death toll climbs back above 1,000",2020-06-02
US takes aim at digital services taxes in UK and EU,2020-06-02
Poorer countries need long-term economic help,2020-06-02
The EU rises to meet the Covid-19 crisis,2020-06-02
ECB set to expand bond-buying to soak up debt,2020-06-02
EU seeks to curb state-backed foreign rivals,2020-06-02
UK savings rise prompts hope of spending rebound after lockdown,2020-06-02
Coronavirus and Brexit are a poisonous combination for UK business,2020-06-02
FirstFT: Today’s top stories,2020-06-02
Brazil’s record outflows underline investors’ fears of Bolsonaro,2020-06-02
George Floyd and the story of the Two Americas,2020-06-02
Central Europe fears effects of German slowdown,2020-06-02
Three good reasons not to dabble in negative interest rates,2020-06-02
Coronavirus: US death rate hits two-month low below 500 — as it happened,2020-06-01
The European PMIs look troubling,2020-06-01
Davos aims to coax elite out of isolation in January,2020-06-01
Huawei turns to mobile chip rivals to beat US pressure,2020-06-01
Will the US block a new WTO director-general?,2020-06-01
FirstFT: Today’s top stories,2020-06-01
Trade and the environment: why it's not all about air miles,2020-06-01
Swiss debate on corporate liability comes to a head,2020-06-01
Ireland plunged back into fight against deficit and job losses,2020-06-01
"Angrynomics, by Eric Lonergan and Mark Blyth",2020-06-01
Will UK wave of state aid recede with coronavirus?,2020-06-01
China’s stimulus sceptics need not fear side-effects this time,2020-05-31
Coronavirus: Greece set to reopen more schools — as it happened,2020-05-31
"US jobs report, ECB meeting, Covid-19 easing",2020-05-31
Bezos invests in UK digital logistics start-up Beacon,2020-05-31
We may be entering a post-dollar world,2020-05-31
Companies should start showing more national loyalty,2020-05-31
Covid-19 effects could deepen secular stagnation,2020-05-31
Borrowing long is the way to borrow safely,2020-05-31
Will the ECB expand its bond-buying programme?,2020-05-31
Trump to revoke Hong Kong’s special trade privileges,2020-05-29
Coronavirus: New Jersey and California lead one-day rise in US deaths — as it happened,2020-05-29
Stocks rebound after Trump pulls his punches on China,2020-05-29
Market rally is based on optimistic assumptions,2020-05-29
Powell says Fed ‘strongly committed’ to helping US economy,2020-05-29
"Alberto Alesina, economist, 1957-2020",2020-05-29
Sound the trumpet! Debt jubilees have arrived,2020-05-29
Living with coronavirus,2020-05-29
"German car parts group to axe up to 15,000 jobs",2020-05-29
Brazil’s first-quarter GDP falls 1.5% as Covid-19 cases climb,2020-05-29
Sweden snubbed as Norway and Denmark open borders,2020-05-29
Deflation fears as eurozone price growth falls to four-year low,2020-05-29
FirstFT: Today’s top stories,2020-05-29
Traders’ happy return to work belies long recovery,2020-05-29
Covid-19 puts Polish logistics and transport groups to the test,2020-05-29
Coronavirus: US outbreak continues to spread beyond original hotspots — as it happened,2020-05-28
Recovery prospects outweigh the negatives,2020-05-28
Fiscal policy must now support the recovery,2020-05-28
Bank of England’s recovery forecasts are narrow,2020-05-28
US jobless claims top 40m as economy struggles to reopen,2020-05-28
Europe’s battle lines are drawn at a perilous time,2020-05-28
EU shouldn’t rely on trade defence to strengthen its supply chains,2020-05-28
FirstFT: Today’s top stories ,2020-05-28
How will Trump intervention affect Hong Kong business?,2020-05-28
It’s game on for an EU of common purpose,2020-05-28
Trade Secrets: Supply Chain Disruption,2020-05-28
Covid-19 crisis reveals supply chain vulnerability,2020-05-28
Businesses get creative to battle Covid-19 drop-off,2020-05-28
Restaurants and hotels clean up with toilet paper sales,2020-05-28
Pivoting production lines help governments cope,2020-05-28
Will coronavirus finally kill off global supply chains?,2020-05-28
Be wary of scapegoating ‘just-in-time’ supply chains,2020-05-28
Britain’s Brexiters still do not understand Europe,2020-05-28
Fraction of Fed lending facilities have been tapped so far,2020-05-28
"Coronavirus: US death toll from Covid-19 tops 100,000 — as it happened",2020-05-27
Mexico’s GDP could fall nearly 9% in 2020,2020-05-27
Zambia hires Lazard to advise on $11bn debt burden,2020-05-27
Fed says pandemic inflicted most ‘severe’ damage on travel sector,2020-05-27
Michel Barnier says EU remains ‘open’ to transition period extension,2020-05-27
‘Lockdown generation’ faces sweeping job losses,2020-05-27
Lex Letter from London: rainy day savings,2020-05-27
Coronavirus hit to eurozone set to dwarf financial crisis,2020-05-27
Will the US be cautious on financial decoupling from China?,2020-05-27
FirstFT: Today’s top stories,2020-05-27
Turkey looks to weather coronavirus crisis without IMF support,2020-05-27
First to close — first to reopen: Denmark’s gain from virus response,2020-05-27
Business will be the loser in the US-China fight,2020-05-27
German ECB executive shrugs off court ruling against bond buying,2020-05-27
Australia given short shrift by China over US ties and virus stance,2020-05-26
Coronavirus: US sees fewest daily infections in two months — as it happened,2020-05-26
China-US rivalry and threats to globalisation recall ominous past,2020-05-26
There is a way forward for Argentina and its creditors,2020-05-26
ECB warns of challenge for eurozone from soaring public debt,2020-05-26
Plight of detained Canadians sends warning to US allies on China trade ,2020-05-26
FirstFT: Today’s top stories,2020-05-26
Fuel price slump puts North American LNG projects on ice,2020-05-26
Singapore warns its economy could shrink by 7% due to coronavirus,2020-05-26
FirstFT: Today’s top stories,2020-05-26
"UK falling short of post-Brexit target for customs agents, warns industry ",2020-05-26
Now is the time to renew the German economy,2020-05-25
The changing face of the billionaire classes,2020-05-25
"European consumers stockpile savings, adding to economic drag",2020-05-25
Rolls-Royce increases price-cuts pressure on suppliers,2020-05-25
Coronavirus crisis provides fertile ground for online fraudsters,2020-05-25
Just one in 10 fund managers expect V-shaped recovery for US economy,2020-05-25
"EU recovery fund, Nissan strategy, inflation data",2020-05-24
China warns audit plans will drive companies from US exchanges  ,2020-05-24
Richest nations face $17tn government debt burden from coronavirus,2020-05-24
China is pitting EU countries against each other,2020-05-24
Investors see uncertain future in Mexico,2020-05-24
The modern era of globalisation is in danger,2020-05-24
UK draws up plans to restrict Chinese inward investment,2020-05-24
Australia: has the ‘lucky country’ run out of luck? ,2020-05-24
The UK must defend companies against overseas takeovers,2020-05-23
Fed on hold to assess scale of  pandemic trauma,2020-05-23
Penny-pinching consumers may spell trouble for recovery,2020-05-23
Coronavirus: Trump demands reopening of ‘houses of worship’ — as it happened,2020-05-22
Trade Secrets video series,2020-05-22
"Nuts, bolts and bay leaves: UK trade after Brexit",2020-05-22
Covid-19 recovery economics,2020-05-22
ECB fuels investor expectations that bond-buying will rise in June,2020-05-22
IMF agrees $5bn loan for Ukraine ,2020-05-22
UK government borrowing and debt surge,2020-05-22
FirstFT: Today’s top stories,2020-05-22
Fears of Japanification spreading are misplaced,2020-05-22
Australia’s A$60bn ‘reporting error’ boosts coffers for virus recovery,2020-05-22
China drops GDP target for first time in wake of coronavirus,2020-05-22
Coronavirus: US death rate increases over last 24 hours — as it happened,2020-05-21
Not a good time for another round of China-US friction,2020-05-21
Bank of England pivots and starts to contemplate negative rates,2020-05-21
A no-deal Brexit amid the pandemic would be disgraceful,2020-05-21
Chinese search giant Baidu reconsiders US listing ,2020-05-21
Iron ore rises to nearly $100 a tonne as China eases custom checks,2020-05-21
Is our food system broken?,2020-05-21
Turkey cuts rates for ninth time in a row in bid to spur growth,2020-05-21
Is the Franco-German plan Europe’s ‘Hamiltonian’ moment?,2020-05-21
FirstFT: Today’s top stories,2020-05-21
"EU recovery fund is a historic step, almost",2020-05-21
IMF chief: halt bank dividends and buybacks now,2020-05-21
"Rebuilding better after Covid-19, part 3",2020-05-21
"Negative interest rates are a tool, not a gift",2020-05-21
Downturn in economic activity starts to ease across eurozone,2020-05-21
Why the Merkel-Macron plan could be a very big deal for Europe,2020-05-21
What to know about America’s newly unemployed,2020-05-21
US Senate passes bill that puts some Chinese listings at risk,2020-05-20
"Coronavirus: US death toll rises by 1,400 as outbreak moderates — as it happened",2020-05-20
UK set for new clash with Brussels over Northern Ireland Brexit plan,2020-05-20
Strong demand for US 20-year bond to fund record spending,2020-05-20
Fed considers giving clearer guidance on crisis policy,2020-05-20
BoE says negative interest rates are ‘under review’ for first time,2020-05-20
World Bank names crisis expert as new chief economist,2020-05-20
The UK needs to extend its EU transition period,2020-05-20
What is the Northern Ireland protocol: the Irish Sea border explained,2020-05-20
The Covid-19 conundrum: lives vs livelihoods,2020-05-20
Capex cuts: the blight stuff,2020-05-20
Why a restructuring strategy is needed to save jobs and growth ,2020-05-20
China’s Communist party will survive Covid-19,2020-05-20
Trump’s new tool to bring factories home from China ,2020-05-20
FirstFT: Today’s top stories,2020-05-20
Argentines take no chances as default fears grow,2020-05-20
"For all its faults, the world needs the WHO",2020-05-20
UK inflation falls to three-year low in April on cheaper energy prices,2020-05-20
Chinese business pleads for more help from Beijing,2020-05-20
The eurozone’s bailout fund remains unfairly toxic,2020-05-20
Countries lift lockdowns despite surge in Covid-19 cases ,2020-05-20
"Coronavirus: US death toll tops 86,000 — as it happened",2020-05-19
Sunak warns UK economy could suffer permanent ‘scarring’,2020-05-19
‘Radical measures’ required: how Covid-19 has hit UK labour market ,2020-05-19
Mnuchin says US ready to ‘take losses’ on $500bn bailout ,2020-05-19
Franco-German rescue plan is a big step forward,2020-05-19
Britain’s vision for EU trade deal prompts claims of cherry picking,2020-05-19
Why inflation might follow the pandemic,2020-05-19
"Virus will push up to 60m into extreme poverty, World Bank warns",2020-05-19
German investors’ optimism about economic outlook grows,2020-05-19
China’s reliance on Australian commodities set to rise in post-virus recovery,2020-05-19
FirstFT: Today’s top stories,2020-05-19
Virus lays bare Latin America’s many woes,2020-05-19
UK sets out post-Brexit tariff regime,2020-05-19
Australia threatens China with WTO challenge over barley tariffs,2020-05-19
Covid-19 has brought a role reversal for Latin America’s populists,2020-05-19
US ‘surgical’ attack on Huawei will reshape tech supply chain ,2020-05-19
Xi seeks to cast China as guardian of global order,2020-05-18
Coronavirus: US records fewest daily deaths since March — as it happened,2020-05-18
Jumping into the next cycle,2020-05-18
Global economic hopes give investors a lift,2020-05-18
US and EU contemplate reshaping WTO after Azevêdo’s departure,2020-05-18
The WTO’s main problems aren’t organisational: they are political,2020-05-18
Huawei says new US sanctions put its survival at stake,2020-05-18
FirstFT: Today’s top stories,2020-05-18
Who will pay for the government spending? ,2020-05-18
The WTO is needed today as much as ever,2020-05-18
Temperature tracker offers sea change for vaccines,2020-05-18
The rise and fall of global trade from the Romans to coronavirus,2020-05-18
Contenders set out stalls to succeed Azevêdo at helm of WTO,2020-05-17
"China’s national congress, M&S results, flash PMIs",2020-05-17
Egyptians face economic pain despite looser lockdown,2020-05-17
America must step up to retain its economic might,2020-05-17
Why the US jobless surge is worse than in Europe,2020-05-17
Flood of bankruptcies must not overwhelm the recovery,2020-05-17
Will Italy’s borrowing costs rise even further?,2020-05-17
Virus brings France’s ‘number-one car region’ to a standstill,2020-05-17
Dollar liquidity measures leave some countries out in the cold,2020-05-17
Can fast fashion’s $2.5tn supply chain be stitched back together?,2020-05-17
US elite forces ill-equipped for cold war with China,2020-05-16
Why prudent investors should start paying up for inflation protection,2020-05-16
Stocks end week lower as Wall Street weighs Sino-US tension,2020-05-15
Huawei back on the chain gang,2020-05-15
Drive for cross-border solidarity to beat pandemic ,2020-05-15
US escalates China tensions with tighter Huawei controls,2020-05-15
Plunge in US industrial and retail activity in April laid bare,2020-05-15
Paying for the Covid-19 pandemic will be painful,2020-05-15
"Is the virus, not lockdowns, doing most of the economic damage?",2020-05-15
New thinking in a crisis,2020-05-15
Oil slump puts pressure on Gulf states’ currency pegs  ,2020-05-15
Brexit talks stall as UK resists EU demands on fair competition,2020-05-15
German GDP shrinks by 2.2% in first quarter,2020-05-15
FirstFT: Today’s top stories,2020-05-15
Wall Street is having a good plague ,2020-05-15
Trump threatens to cut off relations with China,2020-05-15
China industry rebounds in April from coronavirus lows,2020-05-15
The ECB must shift to a wholesale acceptance of junk bonds,2020-05-15
How bank hedging jolted investors into talk of negative rates ,2020-05-15
Investors warn Covid-19 crisis is paving the way for inflation ,2020-05-15
Taiwanese group to build $12bn chipmaking plant in US,2020-05-15
"Coronavirus: US death toll surpasses 80,000 — as it happened",2020-05-14
A healthcare solution for the decade,2020-05-14
Germany faces €82bn tax receipts shortfall because of coronavirus,2020-05-14
Global Boardroom,2020-05-14
"Reshoring should be driven by business, not politics",2020-05-14
Covid-19 looks like a hinge in history,2020-05-14
FirstFT: Today’s top stories,2020-05-14
We need a Financial Stability Board for health,2020-05-14
Why Brexit divorce deal still hangs over EU-UK future-relationship talks ,2020-05-14
The coronavirus downturn makes the worst-off suffer most,2020-05-14
WTO chief Roberto Azevêdo to step down early,2020-05-14
The dangers of a US-China financial war,2020-05-14
Eastern hope survives in EU’s coronavirus gloom,2020-05-14
"Fed chair on fiscal stimulus, BMW payouts, CLO risk",2020-05-14
French business chief predicts decline of Parisian dominance,2020-05-14
Resilient builders lay foundation for German economy to outperform,2020-05-14
China’s record Brazil soyabean imports impede US trade target,2020-05-14
Poland’s plan to block foreign takeovers alarms business,2020-05-14
UK plan to cut US farming tariffs sparks ministerial spat,2020-05-14
"Coronavirus: US death toll jumps to more than 78,000 — as it happened",2020-05-13
"Fiscal stimulus ‘worth it’ to tackle pandemic, says Fed chief",2020-05-13
US says Chinese hackers are targeting coronavirus research,2020-05-13
Now is not the time to worry about the UK debt burden,2020-05-13
Europe damps holidaymakers’ hopes of business as usual,2020-05-13
US government pension fund halts plan to buy Chinese stocks,2020-05-13
Trump threats to China over coronavirus pile pressure on renminbi,2020-05-13
Fed chair warns further economic stimulus may be needed,2020-05-13
"Pandemic stimulus debt will ‘come back to haunt us’, warns OECD",2020-05-13
Japan models a new look for national security,2020-05-13
FirstFT: Today’s top stories,2020-05-13
Why a sensible deadline for US-UK trade talks is next April,2020-05-13
Emerging economies hold back on asking creditors for debt relief,2020-05-13
European investment plunge raises fears for future growth,2020-05-13
Maersk warns of 25% drop in shipping as virus snarls trade,2020-05-13
ECB rebuffs bank complaints on negative interest rates,2020-05-13
Beijing hits back at Trump call to block US pension fund investment in China,2020-05-13
"Georgieva on economic outlook, EM debt concerns",2020-05-13
Martin Wolf: after the coronavirus pandemic,2020-05-13
"Coronavirus: US daily death count bounces back above 1,500 — as it happened",2020-05-12
Trump orders federal pension fund not to invest in Chinese stocks,2020-05-12
"Global economic outlook still worsening, says IMF",2020-05-12
German court decides to take back control with ECB ruling,2020-05-12
RCEP will test appetite for open trade in coronavirus era,2020-05-12
Business cannot simply awake from this coma,2020-05-12
FirstFT: Today’s top stories,2020-05-12
The world needs a new attitude towards debt,2020-05-12
China suspends beef imports from 4 Australian abattoirs ,2020-05-12
Coronavirus just one more crisis for Argentina’s start-ups,2020-05-12
UK on the horns of a dilemma in US trade talks,2020-05-12
Why the coming emerging markets debt crisis will be messy,2020-05-12
The wealthy should welcome an opportunity to reduce inequality,2020-05-12
Investors struggle to hear signals from bond markets,2020-05-12
Covid-19 crisis has laid bare weaknesses in supply chains ,2020-05-12
‘Wolf warrior’ diplomats reveal China’s ambitions,2020-05-12
Coronavirus: US death rate falls sharply — as it happened,2020-05-11
Easing lockdowns creates hope and tensions,2020-05-11
EU trade chief seeks revived talks to close transatlantic rift ,2020-05-11
Moody’s warns of sharp pick-up in EM corporate debt defaults,2020-05-11
Travel ‘bubbles’ offer a potential way forward,2020-05-11
Onshoring won’t protect us,2020-05-11
Why supply chain diversification isn’t all that easy,2020-05-11
FirstFT: Today’s top stories,2020-05-11
China car sales notch first rise in almost 2 years,2020-05-11
US-China decoupling accelerates in first quarter,2020-05-11
The Fed’s Vietnam moment,2020-05-11
Covid-19 is an opportunity to restructure taxes,2020-05-11
South-east Asia rides fourth wave of regional growth,2020-05-11
Asia’s busy investors seek opportunities beyond China,2020-05-11
Argentina on brink of ninth debt default,2020-05-10
India must now help its people back to work,2020-05-10
New virus outbreaks hamper efforts to reopen global economy  ,2020-05-10
"Lockdowns ease, UK and German GDP reports",2020-05-10
Brussels turns up the heat on Brexit talks ,2020-05-10
Here is how banks can help save the economy,2020-05-10
The ECB is deluding itself over German court ruling,2020-05-10
Digital Conference: Global Economic Crisis - What Now?,2020-05-10
Multinationals fear rise in protectionism because of pandemic,2020-05-10
How worried should investors be about rising US-China tensions?,2020-05-10
Sweden unlikely to feel economic benefit of no-lockdown approach,2020-05-10
Coronavirus: Pence aide tests positive for Covid-19 — as it happened,2020-05-08
Risk sentiment whistles past an appalling jobs report,2020-05-08
US and China: edging towards a new type of cold war?,2020-05-08
Unemployment in US hits postwar high of 14.7%,2020-05-08
UK draws up plans to bypass strike-prone port of Calais,2020-05-08
Best of this week’s opinion,2020-05-08
Lagarde urges eurozone to launch joint fiscal stimulus,2020-05-08
Fear factor threatens stocks’ Covid-19 fightback,2020-05-08
It’s the end of globalism as we know it (and I feel fine),2020-05-08
FirstFT: Today’s top stories,2020-05-08
Saving the planet the Brexit way ,2020-05-08
US and China say trade talks on track despite coronavirus tensions,2020-05-08
Germany’s ECB critics toast courtroom success,2020-05-08
Too much cash is chasing too few desirable assets,2020-05-08
Markets should beware this morally hazardous approach to policymaking,2020-05-08
Inside Samsung’s fight to keep its global supply chain running,2020-05-08
"Coronavirus: New York death toll exceeds 20,000 — as it happened",2020-05-07
Dropping Flynn case turns Barr into Trump’s political sword,2020-05-07
Brazil approves QE to fight coronavirus woes,2020-05-07
Tech stock rally turns Nasdaq positive for the year,2020-05-07
Economists question BoE’s overly rosy view of V-shaped recovery ,2020-05-07
EU increases pressure on Britain over Irish Sea customs border,2020-05-07
Trump’s erratic China policy undermines western unity,2020-05-07
People cannot just be ordered back to work and to spend,2020-05-07
Argentina plans to set $45 oil price in push to save Vaca Muerta,2020-05-07
Lagarde says ECB ‘undeterred’ by German court challenge,2020-05-07
US jobless claims of 3.2m take pandemic toll beyond 33m,2020-05-07
Coronavirus: The world after the pandemic,2020-05-07
Franco-Dutch alliance could be harbinger of things to come in EU trade deals,2020-05-07
Paris and The Hague say EU must toughen enforcement of green trade,2020-05-07
FirstFT: Today’s top stories ,2020-05-07
"Most Americans trust governors over Trump on reopening, poll shows ",2020-05-07
"Rebuilding better after Covid-19, part 2",2020-05-07
China exports rebound in April on new Asian demand  ,2020-05-07
Norway cuts rates to zero as economy faces twin shocks,2020-05-07
Breaking down the eurozone’s worst recession in history ,2020-05-07
Can we tackle both climate change and Covid-19 recovery?,2020-05-07
Coronavirus: NY Fed finds hardest-hit states won fewer PPP loans — as it happened,2020-05-06
US looks to step up economic action against China ,2020-05-06
US stocks fall as investors weigh push towards reopening,2020-05-06
Divide and rule: coronavirus provokes dangerous nationalism,2020-05-06
The class of 2020 need help to start their careers,2020-05-06
Brussels and Britain clash over climate conditions in trade deal,2020-05-06
UK construction activity collapses in April,2020-05-06
Why the US-China trade deal is now at risk of falling apart,2020-05-06
Brussels warns outbreak threatens eurozone’s stability,2020-05-06
We risk a return to 1970s stagflation,2020-05-06
The World Health Organization can be reformed,2020-05-06
FirstFT: Today’s top stories,2020-05-06
Companies are dangerously drunk on debt,2020-05-06
Renewables sector shrugs off devastating effects of coronavirus,2020-05-06
Debt relief: which countries are most vulnerable?,2020-05-06
German court ruling casts doubt on European monetary policy,2020-05-06
Coronavirus: US deaths spike as fatalities spread outside NY — as it happened,2020-05-05
Opening up economies drives risk sentiment,2020-05-05
Wall Street closes higher after oil rally takes Brent over $30,2020-05-05
UK and US face hurdles to deliver ‘fast pace’ trade pact,2020-05-05
German court calls on ECB to justify bond-buying programme,2020-05-05
