title,date
BoE chief economist warns against complacency over inflation,2021-02-26
Devastated travel sector takes solace from pick-up in bookings,2021-02-26
US removes stumbling block to global deal on digital tax,2021-02-26
EU urged to consider far-reaching fiscal reforms as debt soars,2021-02-26
FirstFT: Today’s top stories,2021-02-26
The potential pitfalls of economic growth ,2021-02-26
Markets set for a bumpy ride back to inflation,2021-02-26
ECB signals rising concern about eurozone bond market sell-off,2021-02-25
New US jobless claims fall to lowest in 3 months,2021-02-25
Geopolitical supremacy will increasingly depend on computer chips,2021-02-25
Yellen backs fresh financial support for low-income countries,2021-02-25
European Parliament ponders the price of principle on China,2021-02-25
FirstFT: Today’s top stories,2021-02-25
How the pandemic alters everything,2021-02-25
New Zealand tells central bank to consider housing in policy decisions,2021-02-25
Powell pulls his punches on benefits of more fiscal stimulus,2021-02-25
Australia sovereign wealth fund chief warns of stock market ‘clean-out’,2021-02-25
Biden orders review of critical foreign supply chains ,2021-02-24
Is inflation back from the dead?,2021-02-24
Global government bonds hit by fresh wave of selling,2021-02-24
Rich countries should reassign funds to Africa as the path out of Covid,2021-02-24
Carmakers’ chip woes are a blessing for Taipei,2021-02-24
FirstFT: Today’s top stories,2021-02-24
Why optimism about the economy is so important,2021-02-24
Further reading,2021-02-24
BoE chief economist warns against complacency over inflation,2021-02-26
Devastated travel sector takes solace from pick-up in bookings,2021-02-26
US removes stumbling block to global deal on digital tax,2021-02-26
EU urged to consider far-reaching fiscal reforms as debt soars,2021-02-26
FirstFT: Today’s top stories,2021-02-26
The potential pitfalls of economic growth ,2021-02-26
Markets set for a bumpy ride back to inflation,2021-02-26
ECB signals rising concern about eurozone bond market sell-off,2021-02-25
New US jobless claims fall to lowest in 3 months,2021-02-25
Geopolitical supremacy will increasingly depend on computer chips,2021-02-25
Yellen backs fresh financial support for low-income countries,2021-02-25
European Parliament ponders the price of principle on China,2021-02-25
FirstFT: Today’s top stories,2021-02-25
How the pandemic alters everything,2021-02-25
New Zealand tells central bank to consider housing in policy decisions,2021-02-25
Powell pulls his punches on benefits of more fiscal stimulus,2021-02-25
Australia sovereign wealth fund chief warns of stock market ‘clean-out’,2021-02-25
Biden orders review of critical foreign supply chains ,2021-02-24
Is inflation back from the dead?,2021-02-24
Global government bonds hit by fresh wave of selling,2021-02-24
Rich countries should reassign funds to Africa as the path out of Covid,2021-02-24
Carmakers’ chip woes are a blessing for Taipei,2021-02-24
FirstFT: Today’s top stories,2021-02-24
Why optimism about the economy is so important,2021-02-24
Further reading,2021-02-24
China focuses on Africa energy as Belt and Road lending dries up,2021-02-24
How rampant is spending about to get? ,2021-02-24
Car chip shortage shines light on fragility of US supply chain,2021-02-24
Fed needs to ignore ‘taper tantrums’ and let longer rates rise,2021-02-24
Powell signals ‘hope for return to more normal conditions’,2021-02-23
Joe Biden’s $1.9tn package is a risky experiment,2021-02-23
UK urges food manufacturers and farmers to target Asian middle class,2021-02-23
Japan wants CPTPP’s new applicants to follow the rules ,2021-02-23
FirstFT: Today’s top stories,2021-02-23
When is stimulus too much for markets?,2021-02-23
UK pet food industry hurt by Brexit checks and red tape   ,2021-02-23
Japanese companies stick with Myanmar despite putsch ,2021-02-23
China urges Biden to lift sanctions and stop meddling  ,2021-02-23
"Copper breaches $9,000 a tonne in bet on economic bounce and supply limits",2021-02-22
Boris Johnson unveils plan to end lockdown in England,2021-02-22
The UK and EU will remain at odds over finance ,2021-02-22
FirstFT: Today’s top stories,2021-02-22
Europe should ‘go big’ on fiscal policy too,2021-02-22
BoE faces tension over stimulus options if recovery disappoints,2021-02-21
"UK lockdown exit plans, HSBC results, Powell appears before Congress",2021-02-21
Why once successful countries like the UK get left behind,2021-02-21
Will inflation data justify investors’ concerns?,2021-02-21
Covid’s health legacy demands radical revamp of welfare systems,2021-02-21
Eurozone manufacturing recovery partially offsets downturn in services,2021-02-19
FirstFT: Today’s top stories,2021-02-19
Investing in Europe — new opportunities on the old continent,2021-02-19
Too early to call a commodities supercycle,2021-02-19
Diplomats and business express caution over Frost cabinet role,2021-02-18
"Rein in spending of Norway’s oil wealth, central banker warns Oslo",2021-02-18
"‘For me, the key is multilateralism that produces results’",2021-02-18
ECB vows to stick to stimulus despite recent rise in inflation,2021-02-18
UK-EU relations are in for a bumpy ride with Frost in the driving seat,2021-02-18
Coronavirus control and big spending prove a magic economic mix,2021-02-18
FirstFT: Today’s top stories,2021-02-18
Port of LA adapts to the pandemic,2021-02-18
Brussels strikes assertive pose in trade policy reboot ,2021-02-18
Why economists kept getting the policies wrong,2021-02-18
Investors also need to ‘act big’ as Yellen signals regime change,2021-02-18
After Brexit: the UK and EU risk a state of ‘permanent alert’,2021-02-18
Australians dread loss of ‘lifeline’ Covid job subsidy,2021-02-18
Americans borrowed record $1.2tn in fourth quarter for mortgages,2021-02-17
Globalisation 2.0: the new rules of connection,2021-02-17
Inflation rise marks start of upward trend in UK,2021-02-17
Digital services tax will struggle to clear US congressional hurdles ,2021-02-17
FirstFT: Today’s top stories,2021-02-17
Protectionism is back on the French economic menu,2021-02-17
Shortage of giant plastic bags threatens global vaccines rollout,2021-02-17
Spain sets out priorities for spending €140bn in EU recovery funds,2021-02-17
Further reading,2021-02-17
Yellen needs to tell Asian nations to stop currency manipulation,2021-02-17
Sunak urged to copy Biden and ‘act big’ with £190bn stimulus,2021-02-17
Decoupling denied: Japan Inc lays its bets on China,2021-02-16
IMF to resume stalled $6bn loan programme to Pakistan,2021-02-16
FirstFT: Today’s top stories,2021-02-16
South Korea goes missing as multilateral moment strikes ,2021-02-16
China targets rare earth export curbs to hobble US defence industry,2021-02-16
Joe Biden’s huge bet: the economic consequences of ‘acting big’,2021-02-16
Semiconductor cycle out of balance after customers stock up ,2021-02-16
Taiwan’s economy feels heat as TSMC feeds global chip boom,2021-02-15
FirstFT: Today’s top stories,2021-02-15
EU moves against forced-labour imports,2021-02-15
Mexico’s investment drought holds back recovery from pandemic,2021-02-15
The risks from a dash to chip nationalism,2021-02-15
Japan powers out of coronavirus dip with 3% fourth-quarter growth,2021-02-15
The consensus is wrong on European stocks,2021-02-15
Brexit trade disruption fuels boom at French and Irish ports ,2021-02-15
Dani Rodrik: ‘We are in a chronic state of shortage of good jobs’,2021-02-15
London and Brussels plan hotline over Northern Ireland problems,2021-02-14
Argentina’s powerful vice-president pushes for delay to IMF debt deal,2021-02-14
Emerging nations are better equipped to survive the pandemic’s economic shock,2021-02-14
"UK bank earnings, US retail sales set to rebound, flash PMIs",2021-02-14
Brexit woes: small UK distillers struggle to ship gin and whisky to EU,2021-02-14
Bitcoin’s rise reflects America’s decline,2021-02-14
The moment of danger for Europe will be when the recovery starts,2021-02-14
US equities close the week at record highs,2021-02-12
Developing world struggles to get its share of Covid vaccines,2021-02-12
UK suffers biggest drop in economic output in 300 years,2021-02-12
Yellen signals US return to multilateralism in first G7 meeting,2021-02-12
Ngozi Okonjo-Iweala: Nigerian powerhouse to head the WTO ,2021-02-12
FirstFT: Today’s top stories,2021-02-12
China’s record corn purchases have traders wondering if bump can last,2021-02-12
White House scrambles to address global chip shortage,2021-02-11
The Fed needs to call time on cheap money,2021-02-11
Small businesses to be offered grants to cope with Brexit disruption,2021-02-11
Trust deficit is killing a deeply flawed Northern Ireland agreement,2021-02-11
ECB urged to ‘decarbonise’ its €2.4tn corporate credit holdings,2021-02-11
FirstFT: Today’s top stories,2021-02-11
Trade-phobic governments may be jumping at electoral shadows,2021-02-11
The challenges of European identity,2021-02-11
Brussels lifts forecasts for eurozone’s economic recovery,2021-02-11
EU sinks UK hopes of overturning shellfish ban,2021-02-11
Brazil passes law giving autonomy to central bank,2021-02-11
Brussels fires warning shot at UK over N Ireland protocol,2021-02-11
Northern Ireland ports to resume checks after security fears,2021-02-10
Powell stresses patience in pledge to keep monetary policy loose,2021-02-10
FirstFT: Today’s top stories,2021-02-10
A US pivot towards Africa,2021-02-10
China producer prices rise as industrial sector leads recovery,2021-02-10
Ecuador’s presidential front-runner is a CBDC advocate,2021-02-10
The Fed must be mindful of mounting inflation worries,2021-02-10
Further reading,2021-02-10
Powell under pressure over impact of Biden stimulus,2021-02-10
French corporate nationalism comes to fore with Carrefour veto,2021-02-10
FT Health: Future of Antibiotics,2021-02-10
Huawei challenges its designation as a threat to US security,2021-02-09
Spain draws €65bn orders in sale of 50-year bonds ,2021-02-09
The dilemma facing foreign investors in Myanmar,2021-02-09
FirstFT: Today’s top stories,2021-02-09
Taiwan in drive to sign trade deal with US ,2021-02-09
"India’s energy demands to grow more than those of other countries, says IEA chief",2021-02-09
Sharp fall in global migration threatens economic recovery ,2021-02-09
Sweden flies the flag for the free-trade cause in the EU,2021-02-09
Gove calls for Brussels to be ‘pragmatic’ over Northern Ireland ,2021-02-08
AstraZeneca hit by more doubts over vaccine’s efficacy,2021-02-08
Joe Biden’s $1.9tn plan is necessary as economic recovery insurance,2021-02-08
Senior Fed official shrugs off inflation risks from stimulus plan,2021-02-08
US long-term interest rates hit highest in a year on stimulus impact,2021-02-08
The WTO is finally getting its new boss,2021-02-08
A wealth tax is the economic buffer rich nations need,2021-02-08
Further reading,2021-02-08
FirstFT: Today’s top stories,2021-02-08
Argentina’s largest oil group swerves $6.2bn debt default,2021-02-08
Taiwan senses opportunity to bolster relations with west after chip shortages,2021-02-08
Biden warns China will face ‘extreme competition’ from US,2021-02-07
Yellen predicts full US employment next year if stimulus is passed,2021-02-07
"Trump impeachment, lunar new year, inflation data",2021-02-07
Will a key measure of Italy’s political risk continue to fall?,2021-02-07
US China hawks wage battle over commerce department post,2021-02-06
US backing paves way for Nigeria’s Okonjo-Iweala to lead WTO ,2021-02-05
Poorest countries suffering ‘staggering’ hardship during virus,2021-02-05
Biden defends stimulus plan as US struggles to add back jobs ,2021-02-05
Supply chain costs are mounting in all sorts of ways,2021-02-05
FirstFT: Today’s top stories,2021-02-05
Carmakers consider supply chain overhaul to avert more chip crises,2021-02-05
"Carmakers’ chip woes, UK directors’ liability, nursing home robots  ",2021-02-05
Australian farmers warn China trade spat will cost them $28bn,2021-02-05
Chinese bosses push staff to work through new year festivities,2021-02-05
Ford says chip shortage could knock $2.5bn from earnings,2021-02-04
New US jobless claims fall to lowest since November,2021-02-04
We are entering the era of e-globalisation,2021-02-04
Food inflation concerns deepen as prices reach highest level since 2014,2021-02-04
GDP may be imperfect but don’t write it off yet,2021-02-04
BoE expects vaccine-fuelled economic recovery in second half of 2021 ,2021-02-04
Brussels pushes back on UK bid to rewrite Northern Ireland protocol,2021-02-04
FirstFT: Today’s top stories,2021-02-04
The EU is an uncertain trade ally for Biden,2021-02-04
Further reading,2021-02-04
IMF calls on Arab leaders to take action or risk new ‘lost decade’ ,2021-02-04
UK carmakers after Brexit: a race to attract battery production,2021-02-04
Investor-friendly economics on trial in Andean elections,2021-02-04
US-China investment flows belie geopolitical tensions,2021-02-04
Johnson threatens to use emergency powers to avoid barrier in Irish Sea,2021-02-03
"No, inflation isn’t back ",2021-02-03
Eurozone inflation jumps by most in over a decade,2021-02-03
FirstFT: Today’s top stories,2021-02-03
US will not be as quick into CPTPP as UK,2021-02-03
Keeping zombie companies alive is the right call,2021-02-03
Coronavirus: US to ship vaccines directly to pharmacies — as it happened,2021-02-02
Apple increases production of iPhone and iPad outside China,2021-02-02
Biden to order review of critical US supply chains,2021-02-02
Containing China is not a feasible option,2021-02-02
Central banks take rare step of flagging currency sales in advance,2021-02-02
FirstFT: Today’s top stories,2021-02-02
Asia benefits from sharp shift in cross-border investment flows,2021-02-02
Eurozone economy drops into double-dip contraction,2021-02-02
Ed Miliband: Purpose-driven businesses needed to rebuild after Covid,2021-02-02
Europe should pay attention to Germany’s debt brake debate ,2021-02-02
Five politicians and financiers jostle for position in OECD race,2021-02-02
EU responds to vaccine exports backlash,2021-02-01
Italy’s export-dependent factories thrive but Spain lags behind,2021-02-01
UK manufacturing ‘close to stalling’ as Brexit and Covid hit supplies,2021-02-01
The EU’s quixotic plan to shame China over labour rights,2021-02-01
FirstFT: Today’s top stories,2021-02-01
Taiwan asks TSMC and other chipmakers to help ease global crunch,2021-01-31
UK applies to join trans-Pacific trade group,2021-01-31
Boris Johnson urged to review deal on Northern Ireland trade ,2021-01-31
EU faces global criticism over curbs on vaccine exports,2021-01-31
Brexit one month on: what has changed?,2021-01-31
"US jobs report, Bank of England meeting, India budget",2021-01-31
"‘Buy American’ isn’t bad, it’s necessary",2021-01-31
India’s reversal of markets-based policies will hinder recovery ,2021-01-31
European retailers face goods shortages as shipping costs soar,2021-01-31
EU pledges vaccine controls will not hit UK supplies ,2021-01-30
Xiaomi sues US government over inclusion on Pentagon blacklist,2021-01-30
EU reverses course after Irish border curbs for vaccines trigger uproar  ,2021-01-29
Biden administration says Trump’s China trade deal ‘under review’,2021-01-29
EU clamps down on Covid vaccine exports,2021-01-29
EU regulator approves Oxford/AstraZeneca jab but delivery dispute deepens,2021-01-29
Davos highlights: Singapore’s prime minister urges US and China to defuse tensions,2021-01-29
Taiwan’s growth outpaces China for first time in three decades,2021-01-29
FirstFT: Today’s top stories,2021-01-29
Europe’s major economies outstrip gloomy forecasts in fourth quarter,2021-01-29
The battle ahead: war is coming for your money,2021-01-29
Give us liberty to buy those foreign cheeses,2021-01-29
Pace of US economic rebound slowed at the end of 2020,2021-01-28
Norway oil fund chief warns market exuberance cannot ‘go on forever’,2021-01-28
‘Buy American’ plan will not help US workers,2021-01-28
"Rethink public finance rules and live with much higher debt, IMF says",2021-01-28
FirstFT: Today’s top stories,2021-01-28
The struggle to defuse the global vaccine conflict,2021-01-28
The revolutions under way in macroeconomics,2021-01-28
EU opens antitrust probe into Cadbury maker Mondelez,2021-01-28
Samsung says auto chip shortage could hit smartphones ,2021-01-28
UK’s small businesses struggle with Brexit red tape ,2021-01-28
"Powell says ‘we have not won this yet’, as Fed holds rates steady",2021-01-27
IMF warns on financial stability threat from vaccine shortages,2021-01-27
Biden’s Buy American pledge has its limits,2021-01-27
FirstFT: Today’s top stories,2021-01-27
TikTok to shed hundreds of India workers after national security ban,2021-01-27
Further reading,2021-01-27
Davos highlights: Putin warns of ‘all against all’ fight if global development is neglected,2021-01-27
EU navigates rocky start to Biden trade relationship,2021-01-27
Gas tycoon Charif Souki urges industry to clean up under Biden,2021-01-27
Why Ericsson took on its own government to defend rival Huawei ,2021-01-27
Federal Reserve’s first meeting of 2021: five things to watch,2021-01-26
Competence is Joe Biden’s best strategy,2021-01-26
Brussels’ Brexit enforcer warns UK over diplomatic snub,2021-01-26
IMF expects US and China to recover most strongly from virus economic hit,2021-01-26
FirstFT: Today’s top stories,2021-01-26
Why the sharp rise in shipping costs is likely to be temporary,2021-01-26
Chinese stocks fall as central bank adviser warns of asset bubble,2021-01-26
China pours money into green Belt and Road projects,2021-01-26
Vaccine rollout and tech exports boost S Korea growth expectations,2021-01-26
Beijing turns the screws on China’s property sector,2021-01-26
Global chip shortage puts car supply chain under the microscope,2021-01-25
Pandemic crisis: Global economic impact tracker ,2021-01-25
Global trade recovers to pre-pandemic level,2021-01-25
The EU-China deal that gives Beijing too little to lose,2021-01-25
FirstFT: Today’s top stories,2021-01-25
Biden set for ‘buy American’ push to boost domestic manufacturing,2021-01-25
EU fishing fleet bemoans Brexit cuts as bloc prepares for talks,2021-01-25
EU has a chance to change from negotiator to political enforcer,2021-01-25
A bracing collection of salvos on the ‘new Great Depression’,2021-01-25
Joe Biden and the ‘great rebalancing’ ,2021-01-24
"Vietnam congress, Fed meeting, tech reports, Davos goes online ",2021-01-24
Vaccine delays in poorer nations threaten advanced economies,2021-01-24
Post-Brexit UK will need all its growth engines firing,2021-01-24
Mining deal adds to Zambian debt woes,2021-01-24
Joe Biden and US allies need a joint approach to China,2021-01-24
What effect will Biden stimulus plans have on Fed policy?,2021-01-24
Britain must rethink its ‘national security’ law,2021-01-23
Wall Street eyes China despite continued tensions with US,2021-01-23
Britain’s hopes of a quick trade deal with US fade,2021-01-22
"‘A massive second-half recovery’: Biden, China and the global economy",2021-01-22
EU to seek more time to ratify trade deal with UK,2021-01-22
Emerging markets attract $17bn of inflows in first three weeks of 2021,2021-01-22
"Joe Biden’s US must act like a new leader, not a returning one",2021-01-22
Eurozone and UK business activity slows sharply as lockdowns take toll,2021-01-22
FirstFT: Today’s top stories,2021-01-22
Brexit brings a diet of false promises to Parisian gourmands,2021-01-22
"UK economic activity drops the most since May, survey shows",2021-01-22
A wilderness of mirrors in the US,2021-01-22
UK retailers miss out on Christmas shopping boost,2021-01-22
France’s central bank has pledged to green its balance sheet,2021-01-22
Inside the Brexit deal: the agreement and the aftermath,2021-01-22
Chinese purchases of US exports fall far behind trade deal pledge,2021-01-22
China’s currency heads into Biden era on front foot,2021-01-22
ECB details bond-buying shift as it holds rates and stimulus steady,2021-01-21
FirstFT: Today’s top stories,2021-01-21
Europe moans as Biden inherits a dominant dollar,2021-01-21
Bidenomics is off to a good start,2021-01-21
Covid congestion raises the spectre of inflation,2021-01-21
Baupost’s Seth Klarman compares investors to ‘frogs in boiling water’,2021-01-21
The right answer to Xi Jinping is a one-China policy,2021-01-21
"Global policymakers look for Biden reset on trade, tax and climate",2021-01-21
Flanders looks beyond Brexit Britain for business opportunities ,2021-01-21
Why does Davos Man get it so wrong?,2021-01-21
FirstFT: Today’s top stories,2021-01-20
Robert Lighthizer defends his record on China,2021-01-20
America’s big China question,2021-01-20
Further reading,2021-01-20
China escalates fight against new Covid outbreak and US blame game,2021-01-20
"Dear Joe Biden, deficits still matter",2021-01-20
India’s consumers bear the brunt of New Delhi’s inflation paradox,2021-01-20
Boardroom drama shakes China’s biggest chipmaker SMIC,2021-01-20
"EU ‘not punishing’ UK financial services sector, London envoy insists",2021-01-19
Yellen vows to take hard line against currency manipulation,2021-01-19
Trade/containers: the shipping forecast,2021-01-19
Outgoing US trade chief says leading WTO candidate lacks experience,2021-01-19
FirstFT: Today’s top stories,2021-01-19
How international financial sanctions could derail vaccination drives,2021-01-19
"Sorry, but debt forgiveness is not going to happen ",2021-01-19
"Welcome back, America",2021-01-19
Higher inflation is coming and it will hit bondholders,2021-01-19
Tunisia’s anger boils over as Covid batters economy,2021-01-19
Shipping costs quadruple to record highs on China-Europe ‘bottleneck’ ,2021-01-19
"Pandemic shipping costs, Navalny jailed, Brookfield on real estate",2021-01-19
Zoom spy claims a warning for multinationals in China,2021-01-19
Yellen tells confirmation hearing US should ‘act big’,2021-01-18
UK turns corner on vaccine rollout,2021-01-18
UK ports demand help for British fish exporters  ,2021-01-18
China’s rebound masks long-term challenges,2021-01-18
Bonds/Roaring Twenties: slender is the fright,2021-01-18
China’s economy expands at faster rate than before coronavirus ,2021-01-18
America’s disarray is China’s opportunity,2021-01-18
Brexit Britain’s chance to strut its global stuff,2021-01-18
Financial services have been badly let down by Brexit,2021-01-18
FirstFT: Today’s top stories,2021-01-18
EU seeks to boost financial autonomy despite winds of change in Washington,2021-01-18
Kristalina Georgieva: ‘We are in a resilient place but cannot take stability for granted’ ,2021-01-18
"Erdogan’s great game: Turkey pushes into Africa with aid, trade and soaps",2021-01-18
We need a new era of international data diplomacy,2021-01-18
"Biden inauguration, ECB meeting, China GDP",2021-01-17
Chip shortage forces Audi to delay production,2021-01-17
Why the ECB should go Japanese,2021-01-17
Lockdowns fuel fears of double-dip recession in eurozone,2021-01-17
How will the European Central Bank react to longer lockdowns?,2021-01-17
Five things to watch for as China reports fourth-quarter GDP,2021-01-17
EU sets out plans to curb reliance on dollar in post-Trump era,2021-01-16
How Biden’s stimulus plan shook up global markets,2021-01-15
US banks signal post-Covid optimism,2021-01-15
The fate of conferences is not all Zoom and gloom,2021-01-15
Irish freight industry warns of Brexit threat to supply chains,2021-01-15
Central banks and climate change: all hot air ,2021-01-15
FirstFT: Today’s top stories,2021-01-15
Shares in China’s Xiaomi tumble after US investment ban,2021-01-15
UK at risk of double-dip recession as economy shrinks in November,2021-01-15
"US says digital taxes in Spain, Austria and UK are discriminatory",2021-01-14
US blacklists Xiaomi and Cnooc in flurry of actions to counter China ,2021-01-14
The US inflation pressure cooker may be steaming,2021-01-14
US sets out new powers to block Chinese technology,2021-01-14
"Northern Ireland needs pragmatism, not more political rhetoric, as it faces Brexit",2021-01-14
Northern Ireland loses new Stena ferry as Brexit deal disrupts trade,2021-01-14
The carbon tax that Brussels hopes will catch on,2021-01-14
FirstFT: Today’s top stories,2021-01-14
The China challenge,2021-01-14
TSMC says fixing global auto chip drought is a priority,2021-01-14
China trade surplus breaks record monthly level,2021-01-14
Joe Biden needs an America-first foreign policy,2021-01-14
Chinese tech groups set to boost country’s listless CDR market,2021-01-14
A fiscal policy for all seasons,2021-01-13
Barnier warns post-Brexit border friction is the new normal,2021-01-13
"Alibaba, Tencent and Baidu spared from US investor blacklist",2021-01-13
Brexit forces German logistics group to suspend UK deliveries,2021-01-13
"Pandemic’s homeworking surge fuels need for better regulation, says ILO",2021-01-13
Lagarde warns against early tightening of stimulus efforts,2021-01-13
What maiden speech of USTR-elect says about Biden’s trade policy,2021-01-13
FirstFT: Today’s top stories,2021-01-13
Why is the BoE only considering negative rates now? ,2021-01-13
Honda to close Swindon plant next week due to semiconductor shortage,2021-01-13
UK companies face fines over ‘slave labour’ China suppliers,2021-01-12
"Joe Biden must go all out, early, for structural change",2021-01-12
Germany seeks global corporate tax deal with Biden administration,2021-01-12
Japan-South Korea dispute at risk of worsening this year,2021-01-12
FirstFT: Today’s top stories,2021-01-12
