title,date
Shale oil and gas infrastructure bubble goes flat,2018-04-13
BT Pension Scheme sells stake in Hermes in £410m deal,2018-04-12
BlackRock growth dented by market volatility,2018-04-12
‘Get rich quick’ executive pay deals under threat,2018-04-12
Man Group rides volatile markets to enjoy strong Q1,2018-04-12
Fidelity fires broadside in battle to cut fund fees,2018-04-11
China accelerates opening to foreign financial groups,2018-04-11
Leapfrog your rivals to be the digital winner,2018-04-11
UK asset managers oversee £2.6tn for overseas clients,2018-04-10
UK dominates EU ranking of millionaire bankers,2018-04-10
Norwegian oil fund blocked from move into private equity,2018-04-10
BlackRock shows ethical investing is a good bet,2018-04-10
Private equity investors should flex muscles more often,2018-04-09
Rathbones confirms talks with Speirs & Jeffrey,2018-04-09
China’s fund industry to grow fivefold by 2025,2018-04-09
Too much investor cash is being leaked away,2018-04-09
Pret A Manger’s owner on selling a ‘British institution’,2018-04-09
Movers & shakers: April 9,2018-04-09
Asset managers face battle to regain investor trust,2018-04-09
Lazy fund managers lead to lousy returns,2018-04-08
Fink identifies China as critical BlackRock priority,2018-04-08
Closet tracker funds face tougher regulatory scrutiny,2018-04-08
"Cartoon: Gender pay gap chasm exposed, April 8",2018-04-08
AllianceBernstein to revamp European fund fees,2018-04-07
Brewing US-China trade war spooks asset managers,2018-04-07
A clean energy world needs a thriving mining sector,2018-04-06
Fund managers forced to confront endemic gender pay gap,2018-04-06
FCA warns fund executives of ‘personal’ responsibility,2018-04-06
"BlackRock to offer funds that exclude gun makers, sellers",2018-04-05
AQR Capital launches first quantitative bond mutual fund,2018-04-05
FCA reveals strict new rules for asset managers,2018-04-05
Opening Quote: Hammerson suggests Klépierre shut up shop,2018-04-05
We need a new way to assess investment managers,2018-04-05
Listed: asset managers and their gender pay gaps,2018-04-04
Investors nurse $10m losses on LongFin index mistake,2018-04-04
Woodford fund assets dip below £7bn,2018-04-03
Gross struggles to attract flows at Janus Henderson,2018-04-02
Oracles of investment industry are blind to performance,2018-04-02
Movers & shakers: April 2,2018-04-02
Asset management dealmaking climbs to 10-year high,2018-04-02
Intesa Sanpaolo plans asset management merger,2018-04-01
"Cartoon: the backlash against Facebook, April 1",2018-04-01
Invesco Perpetual’s two flagship funds bleed $24.8bn,2018-04-01
Value of infrastructure deals drops to 4-year low,2018-04-01
Falling tide will expose extent of fund industry costs,2018-03-31
Fiduciary rule appeal risks return to law of the jungle,2018-03-31
Morningstar ratings prompted $533bn of fund flows,2018-03-31
Follow the money as Gulf tension ratchets up,2018-03-30
Investment consultants face shake-up under possible CMA remedies,2018-03-29
Asset managers snub UK pension fund code on fees,2018-03-29
Marty Flanagan on active funds and undervaluation,2018-03-29
China lets rich invest offshore as outflow fears ease,2018-03-27
Investors cool on ETFs,2018-03-27
Investors in Japan need pinpoint accuracy,2018-03-27
Passive investing won’t cut it with China A shares,2018-03-26
Mifid’s calm start belies legal confusion on research,2018-03-26
Valuations rattle nerves as stimulus unwinds,2018-03-26
"Brexit, #MeToo and GDPR put risk managers on guard",2018-03-26
Senior managers fear being left on the hook,2018-03-26
Vanguard joins forces with German fintech company,2018-03-26
Dutch regulator offers cost rules escape route,2018-03-26
ETFs win converts among institutional investors,2018-03-26
Global investors are fretting about the UK,2018-03-26
Allianz GI vice-chair wants investors to make impact,2018-03-26
Virgin’s galactic fees do not match tracker’s dire performance,2018-03-26
"Cartoon: Corbyn’s vision spooks investors, March 26",2018-03-26
Movers and shakers: March 26,2018-03-26
Market pressure gauge flashes a red alert,2018-03-25
World’s biggest pension scheme overhauls fee structure,2018-03-25
Jupiter struck by heavy outflows and underperformance,2018-03-24
UK funds commit to social impact investment,2018-03-23
A Venezuelan oil embargo would wipe out Maduro & Co,2018-03-23
Corbyn’s plans to remould UK economy ‘risk scaring off investors’,2018-03-23
Investment consultants fail to select funds that outperform,2018-03-22
Why parting for brokers is not always such sweet sorrow,2018-03-22
Wealth advisers assess impact of Trump tax overhaul,2018-03-22
Facebook investors demand answers over data scandal,2018-03-21
Lyxor steps up price war battle with low-cost ETFs,2018-03-21
EM equity funds make record start to year,2018-03-21
Will BlackRock’s algorithms beat the fund managers?,2018-03-20
Stewardship must be embedded across the investment chain,2018-03-20
Why the Vix volatility index matters so much,2018-03-20
Stockpickers show signs of turnround,2018-03-19
Dropbox IPO is a new corporate governance low point,2018-03-19
"Movers and shakers, March 19",2018-03-19
Asset managers will rue failure to tackle costs,2018-03-19
Retail funds bring investors into boardroom battles,2018-03-19
Few companies link perks to climate change targets,2018-03-19
"Loretta Minghella, steward of the CoE’s investments, on God, guns and gender",2018-03-18
Standalone M&G looks to bring back the investors,2018-03-17
Vanguard’s campaign to drive down fees runs out of road,2018-03-17
Paulson takes an axe to his struggling hedge fund,2018-03-16
"Cartoon: Creepy giggling from Amazon’s smart speakers, March 16",2018-03-16
French fund company prepares global buying spree,2018-03-16
Guest post: The unsolved problem of illiquid bond funds,2018-03-16
The greed-fear cycle is alive and kicking,2018-03-16
Lloyds returns money to overcharged fund investors,2018-03-16
Prudential split adds to shake-up of insurers,2018-03-14
Private equity groups are calling the shots,2018-03-14
AI’s push into finance runs into correlation pitfalls,2018-03-14
Prudential to split into two with M&G spin-off,2018-03-14
AI and big data’s great power comes with great responsibility too,2018-03-14
"ETFs not to blame for market turbulence, says BNY Mellon",2018-03-14
European fund sales reforms criticised by trade bodies,2018-03-13
Volatility drives first ETF outflows in two years,2018-03-12
Equity markets are thriving but are they relevant?,2018-03-12
Gender-diverse companies are more productive,2018-03-12
"Movers and shakers, March 12",2018-03-12
"Cartoon: Comcast disrupts Murdoch’s Disney deal, March 12",2018-03-12
Deutsche in deal with Nippon Life to anchor DWS float,2018-03-11
Woodford sold AJ Bell stake on eve of IPO announcement,2018-03-11
Investors are rarely won over by two-headed monsters,2018-03-11
Fund managers count cost of Mifid research shake-up,2018-03-10
Value investors brave Brexit noise in bargain hunt,2018-03-10
Man Group says female employees’ bonuses almost 60% lower than men,2018-03-09
US unions face looming threat of radical funding cut,2018-03-09
EM investors fail to reap benefits of GDP growth,2018-03-09
More ethical dilemmas for Norway’s oil fund,2018-03-08
Brussels sharpens focus on ‘sustainable’ investment,2018-03-08
Scientist drinks the Kool-Aid before launching green fund house,2018-03-08
People power pushes sustainable investment up the agenda,2018-03-08
Kalanick launches fund after cashing in Uber stock,2018-03-08
Women face battle to grasp lower rungs of corporate ladder,2018-03-08
Carillion investors vent frustration over auditing,2018-03-07
Deutsche Bank nears deal for Nippon Life to anchor DWS float,2018-03-07
Five issues in UK’s corporate governance revamp,2018-03-07
Fund houses pile into direct lending as banks retreat,2018-03-06
Global investors shun UK stock market,2018-03-05
US fund manager diversity under regulatory spotlight,2018-03-05
Too-clever ETFs are a car crash waiting to happen,2018-03-05
"Mover and shakers, March 4",2018-03-05
"Cartoon: Carney flags more than three rate rises, March 5",2018-03-05
European managers attract record €729bn from investors,2018-03-05
Investment consultants questioned over climate change backing,2018-03-05
Fund managers ‘asleep at the wheel’ over fat cat pay,2018-03-04
Cambridge to defy campaigners on divestment,2018-03-04
Passive fund managers face showdown in US gun debate,2018-03-03
Mercer says managers should pay to run clients’ money,2018-03-03
Janus Henderson co-chiefs awarded bumper pay rises,2018-03-03
BlackRock offers clients ways to eschew US gun stocks,2018-03-02
BlackRock to offer clients ways to opt out of gun stocks,2018-03-02
Woodford battles to retain position in cut-throat game,2018-03-02
Blackstone chief’s payout shows health of private equity,2018-03-02
Funds move into US equities just as sell-off resumes,2018-03-02
Is money laundering the favourite crime of America’s elite?,2018-03-02
Schroders and GAM enjoy robust increase in profits,2018-03-01
Schroders defies gloom for active managers,2018-03-01
Neuberger boss Walker dismisses behemoth comparison,2018-03-01
Shares in Neil Woodford’s trust hit new low,2018-02-28
Man Group reports record inflows of $12.8bn in 2017,2018-02-28
Asia provides a glimpse of tomorrow’s technology,2018-02-28
Modern finance must kick its addiction to indices,2018-02-28
ProShares ETFs decrease leverage after market turmoil,2018-02-27
Buoyant markets lift Fidelity to record $5.3bn income,2018-02-27
Fidelity posts record operating income despite active equity fund outflows,2018-02-27
UBS cuts Jupiter to ‘sell’ over fears on flows,2018-02-27
Woodford fund close to cap on unquoted securities,2018-02-27
SLA reins in pay for chiefs Gilbert and Skeoch,2018-02-26
"Movers and shakers, February 26",2018-02-26
Private equity ‘secondaries’ deals hit record $58bn,2018-02-26
Cartoon: The puzzle of making a post-Brexit trade deal work,2018-02-26
Female fund manager bonuses up to 70% below men’s,2018-02-25
Axa IM goes for growth after rebuffing takeover bids,2018-02-25
Brokers and managers grapple with Mifid ‘inducement’ rule,2018-02-24
Trump’s plans for energy dominance meet resistance,2018-02-24
Standard Life seals shift into asset management,2018-02-24
Try timing the market but accept your limitations,2018-02-23
Standard Life Aberdeen sells insurance unit for £3.2bn,2018-02-23
Scandals spur debate over giving to big charities,2018-02-23
Too many boards ask the wrong questions,2018-02-23
Standard Life Aberdeen to quit insurance in £3bn deal,2018-02-22
Asia to rise to 75% of EM index in planned revamp,2018-02-22
Fidelity backtracks on passing on research costs,2018-02-22
List of asset managers that will pay for research,2018-02-22
Blockchain ‘could save asset managers $2.7bn a year’,2018-02-22
Insurers can help close infrastructure gaps,2018-02-21
Deutsche Bank plots March IPO of asset management unit,2018-02-20
Inverse Vix funds: shark chum,2018-02-20
BlackRock bulks up artificial intelligence research,2018-02-19
Brexit shutout fears spur asset managers to act,2018-02-19
Beware the all-knowing macro forecasting genius,2018-02-19
Mixed gender teams lure greater investor inflows,2018-02-19
Cartoon: Neil Woodford’s investment halo slips,2018-02-19
Hedge funds forced to cut fees to lure investors,2018-02-19
"Movers and shakers, February 19",2018-02-19
Blue Noble joins crowded property funds sector,2018-02-19
T Rowe Price pivots from London to Luxembourg,2018-02-18
Investors champion the battle for more women on boards,2018-02-18
Vanguard creates new European stewardship team,2018-02-18
Largest pension scheme cracks down on fund manager pay,2018-02-17
Spooked fund managers look at rivals to London,2018-02-17
Differing fortunes for investors in China,2018-02-16
The Vix horror show will not deter future suckers,2018-02-16
Dalio’s $22bn Europe short exposed to global growth,2018-02-16
Worries over interest rates spread to junk bond funds,2018-02-16
Lloyds pulls the rug from under Standard Life Aberdeen,2018-02-15
Standard Life Aberdeen loses its biggest client,2018-02-15
Standard Life Aberdeen: the one that got away,2018-02-15
Epoch founder predicts a technology dividend age,2018-02-15
Worries over exotic exchange traded funds deepen,2018-02-14
Carillion’s crash exposes corporate governance flaws,2018-02-14
Schwarzman signals likely Blackstone succession,2018-02-13
Cohen fund sued over ‘misogynist’ treatment,2018-02-13
UK investors buy record-breaking amount of funds,2018-02-12
UK fund manager pay suppressed by Brexit uncertainty,2018-02-12
Index error causes Carillion losses for investors,2018-02-12
Wells Fargo staff ‘upset’ by scandal,2018-02-12
Fund managers must act to regain investors’ trust,2018-02-12
"Movers and shakers, February 12",2018-02-12
Pension scheme inflows help German funds push past €3tn,2018-02-12
Cartoon: Capita’s profits warning reverberates,2018-02-12
ETFs smash through $5tn barrier after record month,2018-02-11
Brussels warns UK asset managers of Brexit shutout,2018-02-11
"Copper is still cheap, despite its surging price",2018-02-10
"A 1% fee wipes £100,000 from a £100,000 investment",2018-02-10
Amundi targets place in top-tier global asset managers,2018-02-09
Selling volatility is for consenting adults only,2018-02-09
Asset managers: a fitting conclusion,2018-02-09
FCA’s Andrew Bailey: Why regulators are examining fund managers,2018-02-09
An Englishman’s home can be a fund manager’s castle,2018-02-09
Investors resume bets against market volatility,2018-02-08
Popular mutual fund is victim of market turbulence,2018-02-08
Reits investors locked out over EU rules confusion,2018-02-08
Star fund manager leaves over ‘professional conduct issue’,2018-02-07
Investors should keep calm but stay alert after mini-crash,2018-02-07
Star analyst Huw van Steenis leaves Schroders,2018-02-07
UK church investment fund demands action on gender,2018-02-07
Credit Suisse liquidates ETN product amid market volatility,2018-02-06
Janus Henderson outflows top $10bn in 2017,2018-02-06
Vix/Credit Suisse: Hyman the hunter,2018-02-06
Janus Henderson ends the year with return to net outflows,2018-02-06
Baillie Gifford’s core clients switch to passive funds,2018-02-06
Wall Street sell-off stings low-volatility ETFs,2018-02-06
‘Wizard of Oz’ plans return with $2bn hedge fund,2018-02-05
US pressure over EU plan for change to fund rules,2018-02-05
Stock lending by ETF operators worries investors,2018-02-05
SEC drags feet on bitcoin,2018-02-05
Mifid tips balance against active funds,2018-02-05
ETF growth is ‘in danger of devouring capitalism’,2018-02-05
Index trackers deny any ‘abdication’ of stewardship role,2018-02-05
State Street chief takes aim at cost of servicing,2018-02-05
Value of global pension assets surges to $41.3tn,2018-02-05
"Movers and shakers, February 5",2018-02-05
Cartoon: The Trump presidency,2018-02-05
"Embrace technology or else, report warns",2018-02-05
Bull market foils activist shareholders,2018-02-04
US mutual  funds chop away the dead wood,2018-02-04
Investors pull money out of Woodford funds,2018-02-04
State Street ramps up pressure on executive pay,2018-02-03
Vanguard hosts meeting over fund cost disclosures,2018-02-03
Strong ESG policies are no protection against scandal,2018-02-03
Japan pension fund warns on lack of gender diversity,2018-02-02
New Fed chief Powell a debt man walking,2018-02-02
In the Vanguard: Fund giants urge CEOs to be ‘Force for Good’,2018-02-01
Brussels urged to clarify ‘green’ investment guidelines,2018-01-31
Private equity financing has a new twist,2018-01-31
Spotify listing is template for unicorns riding high,2018-01-30
Mifid II’s cost disclosure regime muddies the waters,2018-01-30
Infra investors seek better performance data,2018-01-30
ETF minnows struggle to catch up to giants,2018-01-30
Vanguard warns of growing threat in ETF market,2018-01-29
Fund industry must work to tackle bad regulations,2018-01-29
Scramble for ‘alternative data’ analysts intensifies,2018-01-29
Individual directors targeted over excessive pay,2018-01-29
Movers and shakers: January 29,2018-01-29
Booming markets mask the death of the cult of equity,2018-01-29
Cartoon: GKN fights off Melrose,2018-01-29
China stamps its authority on fixed income markets,2018-01-29
‘Fund managers should eat their own cooking’,2018-01-28
Active fund managers beat market by just 16p for every £100 invested,2018-01-28
New tax-efficient savings plans tempt Italians,2018-01-27
The cheapest way to profit from a rise in US rates,2018-01-27
Fund trade body urged to apologise over offensive report,2018-01-26
Investors pile into stocks amid economic optimism,2018-01-26
Investing costs revealed — but ‘still hard to find’,2018-01-26
Slippage causes confusion in Mifid II rules row,2018-01-26
JPMorgan to launch fixed-income ETFs in London,2018-01-25
FCA lambasted for ‘worst financial regulation’,2018-01-25
Popularity of bonds driven by risk aversion,2018-01-25
World’s largest ETF roars past $300bn in assets,2018-01-24
ESG is important to fund managers too,2018-01-24
Private equity: flood of cash fuels buyout bubble fears,2018-01-23
"Number of stock indices rises to 3m, survey finds",2018-01-22
The barbell effect turns companies into M&A targets,2018-01-22
Large hidden fund charges revealed by Mifid II rules,2018-01-22
Making America’s asset managers great again,2018-01-22
Movers and shakers — January 22,2018-01-22
US fixed-income investors warned of rocky 2018,2018-01-22
Cartoon — Carillion,2018-01-22
Mifid II caution hits small business research,2018-01-21
"UBS, Morgan Stanley and Belgrave top 2017 table",2018-01-21
Finra’s glasnost may not save its feudal privilege,2018-01-20
Regulators meet over ‘absurd’ performance forecasts,2018-01-20
Secret Brexit decisions worry me — Peter Moores,2018-01-20
Six US market regulation predictions for 2018,2018-01-19
Fink knows passive investing can’t outsource engagement,2018-01-19
Price war bites as world’s largest ETF turns 25,2018-01-19
Asset managers fear delegation changes post-Brexit,2018-01-18
Hungry funds look to switch to active equity,2018-01-18
ESG? SRI? Is your green portfolio really green?,2018-01-18
Boardroom diversity rules could tip investor decisions,2018-01-18
Investors must get to grips with impact of technology,2018-01-17
BlackRock chief gives companies code of conduct,2018-01-16
Retail investors bear the brunt of Carillion losses,2018-01-16
Insurers compete with fund managers for pension pots,2018-01-16
BoJ buying spree still going strong,2018-01-15
Funds seek tax accord on repatriated UK cash,2018-01-15
M&A in asset management sector climbs to 8-year high,2018-01-15
"Movers & shakers, January 15",2018-01-15
Fund managers join fight against virtual AGMs,2018-01-15
Cartoon: January 15,2018-01-15
Fixed-income ETFs are an exciting growth story,2018-01-15
New European rules rely on a bent coin,2018-01-15
Shift to virtual meetings sets stage for shareholder rebellion,2018-01-14
The irreversible rise of the investing machines,2018-01-14
Mis-selling fears erupt over ‘returns of 1m% plus’,2018-01-14
Investors lick lips as China opens to asset firms,2018-01-14
"Immigration, rich old guys and why we need babies",2018-01-13
Global X launches ‘safe’ leveraged shares ,2018-01-13
Fink warns rate rises will swamp tax reform gains,2018-01-12
London’s asset managers fear EU raids,2018-01-12
European ETF market leaps 40% in strong showing,2018-01-12
"ETF managers must be agile, says Lyxor chief",2018-01-11
Volta joins fray in battle for battery technologies,2018-01-11
Ethical investing is not just for millennials,2018-01-09
Investors can ill-afford to ignore China’s equities,2018-01-09
Emerging market sovereigns tap buoyant bond demand,2018-01-09
Cartoon: going long,2018-01-08
"Movers & shakers, January 8",2018-01-08
Goldman and Franklin top worst selling fund ranking,2018-01-08
Warning signs emerge for US Treasury market,2018-01-08
US expats hit as investment platform abandons funds,2018-01-08
Investors shun property funds over price peak fears,2018-01-08
Bitcoin surge helped 2017’s best-performing ETFs,2018-01-07
London may be key to euro-yuan rival to US dollar,2018-01-07
Bull or bear? The big issues we face in 2018,2018-01-06
Milan moves to lure UK asset managers after Brexit,2018-01-06
Mark Mobius to retire from Franklin Templeton,2018-01-05
A major S&P ratio has a whiff of 1929. Is this a bubble?,2018-01-05
Brexit raid on a British financial success story,2018-01-04
Vanguard still world’s fastest-growing asset manager,2018-01-04
Avoid fund managers to keep investment costs low,2018-01-04
EU rule changes prompt Hargreaves and Bestinvest to ditch funds,2018-01-04
Debt is the danger: beware the butterfly moment,2018-01-04
Britain braced for Brexit raid on £8tn fund industry,2018-01-03
ETF providers hope Mifid II will spur European growth,2018-01-03
Legg Mason chief warns of disruption for asset managers,2018-01-03
Mifid II can succeed if it encourages competition,2018-01-02
Stockpickers’ fees set to suffer from ETF price war,2018-01-02
Europe begins countdown to Mifid II,2018-01-01
‘Fear of missing out’ will spur on investors next year,2017-12-29
Index funds: cut-price consciences,2017-12-28
Goldman eyes Dublin for European asset management,2017-12-27
ETFs: uncover the cracks,2017-12-27
Neil Woodford: Brexit bet,2017-12-27
Absolute return funds: take a pill,2017-12-27
Passive funds: grin and bear it,2017-12-27
Smart beta funds pass $1tn in assets,2017-12-27
Big asset managers set to benefit from Mifid II,2017-12-27
Unseen upsides: pessimist fog,2017-12-26
Why activists are fans of social responsibility,2017-12-26
Hidden gyrations underpin 2017 global fund flows,2017-12-22
Why investors should be weaned off tracking to indices,2017-12-20
Cartoon: Frederick’s 20th century attitude problem,2017-12-20
Exchange traded funds: a review of 2017,2017-12-19
London fund managers warn of a ‘sneaky’ Brexit,2017-12-18
Investors lap up EM bonds despite falling ratings,2017-12-18
Sexism in the City: gender crisis in fund management,2017-12-18
Sharp rise in sexual harassment in fund management,2017-12-18
Women annoyed and exhausted by industry sexism,2017-12-18
Fund managers must tackle sexual harassment head on,2017-12-18
Women in asset management tell their stories of discrimination,2017-12-18
Leading asset managers warn on ‘unsustainable’ dividends,2017-12-17
"Movers & shakers, December 18",2017-12-17
‘Arrogant’ slur puts Sier fee probe on knife edge,2017-12-16
Standard Life Aberdeen suffers heavy investor outflows,2017-12-15
Women in Asset Management,2017-12-15
Some gender imbalances are in the genes,2017-12-15
Oil investors face dilemma as demand is likely to fall,2017-12-14
Bitcoin ETFs: making a bomb,2017-12-13
Ashmore is last hold out on research cost disclosure,2017-12-13
FCA delays fresh conduct rules for asset managers,2017-12-13
Russell’s new chief says it’s time to get ‘personal’,2017-12-13
Moneybox app launches Lifetime Isa,2017-12-12
Mifid data delays threaten European fund sales,2017-12-11
UK needs its own business development companies,2017-12-11
Pension funds in the mix for £20bn ‘patient capital’,2017-12-10
International investors chase the red dragon,2017-12-10
Movers & shakers: December 11,2017-12-10
European regulators move to mitigate Brexit threat,2017-12-10
Cartoon: cryptocurrencies,2017-12-10
FCA urges asset managers to report Mifid struggles,2017-12-09
The big losers from Trump’s massive tax reforms,2017-12-08
Investors pour $1.5bn into financial sector funds,2017-12-08
Ten ways to a cheap private school education,2017-12-08
Private equity faces a dilemma: to buy or to sell,2017-12-08
Mifid II impact on investment banking ‘exaggerated’,2017-12-07
Hammond eyes Brexit tax boost for asset managers,2017-12-06
Bold fund managers raise £2.3m for cancer research,2017-12-06
"Retirement plans’ black hole is deep, dark and scary",2017-12-06
US tech-focused ETF duo hit by $1.57bn outflows,2017-12-05
ETF providers better bet than products they sell,2017-12-05
Deutsche Bank to rebrand its asset management arm,2017-12-05
Investors fail to back votes on climate disclosure,2017-12-05
Macquarie hunts for acquisition targets in Europe,2017-12-04
EU fund houses demand say on US executive pay,2017-12-04
ETF inflows on course to surpass $600bn in 2017,2017-12-03
Cartoon: robo-advice and AI,2017-12-03
‘I have never sold a Macquarie share in 30 years’,2017-12-03
Movers & shakers: December 4,2017-12-03
Global regulatory body to launch fresh ETF probe,2017-12-02
Bitcoin is a faith-based asset for a populist era,2017-12-02
Neil Woodford: prophet warning,2017-12-01
Machine learning poses challenges for Wall Street,2017-12-01
Fidelity to pass $42m research costs on to clients,2017-12-01
Italy’s Mediobanca launches private bank in asset management push,2017-12-01
Woodford warns of stock market ‘bubble’,2017-12-01
Neil Woodford: Will investors keep the faith?,2017-12-01
Legg Mason launches ‘cutting edge’ parental leave plan,2017-11-30
Six bond fund managers give their top tips for 2018,2017-11-30
Fund houses probed by FCA for IPO price collusion,2017-11-29
UK’s new industrial strategy is a breakthrough,2017-11-29
Technology the ‘pain trade’ of 2017 for EM funds,2017-11-29
Trump tax bills push US jobs and factories abroad,2017-11-28
Legg Mason joins 30% Club with 2 women director hires,2017-11-28
Child labour fuels fear of reputational risk,2017-11-27
‘Alt beta’ disrupts hedge funds,2017-11-27
BlackRock and Vanguard are smart beta’s biggest winners,2017-11-27
Smart beta: what’s in a name?,2017-11-27
Lack of smart beta benchmarks fuels concerns,2017-11-27
