title,date
Foreign funds shun Saudi as it enters key index,2019-05-20
"Woe is us, says high street – but it is leases to blame",2019-05-20
Fund groups tested on gender pay,2019-05-20
Index companies feel the chill,2019-05-20
Investors face arduous task in forcing change at energy groups,2019-05-20
"Movers and shakers, May 20",2019-05-20
"Cartoon, May 20",2019-05-20
ESG accelerates into the investment mainstream,2019-05-20
Derville Rowland: Ireland can fill Britain’s shoes after Brexit,2019-05-19
Union Investment criticises blue-chip governance,2019-05-19
Fund managers go to war on plastic waste,2019-05-18
Ireland and Luxembourg warn of fund-manager site inspections,2019-05-18
Fund-management giants vie to crack the China market,2019-05-18
LGIM announces it will vote against Metro Bank chair,2019-05-17
Polisario case reveals high stakes behind investors’ ESG enthusiasm,2019-05-17
Women-led hedge funds try to crack the boys’ club,2019-05-16
Time to cast your vote in the Eurovision fund contest,2019-05-16
Canada pension plan chief warns over illiquid private assets,2019-05-15
"Issue green gilts, fund managers tell UK government",2019-05-15
The $119tn question: how do we get China to save for retirement?,2019-05-15
BofA survey shows investors bracing for falls,2019-05-14
Standard Life Aberdeen suffers heavy revolt over CFO pay,2019-05-14
Pimco and TCW funds whacked in Morningstar ratings revamp,2019-05-14
Deutsche talks with UBS hit hurdle on asset manager deal,2019-05-13
SEC gives green light to first ‘negative fee’ fund,2019-05-13
Liquidnet expands with RSRCHXchange purchase,2019-05-13
Indices will help firms avoid cyber-goofs,2019-05-13
Lionel Aeschlimann: art will help us see the world differently,2019-05-13
Fears of QE-forever cycle turns spotlight on hedging,2019-05-13
Nissan’s parable of shoddy governance,2019-05-13
Bundled loans bolster green bond expansion drive,2019-05-13
Britain risks losing its edge on stewardship,2019-05-13
Companies asked to come clean on climate lobbying,2019-05-13
‘Green’ funds can fall short of buyer expectations,2019-05-13
ETFs pull in $46bn in new cash inflows,2019-05-13
Cartoon May 13,2019-05-13
ESG ratings agencies fulfil the need for know-how,2019-05-12
Crypto hedge funds live to fight another day,2019-05-12
Welcome to brave new world of negative-fee funds,2019-05-11
Challenge to funds groups over securities lending,2019-05-11
Investors in scandal-hit LCF given hope of UK redress,2019-05-10
Investors’ nerves tested by US-China trade tension,2019-05-10
Blind faith in the high equity return cult will lead to disaster,2019-05-10
Wealth manager Charles Stanley to cut senior roles,2019-05-09
Fund manager Rathbones hit by slowing growth despite asset rise,2019-05-09
Amundi investors urged to vote against chief’s pay deal,2019-05-09
Former GAM fund manager Tim Haywood blocked from AGM,2019-05-08
JPMorgan poised to take control of Chinese asset manager,2019-05-08
How the fund industry can flush out the closet trackers,2019-05-08
Federated snaps up $14bn of fund assets from PNC,2019-05-07
Stock buybacks ramp up while investors turn to ETFs — BofA,2019-05-07
How Mifid has made its mark in the US,2019-05-07
Reform flips cost of research on to small companies,2019-05-07
Why Mifid spoiled the business of matchmaking,2019-05-07
Where now for the rules that rocked European finance?,2019-05-07
Towards a Hippocratic oath for impact investing,2019-05-06
"Larry Fink, Barclays and the deal of the decade",2019-05-06
The Rich Column: the wealthy are increasingly interested in ESG,2019-05-06
Quant equity funds hit by $25bn outflows,2019-05-06
Brunei’s stoning punishment will test industry zeal,2019-05-06
"Cartoon, May 6",2019-05-06
Insurance looks beyond safety of traditional markets,2019-05-06
"Movers and shakers, May 6",2019-05-06
"Nancy Prior, the unassuming trillion-dollar woman",2019-05-05
US wealth management becomes hotbed of M&A,2019-05-04
BlackRock and HSBC launch Saudi funds,2019-05-04
Norway’s $1tn oil fund rebounds to third best quarterly returns,2019-05-03
Impact-investing golden group presents a cautionary story,2019-05-03
Schroders investors stage pay revolt,2019-05-02
The SEC must solve its cryptocurrency custody conundrum,2019-05-02
Brexit drains £30bn from UK funds,2019-05-02
Arki Busson’s hedge fund LumX posts $8.7m loss,2019-05-01
Watchdog probes financial ‘advice gap’,2019-05-01
Schroders and Woodford come low in value ranking,2019-05-01
Redress scheme accused in London Capital & Finance scandal,2019-04-30
Neil Woodford sells stake in P2P Global to meet redemptions,2019-04-30
Jupiter sees further fund outflows but assets edge up ,2019-04-30
St James’s Place posts strong sales despite macro uncertainty,2019-04-30
Do women really make better investors than men?,2019-04-30
Active or passive? There are reasons to own both,2019-04-29
Global asset managers jostle for China prize,2019-04-29
"Movers and shakers, April 29",2019-04-29
UBS seeks to retrench with DWS tie-up,2019-04-29
"Cartoon, April 29",2019-04-29
Poll shows only a few funds adopt climate goals,2019-04-28
Azimut becomes a Hydra — with five heads,2019-04-28
Private equity: secondary education,2019-04-28
High trading fees hit absolute return funds,2019-04-28
Anti-greenwash drive intensifies,2019-04-28
Mitesh Sheth: from Sanskrit to spreadsheets,2019-04-27
Andrew Mitchell takes paid position at Arch,2019-04-27
Alliance Trust’s reinvention is a lesson to others,2019-04-26
Neil Woodford’s Patient Capital tests investor patience,2019-04-26
Washington boxes in Iran and spooks the world,2019-04-26
Invesco counts the cost of uncertainty over Brexit,2019-04-25
Shareholder advisers call for protest vote against GAM,2019-04-25
Are you a great investor — or is it just the market?,2019-04-25
Buyer beware: ESG screening has its faults,2019-04-25
Wall Street hits fresh peak as earnings fears recede,2019-04-24
Guernsey lifts suspension of two Neil Woodford companies,2019-04-23
UBS and Deutsche asset managers in merger talks,2019-04-23
Exchange-traded bond funds crash through $1tn in assets,2019-04-23
UBS remains top-performing foreign fund house in China,2019-04-22
Beware managers taking on too much capital,2019-04-22
"Movers and shakers, April 22",2019-04-22
Climate resilience and investment portfolios,2019-04-22
"Cartoon, April 22",2019-04-22
Man Group urges investors to back Jersey move,2019-04-21
Sovereign wealth funds eye a low-oil future,2019-04-20
Robert Zoellick vacates AllianceBernstein chair,2019-04-19
DE Shaw to revert to ‘3 and 30’ model as costs bite,2019-04-19
Investors advised to reject Leonie Schroder board appointment ,2019-04-19
‘Non-transparent’ ETFs set to be a boon for fund managers ,2019-04-19
Funds continue to show appetite for US equities,2019-04-19
Crisis-hit GAM approaches potential acquirers,2019-04-18
Funds full of returns and do-goodery now harder to find,2019-04-18
Call for cap on workplace pension fund fees to be scrapped,2019-04-18
PG&E creates world-class hangover for wind and solar investors,2019-04-18
BlackRock rebound heralds wider fund-sector recovery,2019-04-18
Short-term thinking is undermining sustainable business models,2019-04-18
Shawn Parker — an advocate for smart beta strategies,2019-04-18
Ohio National faces down commission lawsuits,2019-04-18
Stock market volatility challenges both meek and brave,2019-04-18
Woodford sells £42m property stake to protégé Barnett,2019-04-18
Thomas Van Dyck — from no-nukes activist to ESG advocate,2019-04-18
Asset managers strive to cut out banks from forex dealing,2019-04-18
FT 400 Top Financial Advisers stress their big picture role,2019-04-18
GAM strikes a deal to help put crisis behind it,2019-04-17
Hedge funds realise going long has its rewards  ,2019-04-17
Niche asset nears mainstream as investors warm to EU carbon market,2019-04-17
IBM first-quarter revenues miss as cloud unit cools,2019-04-16
"Markets are poised for ‘melt-up’, says BlackRock’s Fink",2019-04-16
Ashmore/bond funds: EMpowered,2019-04-16
AllianzGI chief changes tack on the promise of M&A,2019-04-16
LGIM toughens stance on ‘overboarding’ directors,2019-04-15
BlackRock moves to hire GF Securities boss for China operations,2019-04-15
Jan Erik Saugestad on investing responsibly,2019-04-15
"Long-term investing, a necessity and a choice",2019-04-15
Global asset managers eye Chinese investors,2019-04-15
Pakistan slide calls emerging market status into question,2019-04-15
"Movers and Shakers, April 15",2019-04-15
"Cartoon, April 15",2019-04-15
Exotix rebrands as ‘Netflix-style’ data supplier,2019-04-14
"Fund managers pay UK politicians £236,000",2019-04-14
Shareholders take company auditors to task,2019-04-14
Broker research spending slashed after Mifid II,2019-04-13
China’s ‘funds by phone' culture nears maturity,2019-04-13
Glass Lewis gives groups right of reply,2019-04-13
BlackRock boss Larry Fink paid $24m in 2018,2019-04-12
Neil Woodford’s stakes in three private companies suspended,2019-04-12
T Rowe Price shake-up combines global sales activities,2019-04-12
World Bank arm launches ‘impact’ standards,2019-04-12
Cleaner shipping will drive up motoring and flying costs,2019-04-12
Investors flee UK stock funds on Brexit worries,2019-04-11
Robots scour earnings calls for ‘vague’ signals to sell,2019-04-11
ETF investor inflows tumble 28% in first quarter,2019-04-10
IMF warns on risk of rapid exit from EM assets,2019-04-10
Public groups can learn from private philosophy,2019-04-10
S&P would be wise to aim its ESG sights at Japan,2019-04-10
Has Neil Woodford’s luck turned? Or is the writing on the wall?,2019-04-09
Hargreaves and Share Centre to buy £1.5bn of JPMorgan assets,2019-04-09
Global investors are shunning Brexit-battered stocks,2019-04-09
Fink says BlackRock aims to control Chinese asset manager,2019-04-08
Interactive Investor to roll out ‘Netflix pricing’,2019-04-08
Who benefits from investment platforms?,2019-04-08
M&A vultures circle over fund groups,2019-04-08
"Movers and shakers, April 8",2019-04-08
Private equity managers hit road in quest for $1tn,2019-04-08
"Cartoon, April 8",2019-04-08
Sovereign wealth funds must choose a new path,2019-04-07
Nick Train doubles Schroders stake to 8%,2019-04-06
Andrew Carter: last of the fund industry elders,2019-04-06
Nervous investors ramp up cash in investment accounts,2019-04-05
Investors flee stock market at peak Isa season,2019-04-05
Beyond Brexit: what it means for your wealth,2019-04-05
Central bank independence is as dead as vaudeville,2019-04-05
MarketAxess muscles into ETF industry with Virtu tie-up,2019-04-05
Crisis-hit GAM loses three directors as it battles to recover,2019-04-04
Protectionist attack on shareholder rights matters to all of us,2019-04-04
BlackRock analysis helps define climate-change risk,2019-04-04
Europe’s $850bn ETF sector fears no-deal Brexit crunch,2019-04-04
Oxford Nanopore’s flotation plans are a boon for Neil Woodford,2019-04-03
"'Greenwashing is rampant’, warns chief of global accounting body",2019-04-02
BlackRock shakes up management as fee pressure grows,2019-04-02
Ontario Teachers’ Pension Plan faces sharp fall in returns,2019-04-02
UK fund groups’ gender pay gap data is ‘sobering’,2019-04-01
Not all measures of value stocks are created equal,2019-04-01
City watchdog ordered to probe LCF collapse,2019-04-01
Fidelity’s alleged ‘pay to play’ fee highlights income dilemma,2019-04-01
How to spot the winners and losers in fund management,2019-04-01
Value of impact investment universe grows to $502bn,2019-04-01
Greenwashing purge sees sustainable funds lose share in Europe ,2019-04-01
ETF dividend chasers told to ‘do your homework’,2019-04-01
Investments in bond-based ETFs head for $1tn landmark,2019-04-01
Is cannabis the new bitcoin?,2019-04-01
BoJ’s dominance raises concern on distorting influence,2019-04-01
Watchdogs probe systemic risks of passive fund growth,2019-04-01
"Movers and shakers, April 1",2019-04-01
Hedge fund fee model morphs from ‘two and 20’ to ‘one or 30’,2019-04-01
"Cartoon, April 1",2019-04-01
No-deal Brexit plans cause sales headaches for asset managers,2019-03-31
Companies do better when they tie outgoing CEOs to keeping stock,2019-03-31
Fund sector’s trillion-dollar club tickles Dimensional’s fancy,2019-03-30
Half of UK fund groups say gender pay gap is widening,2019-03-30
LCF’s collapse exposes confusion over shadow savings rules,2019-03-29
US pressure building on investors in China surveillance group,2019-03-29
Investors face ‘unacceptable’ delays to switch platforms,2019-03-29
My Green New Deal column did not monger enough scare,2019-03-29
Raising the bar into a safe haven,2019-03-29
GAM executives nervous over slipping repayment deadlines,2019-03-29
MPs blast fund groups over conflict of interest on pay,2019-03-28
Marketing outfit behind scandal asked for money back,2019-03-27
£60bn workplace pensions face pressure to invest in infrastructure,2019-03-27
Emerging market equities justify their existence,2019-03-27
Big companies shun labour survey backed by influential investors,2019-03-27
Fund managers turn activist in bid to prove their worth,2019-03-26
Do alternatives deserve a place in your portfolio?,2019-03-26
MPs urge business to cap ‘eye-watering’ bosses’ pay,2019-03-26
Nikos Stathopoulos: My lesson from Acuris,2019-03-25
"Movers and shakers, March 25",2019-03-25
Lower fees and switch to passive will hammer active managers,2019-03-25
Cartoon: March 25,2019-03-25
Investors to target tarnished directors over audit failures,2019-03-24
Quants: is it time to tweak the code?,2019-03-23
Pension inequality top investor gripe as AGM season nears,2019-03-22
Prudential employee earns more than double chief executive,2019-03-22
Regulators in spotlight over mini-bond scandal,2019-03-22
Hedge fund launches fall to 18-year low,2019-03-22
St James’s Place defends Woodford’s record on its own funds,2019-03-22
Top five GAM shareholders nurse losses of $840m,2019-03-22
America’s Green New Deal needs copper but is there enough?,2019-03-22
"Janus Henderson chief receives 26% salary rise, despite heavy outflows",2019-03-21
The Big Short’s Eisman raises bets against Canadian banks,2019-03-21
Allianz turns picky as it shops for asset managers,2019-03-21
Market pressure blurs the line between US asset and wealth managers,2019-03-21
Index providers become kingmakers for Saudi stocks,2019-03-21
Asset managers slash expenses as ‘feemageddon’ bites,2019-03-21
"NZ challenge to Facebook, Google and Twitter over violent content",2019-03-20
SEC to examine competition among US asset managers,2019-03-20
A look behind the scandal that rocked GAM Holding,2019-03-20
We ignore the index providers’ power at our peril,2019-03-20
Lloyds faces £300m bill for SLA divorce,2019-03-19
Standard Life Aberdeen claims victory in Lloyds Bank row,2019-03-19
Saudi Arabia takes first step into equity benchmarks,2019-03-18
Busson hedge fund gives up Swiss licence and cuts jobs,2019-03-18
Asset management: inside the scandal that rocked GAM,2019-03-18
Assets in European absolute return funds drop to €86bn,2019-03-18
Fund managers raise their game on home-grown talent,2019-03-18
"Movers and shakers, March 18",2019-03-18
"Brexit moves ‘will reduce UK tax base, influence and jobs’",2019-03-18
"Cartoon, March 18",2019-03-18
"ESG has no financial benefit for infrastructure groups, study finds",2019-03-18
Alan Miller: the star stockpicker who switched to ETFs,2019-03-17
EU to take fresh look at fair deal for consumers,2019-03-17
US college cheating scandal snares fund sector executives,2019-03-16
Fund groups must put investors first as FCA brings in new rules,2019-03-16
Pimco hosted admissions counsellor in bribery scandal,2019-03-15
Wealth management customers set for fee shock in April,2019-03-15
"Active investors are depressed, but not depressed enough",2019-03-15
SLA shake-up fails to appease disgruntled shareholders,2019-03-15
Puerto Rico’s number-crunching frustrates even the best minds,2019-03-15
Woodford races to boost performance as investors flee funds,2019-03-15
US equity funds benefit from uncertainty elsewhere,2019-03-15
Woodford accuses critics of misleading investors,2019-03-14
Neil Woodford: a bad case of shingles,2019-03-14
FCA seeks industry-wide cap on fund supermarket exit fees,2019-03-14
Passive assets poised to surpass active in the US by 2021 — Moody’s,2019-03-14
Brookfield’s ‘yin and yang’ deal with Oaktree,2019-03-14
JPMorgan bets on ‘latecomer advantage’ in passive push,2019-03-14
BNP Paribas fund arm plans €1bn coal divestment,2019-03-14
Canada’s Brookfield gobbles up Oaktree to challenge Blackstone,2019-03-14
Brookfield/Oaktree: alt country blues,2019-03-13
Standard Life Aberdeen/fund managers: juncture puncture,2019-03-13
Brookfield takes control of Oaktree in $4.7bn deal,2019-03-13
"One in three asset managers could disappear, says Invesco chief",2019-03-13
Gilbert steps down as co-chief of Standard Life Aberdeen,2019-03-13
The EU must act now to beat the bad guys behind money laundering,2019-03-13
JPMorgan edges closer to zero fees in a push for passive,2019-03-11
Head of Nikko Asset Management resigns after lawsuit,2019-03-11
Man Group chief executive’s pay more than halves,2019-03-11
Catherine Howarth is on a mission to hold asset managers to account,2019-03-11
Frustration over Mifid and Priips hits boiling point,2019-03-11
Fund industry jobs predicted to fall for first time in a decade,2019-03-11
Good stewardship must begin with fiduciary duty,2019-03-11
"Movers and shakers, March 11",2019-03-11
Financial industry fails to enthuse female clients,2019-03-11
"Cartoon, March 11",2019-03-11
"Hot-button topics this AGM season: pay, diversity and the climate",2019-03-10
Lansdowne woes mirror rest of hedge fund industry,2019-03-10
Investors put US prisons companies under scrutiny,2019-03-10
Norway’s investment cull leaves oil majors spared but shaken,2019-03-09
Woolnough under pressure on pay after Optimal Income fund suffers,2019-03-09
Invesco blockchain ETF to launch on London stock exchange,2019-03-09
"Forget the film glamour, US finance workers are set to be squeezed",2019-03-08
Leonie Schroder replaces late father on Schroders board,2019-03-07
Schroders/family companies: DNA test,2019-03-07
BlackRock steps up ‘sin’ stock and ESG disclosures,2019-03-06
Fund sector needs Whitehall changes to make apprenticeships work ,2019-03-06
"A merger, a sale, a break-up, a turnround: what next for DWS?",2019-03-04
Halfhearted regulators are to blame for Mifid and Priips confusion,2019-03-04
"Invesco, Dodge Cox and Wellington eye global adoption of Mifid II",2019-03-04
"Movers and shakers, March 4",2019-03-04
PE managers turn to rivals to fund exit of founding partners  ,2019-03-04
"Cartoon, March 4",2019-03-04
"Christian investors to target Exxon, Amazon and Broadcom on tax",2019-03-03
New York and Boston lose fund industry jobs to cheaper cities ,2019-03-02
Canadian cannabis fund returns 50% in two months,2019-03-02
John Havens retires as hedge fund chairman,2019-03-01
Neil Woodford’s income fund offloads unlisted stocks for £73m,2019-03-01
GAM lays off whistleblower at heart of crisis for Swiss fund group,2019-03-01
Jupiter: ode to joy,2019-03-01
Jupiter jumps on smaller cut to dividend,2019-03-01
Martin Currie promotes Julian Ide to CEO,2019-02-28
A clearing house crisis will pose a particular threat to Europe,2019-02-28
UK regulator dismisses asset managers’ criticisms of cost disclosure rules,2019-02-28
ESG is more than ‘good karma’ but analysis can help pick a winner,2019-02-28
US companies make slow progress on gender diversity ,2019-02-28
"Property funds likely to halt trading, says rating agency",2019-02-26
Women take more CEO roles at asset managers,2019-02-26
Insurer RSA poaches Jupiter finance chief Charlotte Jones,2019-02-26
FCA says Mifid II has had ‘positive’ effects,2019-02-26
FCA says Mifid II to cut investor costs by £1bn,2019-02-25
L&G/fund management: Scrimgeour scrums down,2019-02-25
Kim-Trump summit is Vietnam’s moment to seize,2019-02-25
Fund sector wishlist for the post-Brexit world,2019-02-25
L&G picks Michelle Scrimgeour as investment chief,2019-02-25
Why the gloom over China? I predict a trade deal with the US,2019-02-25
"‘Follow the benchmarks’ hits returns, says markets expert",2019-02-25
Madoff victims accuse Luxembourg of failing to take action,2019-02-25
"Movers and shakers, February 25  ",2019-02-25
Low valuations give M&A investors the right cards,2019-02-25
"Cartoon, February 25",2019-02-25
"Supermancos, the fund businesses winning big from Brexit",2019-02-24
Pensions industry welcomes FCA Brexit assurance ,2019-02-24
All eyes on Jupiter as more investors short stock,2019-02-23
Credit rating agencies turn attention to ESG risk,2019-02-23
"£3.6bn stuck in UK ‘orphan funds’, warns report",2019-02-23
Neil Woodford endures tough week in the market,2019-02-22
Palladium price bubble forces critics to admit they were wrong,2019-02-22
Activist Edward Bramson loses support of key ally in Barclays campaign,2019-02-21
Axa IM results dented by large mandate loss,2019-02-21
"Fund groups nod through huge CEO pay deals, says non-profit group",2019-02-21
Regulator fines two asset managers over IPO collusion,2019-02-21
"Schroders patriarch, Bruno Schroder, dies at 86",2019-02-21
GAM sacks star portfolio manager for ‘gross misconduct’,2019-02-21
Aberdeen launches fund that will track index of 140 hedge funds,2019-02-21
How to ‘Marie Kondo’ your investment portfolio,2019-02-20
Focus should be on active stewardship to restore trust in business,2019-02-20
Big asset managers cut research costs at higher rate ,2019-02-18
LGIM’s Mark Zinkula leaves influential asset management task force,2019-02-18
Investors and their managers climb the steep ESG learning curve ,2019-02-18
"Behold the giants, the vast new buyout funds of private equity",2019-02-18
BlackRock and Vanguard pull in 57% of global fund flows in 2018,2019-02-18
"Movers and shakers, February 18 ",2019-02-18
"Cartoon, February 18",2019-02-18
SLA clinches Asia deal after Japan’s Mitsubishi offloads stake ,2019-02-17
Meet the boss of one of Europe’s top hedge fund performers,2019-02-17
Investors warn executives that pensions fairness is vital ,2019-02-16
M&A activity in fund sector breaks 11-year record,2019-02-16
Janus Henderson property fund changes pricing amid outflows,2019-02-15
Mexican leopard won’t change its spots over pipeline contracts,2019-02-15
Ashmore chief to cut stake below 30% after ‘creeping control’ row,2019-02-14
Amundi lifts earnings despite €50bn hit in final quarter,2019-02-13
"Day late, dollar short? In impact investing, urgency is vital",2019-02-13
Euronext Dublin beefs up European fund-listing role,2019-02-13
Charles Schwab and Fidelity intensify battle for ETF business  ,2019-02-12
Reviews shine light into vexed issue of investment consultants ,2019-02-11
Fidelity and Allianz performance-fee funds struggle to pull in money,2019-02-11
Investors’ smart money piles into smart beta ETFs,2019-02-11
"Movers and shakers, February 11",2019-02-11
Investors demand huge fee discounts from asset managers,2019-02-10
Deadly dam burst prompts investors to review mining stocks,2019-02-10
"Denise Voss, the American helping Luxembourg run its money",2019-02-10
EU governments provide Brexit relief for asset managers,2019-02-10
Asset managers question value of lavish sponsorships,2019-02-09
"Biggest risk to quant funds is loss of confidence, says QMA chief",2019-02-09
Woodford named in list of poor performing ‘dog funds’,2019-02-08
Sanders and Warren take fund groups to task over palm oil,2019-02-08
Investors are wrong about both hedge funds and infrastructure,2019-02-08
UK property funds on daily watch as outflows surge,2019-02-07
Fund industry must use the right type of machine learning,2019-02-06
Retail investors return to Wall Street,2019-02-05
FCA fines ex-Newton fund manager over IPO pricing,2019-02-05
Janus Henderson assets under management dive $50bn,2019-02-05
Watchdog urges funds to cut  jargon,2019-02-05
"Tuesday, February 5",2019-02-05
How the ‘bond king’ Bill Gross lost his crown,2019-02-04
Bill Gross: coupon quitter,2019-02-04
FCA orders more fund disclosure from asset managers,2019-02-04
Tell the politicians: asset managers aren’t monsters,2019-02-04
How blockchain can help disrupt the fund admin chain,2019-02-04
Italian investment industry prepares for big drop in sales,2019-02-04
"Movers and Shakers, February 4",2019-02-04
"End the clash over EU research rule, SEC urged",2019-02-03
China stocks wounded by trade war fears,2019-02-03
"Barings, an old name with a new purpose",2019-02-02
"Climate fight will upheave fund sector, says archbishop",2019-02-02
Asset managers count the cost of big squeeze on fees,2019-02-01
Glencore’s coal-stained black flag snags in investors’ ESG screens,2019-02-01
EU and UK regulators agree Brexit deal for asset managers,2019-01-31
Buyout groups line up €1.5bn-plus bids for Primonial,2019-01-31
Fixed income funds fail to push companies on climate change,2019-01-31
Invesco suffers $28bn in outflows in 2018 amid Brexit fears,2019-01-30
Rising volatility may boost yen but hit dollar,2019-01-30
Funds stock up on Chinese staples and healthcare stocks,2019-01-30
Disclosure is a lure for green bond investors,2019-01-30
New UK stewardship code to look at adoption of ESG criteria,2019-01-30
Why investors suck at selling stocks,2019-01-29
JPM Asset Management wins go-ahead to sell funds into China,2019-01-29
JPMorgan Asset Management wins approval to sell HK funds in China,2019-01-29
Ant Financial’s money fund shrinks to 2-year low,2019-01-28
Young people must act: money managers will not fix the world,2019-01-28
