title,date
H2O hires advisers as it races to dispose of illiquid debt,2021-02-26
Protecting your money from Covid-23,2021-02-25
A Spac ménage à trois gets messy for private equity,2021-02-25
Investors increase bets on Ark fund losing value ,2021-02-24
Hedge funds’ bitcoin trade helps lift Grayscale assets to $38bn ,2021-02-24
HANetf recruits top industry executive Manooj Mistry,2021-02-24
Wells Fargo/funds: land of giants,2021-02-23
Wells Fargo agrees sale of asset management arm to private equity for $2.1bn,2021-02-23
Taiwan’s global bond ETF market suffers sharp reversal in 2020,2021-02-23
UK companies face greater scrutiny on climate risks at upcoming AGMs       ,2021-02-22
Trinity College Cambridge to dump fossil fuel companies this year ,2021-02-22
ESG investment favours tax-avoiding tech companies,2021-02-22
Asset managers rush to shore up portfolios against inflation ,2021-02-20
Ranks of ‘dog’ funds swell by 33 per cent ,2021-02-19
Do not rule out a market panic next month,2021-02-19
Covid-19 forces electronic shift in bond markets,2021-02-19
Neil Woodford’s rocky return,2021-02-19
Surge in ESG queries spurs ETF hiring spree at DWS,2021-02-19
Millennium emerges as top hedge fund investor in Spacs,2021-02-19
North America’s first bitcoin ETF captures flurry of trading on debut,2021-02-18
City regulator under fire from UK parliament over Woodford probe,2021-02-18
What does institutional bitcoin mean? ,2021-02-18
"More than 10% of ETFs have made changes to their index, data show",2021-02-18
Ariel and JPMorgan to invest in minority-owned companies  ,2021-02-17
Managing your investments during retirement ,2021-02-17
H2O hires advisers as it races to dispose of illiquid debt,2021-02-26
Protecting your money from Covid-23,2021-02-25
A Spac ménage à trois gets messy for private equity,2021-02-25
Investors increase bets on Ark fund losing value ,2021-02-24
Hedge funds’ bitcoin trade helps lift Grayscale assets to $38bn ,2021-02-24
HANetf recruits top industry executive Manooj Mistry,2021-02-24
Wells Fargo/funds: land of giants,2021-02-23
Wells Fargo agrees sale of asset management arm to private equity for $2.1bn,2021-02-23
Taiwan’s global bond ETF market suffers sharp reversal in 2020,2021-02-23
UK companies face greater scrutiny on climate risks at upcoming AGMs       ,2021-02-22
Trinity College Cambridge to dump fossil fuel companies this year ,2021-02-22
ESG investment favours tax-avoiding tech companies,2021-02-22
Asset managers rush to shore up portfolios against inflation ,2021-02-20
Ranks of ‘dog’ funds swell by 33 per cent ,2021-02-19
Do not rule out a market panic next month,2021-02-19
Covid-19 forces electronic shift in bond markets,2021-02-19
Neil Woodford’s rocky return,2021-02-19
Surge in ESG queries spurs ETF hiring spree at DWS,2021-02-19
Millennium emerges as top hedge fund investor in Spacs,2021-02-19
North America’s first bitcoin ETF captures flurry of trading on debut,2021-02-18
City regulator under fire from UK parliament over Woodford probe,2021-02-18
What does institutional bitcoin mean? ,2021-02-18
"More than 10% of ETFs have made changes to their index, data show",2021-02-18
Ariel and JPMorgan to invest in minority-owned companies  ,2021-02-17
Managing your investments during retirement ,2021-02-17
Millennium emerges as top hedge fund investor in Spacs,2021-02-19
North America’s first bitcoin ETF captures flurry of trading on debut,2021-02-18
City regulator under fire from UK parliament over Woodford probe,2021-02-18
What does institutional bitcoin mean? ,2021-02-18
"More than 10% of ETFs have made changes to their index, data show",2021-02-18
Ariel and JPMorgan to invest in minority-owned companies  ,2021-02-17
Managing your investments during retirement ,2021-02-17
Call for SEC to regulate index providers as investment advisers,2021-02-17
Neil Woodford’s relaunch plan prompts calls for independent inquiry,2021-02-16
ESG demand prompts more than 250 European funds to change tack,2021-02-16
"US ETF investors mainly motivated by tax loophole, study shows",2021-02-15
‘Red flags’ over market abuse rise at asset managers during lockdowns,2021-02-15
Leadership change at Amundi and BlackRock sparks fresh rivalry ,2021-02-14
CIO of £19bn pension pot casts doubt over returns from illiquid assets,2021-02-14
New criteria for chiefs’ bonuses: diversity and climate change,2021-02-12
Investors pour record $58bn into global stock funds in single week,2021-02-12
Investment firm Covalis looks to raise $1bn for ESG fund,2021-02-12
T Rowe Price eliminates brokerage commissions on third-party ETFs ,2021-02-12
Is the party over for top tech stocks?,2021-02-12
"Big money ditches New York, moves family to Palm Beach",2021-02-12
The ‘stonk’ bubble poses significant global risks,2021-02-11
Ark's Cathie Wood dismisses bubble talk and Tesla doubters,2021-02-11
CSOP kicks off launch of Hong Kong’s Star Market ETFs,2021-02-11
Amundi/Valérie Baudson: she covers the waterfront,2021-02-10
Amundi appoints Valérie Baudson as chief executive ,2021-02-10
FT returns to indices business with Wilshire partnership ,2021-02-10
Direct indexing looks set to disrupt the retail ETF market ,2021-02-10
UK stocks creep back into favour after years of ‘benign neglect’,2021-02-10
Fallen angel ETFs face potential fall from grace,2021-02-09
BlackRock’s new Asia-Pacific chief sees Hong Kong retaining power  ,2021-02-09
Social media sentiment ETF to launch in wake of Reddit rebellion,2021-02-08
Ikea foundation bets $250m on  green investment fund ,2021-02-08
Hedge fund Marshall Wace seeks venture capital deals,2021-02-08
High-flying Bird pilots new path at Standard Life Aberdeen  ,2021-02-07
Sovereign wealth funds sidestep climate change threat,2021-02-07
BlackRock urged to take tough line with HSBC over climate change,2021-02-06
ESG funds defy havoc to ratchet huge inflows,2021-02-06
"Buy coal-fired power plants, shut them down and reap cost-plus profits",2021-02-05
Where do the next generation of investors go from here?  ,2021-02-05
Money pours into US loan funds as growth and inflation expectations rise,2021-02-05
South Korea ETF price war intensifies,2021-02-04
Future facing investor anger over proposed £40m CEO bonus scheme ,2021-02-04
Kuwait wealth fund’s diplomatic immunity challenged in UK tribunal,2021-02-03
Exchanges compete to improve ETF investor experience,2021-02-03
How to find a financial adviser ,2021-02-03
Steve Cohen’s Point72 raises $1.5bn,2021-02-02
Boutique fund managers hit Brexit turbulence,2021-02-02
What is a buffered ETF?,2021-02-01
Buffered ETF popularity surges but regulatory hurdle threatens ,2021-02-01
Tesla champion Ark Investment outguns Wall Street titans,2021-02-01
Standard Life Aberdeen’s ‘reset guy’ promises growth revival ,2021-01-31
Aviva will use its ‘ultimate sanction’ to force action on global warming,2021-01-31
Bubble fears grow as China fund launches attract huge inflows,2021-01-30
The wave of populism shaking Wall Street,2021-01-29
Wall Street’s new mantra: green is good,2021-01-29
The battle ahead: war is coming for your money,2021-01-29
UK looks into ETF hub launch to boost industry post-Brexit,2021-01-29
Franklin Templeton named worst-selling fund manager of 2020,2021-01-29
Investors dump State Street ETF after GameStop weighting surges,2021-01-28
China and Japan expand ETF connectivity scheme,2021-01-28
Jane Street: the top Wall Street firm ‘no one’s heard of’  ,2021-01-28
UK pension schemes face new climate risk reporting rules,2021-01-27
Investors call for more clarity on Singapore ESG fund labels,2021-01-27
UK government plans post-Brexit reform of investment industry ,2021-01-26
BlackRock pushes companies to adopt 2050 net zero emissions goal,2021-01-26
"Thematic ETFs can deliver significant losses, academics find",2021-01-26
Steve Cohen provides funds for hedge fund protégé Gabe Plotkin,2021-01-25
EU regulators face January deadline to reform fund performance rules,2021-01-25
ETF trading surges on European stock exchanges,2021-01-25
Investor anxiety mounts over prospect of stock market ‘bubble’,2021-01-25
Is value investing back from the dead?,2021-01-25
M&A in 2021: asset management primed for consolidation ,2021-01-25
Top hedge funds reap biggest gains in a decade during pandemic ,2021-01-25
"Climate change, regulation, diversity and Covid top 2021 ‘to-do’ lists ",2021-01-24
"BlackRock, Aegon and Columbia Threadneedle fail ‘fee disclosure’ test",2021-01-24
BlackRock’s sustainability ‘report card’ one year from Fink’s annual letter,2021-01-23
Picking hedge fund winners turns harder for investors ,2021-01-23
Bitcoin heads for worst week since September as scrutiny builds,2021-01-22
Spacs/incentives: skewed dudes,2021-01-22
Finding Tokyo’s hidden treasures,2021-01-22
After Brookfield’s asset shuffle what cards are left to be played?,2021-01-22
Water looms large for European thematic ETF providers,2021-01-22
"Covid ‘changing’ investment advisory industry, says funds chief",2021-01-22
Cineworld facing revolt over proposed £65m CEO bonus scheme,2021-01-21
Fund managers speak out after crypto funds crackdown,2021-01-21
Hong Kong’s central bank criticises State Street over US blacklist flip-flop,2021-01-20
"UK dividends set to remain depressed in 2021, says report",2021-01-20
Hedge fund industry assets surge to record $3.6tn,2021-01-19
Top fraud investigator leaves UK hedge fund Gladstone,2021-01-19
Majority of EM bonds remain off limits to passive investors ,2021-01-19
"Workers will be lured back to the office, says Brookfield chief ",2021-01-19
BlackRock/Vanguard: ETF leviathans,2021-01-18
Sustainable ETF assets jump but most funds fall short on UN goals,2021-01-18
The week’s best fund management articles,2021-01-18
Norilsk Nickel becomes first miner to launch metals ETPs,2021-01-18
UK companies warned against shutting investors out of AGMs,2021-01-17
EU rules promise to reshape opaque world of sustainable investment,2021-01-17
The best and worst-performing equity funds of 2020,2021-01-16
Berkeley insider offloads shares worth £11m,2021-01-15
Bitcoin funds: trust issues,2021-01-15
UK fintech offers world’s ‘first’ net zero pension fund,2021-01-15
Central banks and climate change: all hot air ,2021-01-15
Bitcoin securities trading surges as investors seek crypto exposure,2021-01-15
Investors urged to exercise caution after bitcoin price swings,2021-01-15
Dealing fix for Treasury securities market is needed now ,2021-01-15
Global investors in limbo after Ant IPO torpedoed by Beijing,2021-01-15
BlackRock assets surge to record $8.68tn,2021-01-14
Hasenstab suffers largest outflow among bond managers in 2020,2021-01-14
Bitcoin faces regulatory scrutiny after rapid rally,2021-01-14
Annual inflows drive ETF industry assets to all-time high of $8tn,2021-01-14
Compass faces ‘critical questions’ on food parcels for children ,2021-01-13
Aviva Investors aims for greener future with cuts to carbon emissions ,2021-01-13
Vanguard’s assets hit record $7tn ,2021-01-13
Bitcoin’s wild ride leaves traditional money managers queasy,2021-01-13
BlackRock and Vanguard face heavy burden of US sanctions on China,2021-01-12
Louis Bacon rides stormy 2020 trading to make bumper gains ,2021-01-12
UK urged to introduce mandatory climate votes at AGMs,2021-01-12
M&G chairman Mike Evans steps down temporarily due to stress,2021-01-11
Hong Kong delistings: unstructured thinking,2021-01-11
One in 20 ETFs axed in 2020 after failing to build scale,2021-01-11
Liontrust chief on the competitive edge of small asset managers,2021-01-11
Appian raises $775m for its second private equity mining fund,2021-01-10
State Street to insist companies disclose diversity data,2021-01-10
HSBC targeted by shareholders over fossil fuel financing ,2021-01-10
Nest plans bold expansion into private markets,2021-01-10
"Global tech, emerging markets and pandemic uncertainties: opportunities and risks in 2021",2021-01-09
Direct indexing allows investors to pick and mix,2021-01-09
"China will vie to become world financial centre, says Ray Dalio",2021-01-09
Charities set for £800m boost from expansion of UK dormant asset fund,2021-01-09
Bitcoin: a symptom of market mania — or the new gold?,2021-01-08
Hedge fund Element to return $2bn after profiting in pandemic,2021-01-08
Active non-transparent ETF provider hits distribution hurdle,2021-01-08
Is time up for Euronet’s ATM earner?,2021-01-08
From hedge fund to sovereign wealth: Norway’s investment chief eyes active approach ,2021-01-07
Joe Biden must take a global lead on climate risk disclosure,2021-01-06
Hedge fund Winton’s assets plunge $26bn from peak after 2020 rout,2021-01-06
Pension funds need a radical rethink,2021-01-05
SkyBridge has worst year since 2008 after structured credit hit,2021-01-04
Brookfield seeks to take real estate arm private in $5.9bn deal,2021-01-04
Natixis to sell its stake in H2O Asset Management,2021-01-04
ETF costs: what is an OCF or TER and why is it important to know?,2021-01-04
EU lobbying by fund groups fuels fears over vested interest,2021-01-04
Eric Syz: ‘80% of active managers are index huggers’,2021-01-03
What’s your financial new year’s resolution for 2021?,2020-12-31
Cannabis ETF inflows jump but potential problems persist,2020-12-30
A theory of (almost) everything for financial markets,2020-12-29
"Ignorance impedes growth of China ETF market, survey reveals",2020-12-28
Large asset managers boost staffing in EU by 38% since 2015,2020-12-28
GQG emerges as pandemic winner with $30bn asset growth,2020-12-27
Green energy funds top league table in banner year for ESG  ,2020-12-26
Decarbonisation goals require huge commitment to critical metals,2020-12-24
Covid crisis opens chasm between hedge fund winners and losers,2020-12-24
The 12 days of Christmas for canny investors,2020-12-23
European ETF investors pull $7.8bn from S&P 500 funds  ,2020-12-23
OECD warns against using pension assets for ‘pet projects’ ,2020-12-23
"Money market funds need reform to prevent runs, US regulators say",2020-12-22
Mutual fund conversions to ETFs pose challenge ,2020-12-22
Connaught investors accuse regulator of ‘lying’ over compensation ,2020-12-22
Third of low-carbon funds invest in oil and gas stocks,2020-12-20
US urged to adopt auto-enrolment to address pensions crisis  ,2020-12-19
Amundi’s ETF chief on building a scale business,2020-12-19
Ireland overhauls private fund rules to lure UK managers after Brexit ,2020-12-18
BlackRock revamps style ETFs with retail investors in mind,2020-12-18
Foreign investors dash into emerging markets at swiftest pace since 2013,2020-12-18
Surging cloud market spells clear skies for datacentre owners,2020-12-18
St James’s Place appoints Paul Manduca as next chairman,2020-12-17
Tesla’s delayed S&P 500 entry highlights rise of profit metric ,2020-12-17
JPMorgan was losing bidder in $7bn battle for asset manager Eaton Vance,2020-12-16
China insists Trump sanctions will not deter foreign investors,2020-12-16
MSCI drops seven Chinese companies from indices,2020-12-16
Treasury plans UK tax shake-up for asset holding companies ,2020-12-15
Shareholder revolts over executive pay fall in 2020,2020-12-15
Vestrata aims to shake up Europe’s private banks ,2020-12-15
Hedge funds exploit technology to reduce cost and waste,2020-12-15
Fee war escalates across Europe’s fund industry,2020-12-14
France urges changes to supervision of EU asset managers,2020-12-13
Investors dump UK funds on fears of no-deal Brexit,2020-12-13
Lobbyist for Europe’s €17.6tn fund industry believes in Brexit balancing act,2020-12-12
Finance jobs stayed in London after Brexit vote,2020-12-12
Cheap tracker funds trounce private equity,2020-12-12
Homeless housing funds spark ethical debate over ESG profits,2020-12-11
Fund managers with $9tn in assets set net zero goal,2020-12-11
Index providers race to respond  to Trump’s Chinese investment bans ,2020-12-11
The US Treasury market is facing a train wreck,2020-12-11
What are active non-transparent ETFs?,2020-12-10
BlackRock vows to back more shareholder votes on climate change,2020-12-10
Caxton to shut main hedge fund to new money after record year,2020-12-10
My annual investment mea culpa,2020-12-10
New York state’s $226bn pension fund plans rolling fossil fuel divestments,2020-12-09
ETF inflows surge to beat previous monthly record by 14.5%,2020-12-09
LGIM rolls out first fixed income ETFs,2020-12-09
Passive funds’ share of European investment market jumps to 20%,2020-12-08
The battle over ESG investing,2020-12-07
Demand grows for student-led impact investment funds,2020-12-07
Students push for university climate change divestments,2020-12-07
Next generation behind family offices’ ESG push,2020-12-07
"Post-pandemic recovery will reshape asset management industry, says study",2020-12-06
Absolute return funds on course for worst ever annual outflows,2020-12-06
Calstrs plans green shift after Joe Biden’s victory,2020-12-05
FTSE drops 8 Chinese groups from indices after Trump order,2020-12-05
Active fund investors earn higher returns for tolerating underperformance ,2020-12-04
M&G urged to waive fees on suspended property fund,2020-12-04
"Asset management industry ‘not doing a good job’ on diversity, says SEC chief",2020-12-04
Rash of bond defaults tests China’s fixed income fund market,2020-12-04
Vanguard’s international chief to retire after 33 years at asset manager,2020-12-03
Golden oldies strike right note for pandemic winner AJ Bell ,2020-12-03
Pershing Square/FTSE 100: it’s hip to be there,2020-12-03
Vanguard to close European active ETF range,2020-12-03
‘Tiger cub’ hedge fund Coatue surges to 52% gain ,2020-12-03
Equivalence row looms over London ETF hub role,2020-12-01
DWS reignites European ETF price war with fresh round of fee cuts,2020-11-30
China’s ESG ratings tarnish its allure for sustainable investors,2020-11-30
Bruno Crastes: ‘French Soros’ fights for H2O’s future ,2020-11-30
‘Mancos’ consolidate as Brexit transition deadline approaches  ,2020-11-30
Standard Life Aberdeen to offload Parmenion advisory arm,2020-11-29
Price of sellside analyst meetings almost halved by pandemic  ,2020-11-29
Toxic side effects of coronavirus weaken global pension systems  ,2020-11-29
UK public pension funds suffer £2bn hit to oil investments,2020-11-28
Record-setting bitcoin faces test after volatile week ,2020-11-27
Hang Seng tech ETF to launch in Singapore,2020-11-27
Biden administration faces a housing booby trap,2020-11-27
ESG: a trend we can’t afford to ignore ,2020-11-26
Vanguard’s exit from Asia mandates rattles feeder fund partner,2020-11-26
Aberdeen Standard targets women-led hedge funds with new strategy,2020-11-26
Brussels criticised for giving BlackRock sustainable finance contract,2020-11-25
BlackRock aims for wealthy business with $1.05bn Aperio deal,2020-11-25
Vaccine hopes set off rush for emerging markets,2020-11-25
Tesla’s market value soars to $500bn ahead of S&P 500 debut,2020-11-24
"BlackRock should split off its Aladdin tech platform, says think-tank",2020-11-24
Credit Suisse set to take $450m hit as hedge fund York Capital retreats,2020-11-24
Stanhope merges with FWM to create $24.2bn wealth manager,2020-11-24
From mutual fund to ETF: first conversion nears completion,2020-11-24
"Mutual fund conversions to ETFs set to gather momentum, experts say",2020-11-23
FTI axed by clients in fallout over oil industry work,2020-11-23
CFA forges ahead with ESG standard despite criticism,2020-11-23
Invesco’s UK investment chief targets performance turnround,2020-11-22
China regulations spur investors to reassess tech sector,2020-11-22
Janus Henderson under pressure as Trian eyes consolidation,2020-11-21
Bullish mood across markets leaves investors with a dilemma,2020-11-21
Deutsche Börse to back ISS in lawsuit against SEC,2020-11-21
European weekly ETF inflows hit highest level this year,2020-11-20
Why China could snarl global debt relief,2020-11-20
Norway’s $1.2tn oil fund to use more external managers,2020-11-19
"What is securities lending, why do ETFs do it and is it risky?",2020-11-19
Two Pimco employees accuse asset manager of discrimination,2020-11-18
Multi-factor funds fall out of favour after poor performance,2020-11-18
US regulators issue stern warning on volatility ETPs,2020-11-18
Roger Ferguson to step down after 12 years at helm of TIAA,2020-11-17
ESG falls down the investment agenda,2020-11-17
Andrew Bailey signals looser UK financial regulations in investment drive,2020-11-17
Vanguard and BlackRock tighten stranglehold on ETF industry,2020-11-17
Investors urge European companies to include climate risks in accounts,2020-11-16
ETF tax advantage feared at risk if Democrats win Senate,2020-11-16
Pimco investment chief warns of market fragility after Covid ,2020-11-16
Big investors push UK to go further on green finance,2020-11-15
Vulture funds buy up bonds of China state-owned enterprises,2020-11-15
Inflows into stock funds hit 20-year high,2020-11-14
Engagement is the key to investment trusts’ success,2020-11-13
EU regulator says investment funds must strengthen against future shocks,2020-11-13
US ban on China military-linked stocks creates investor woe,2020-11-13
Investment trusts stay on course through the pandemic,2020-11-13
"Cut-throat ETF price war is over, industry professionals say  ",2020-11-13
The $5tn club: Merger mania sweeps asset management industry,2020-11-13
The fairytale of market liquidity ,2020-11-13
Brookfield launches Bermuda reinsurer to fuel growth,2020-11-12
Labour calls for UK pension funds to be carbon neutral by 2050,2020-11-12
Investment research: tipping points,2020-11-12
Put global stocks at the heart of an investment trust portfolio,2020-11-12
China corporate bond index draws interest from offshore issuers,2020-11-12
Scandals rock South Korea’s booming hedge fund industry,2020-11-12
Active managers struggle to prove their worth in a turbulent year,2020-11-11
Oxford university partners with BlackRock on sustainable tracker fund,2020-11-10
ETF investors set to perform volte-face on US Senate uncertainty,2020-11-10
Schroders to invest in pandemic winners with new UK trust,2020-11-10
The man leading Mitsubishi UFJ’s push in Australia,2020-11-09
Schroders launches impact fund to aid Covid-hit emerging markets,2020-11-09
AI can drive ethical investment only if we grasp the messy reality ,2020-11-09
Scottish Widows to dump £440m of company holdings that fail ESG tests,2020-11-09
From veganism to #BLM: Big Data promises to transform niche ETFs,2020-11-08
Funds cut cash holdings to pre-pandemic levels,2020-11-08
"Charity sector faces £10bn funding shortfall and 60,000 job losses",2020-11-08
Companies defy investor demands on climate change,2020-11-08
Vanguard admits investors were sent incorrect information,2020-11-07
Natixis to cut ties with under-fire H2O,2020-11-06
"ESG data explosion, investors demand diversity, policymakers fight climate change",2020-11-06
Pandemic drives financial advisers to speed tech change,2020-11-06
Asset management: an activist’s playground,2020-11-06
Early US election results prompt rush for small and mid-cap ETFs,2020-11-06
Now is the time for financial advisers to earn their corn,2020-11-06
Senate plays the grinch with distressed US states,2020-11-06
Invesco grants board seats to Trian executives Peltz and Garden,2020-11-05
BlackRock looks for new profit rockets as rivals play defence,2020-11-05
VanEck applies for China retail fund management licence,2020-11-05
Odey Asset Management: one foot out the door,2020-11-04
Ethical investment is about morals not markets,2020-11-04
Sharesave: what’s not to like?,2020-11-04
Crispin Odey steps down from helm of Odey Asset Management,2020-11-03
"A terrible, horrible, no-good year for quants",2020-11-03
CSOP’s China bond ETF scoops more than $1bn in assets,2020-11-03
Hedge fund GSA moves low-cost fund into high-fee markets,2020-11-02
What the US election could mean for EM investing,2020-11-02
US pension funds failing in climate change challenge ,2020-11-01
Unlock UK pension funds to speed recovery and boost savers,2020-10-31
Stanford endowment chief applies ballet discipline to investment,2020-10-31
Investors pile pressure on companies over ESG at annual meetings ,2020-10-31
Investors find a novel way to hedge their portfolios: hedge funds,2020-10-31
Money market funds brace for rules overhaul after Covid shock,2020-10-30
Amundi accelerates Asia push with China wealth venture,2020-10-30
Safe as houses on a faultline,2020-10-30
Somerset Capital is now more Beijing than Bath,2020-10-30
SEC decision on leveraged ETFs sparks concern for retail investors,2020-10-29
BlackRock pushes for global ESG standards,2020-10-29
Taiwan asset owner pre-emptively terminates Vanguard mandate,2020-10-29
Distressed debt investors still await rich pickings from pandemic,2020-10-29
Asset managers warned over ‘insufficient’ climate risk reporting,2020-10-29
US SEC opens door to more leveraged ETFs,2020-10-28
China and Hong Kong ETF markets grow closer with feeders launch,2020-10-28
Investors probe ESG credentials of bond sellers on ‘greenwashing’ fears,2020-10-28
Australia’s pensions minister clashes with fund managers and green lobby,2020-10-27
Finance houses join the rush toward supporting the energy transition,2020-10-27
Activist fund targets St James’s Place  ,2020-10-26
Covid condemns value investing to worst run in two centuries,2020-10-26
Oil and gas lobby moves to embrace green investors,2020-10-26
European bank ETFs lose out as investors flock to US counterparts,2020-10-26
The senator shaking up Australia’s A$3tn pensions sector ,2020-10-26
Chris Hohn blasts BlackRock and Vanguard over climate change,2020-10-25
Fund managers grapple with limits of remote working,2020-10-25
