title,date
Are you brave enough to hunt for value in a bear market? ,2020-03-13
UK regulator demands early warning on funds at risk of suspension,2020-03-13
An avalanche of destabilised debt and liquidity is coming our way,2020-03-13
Trapped Woodford investors in line for £142m repayment,2020-03-12
"Meat companies must do more over climate risks, say investors",2020-03-12
Oil crash hits South Korea’s exotic investment products,2020-03-12
BlackRock rebels over executive pay at Qualcomm,2020-03-11
Natixis shares drop after H2O warns of large asset management losses,2020-03-11
Hedge fund Solus to close flagship vehicle,2020-03-11
Funds count cost after market drop with H2O down 20%,2020-03-11
Gold: a hedge against future policy misfires,2020-03-11
How many funds make an ideal portfolio?,2020-03-11
Stock drop raises pressure on BoJ buying spree,2020-03-11
M&G warns on capitalposition  as profits fall,2020-03-10
H2O warns clients of ‘surprisingly large’ losses,2020-03-10
Stock pickers v index funds: acid test for active managers,2020-03-10
Standard Life Aberdeen suffers almost £60bn of withdrawals,2020-03-10
Switching out of shares in a battered market,2020-03-10
UK funds exposed to energy companies hit hard,2020-03-09
Students flock to study quant finance in record numbers,2020-03-09
Jobs bonanza in stewardship and sustainable investing teams ,2020-03-08
Terry Smith blasts  platforms for fuelling illusion of fund liquidity,2020-03-08
MSCI president defends decision to include China,2020-03-07
"The ants, whales and pandas battling for a £34m investment contract",2020-03-07
UK-listed companies face compulsory climate disclosures,2020-03-06
Coronavirus mayhem reflects phenomenon of ‘shock-led’ markets,2020-03-06
The many confusing shades of green for investors,2020-03-06
Maturing Child Trust Funds to provide £700m bonanza   ,2020-03-06
Fed Funds cuts are for TV news and headlines,2020-03-06
Why investors need diligent advisers,2020-03-06
Schroders’ profits drop but show recovery in new business,2020-03-05
Climate change tops agenda at UK voting season,2020-03-05
As the ETF turns 30 active managers should embrace it,2020-03-05
"Intu the breach, dear lenders",2020-03-04
New business surges at Legal & General Investment Management,2020-03-04
UK watchdog admits 7 funds breached ‘trash ratio’,2020-03-04
UK investment body lobbies for   property fund revamp,2020-03-04
Flows into ESG funds raise questions over ratings,2020-03-04
Hedge funds Caxton and Kirkoswald profit as rates drop,2020-03-04
Exchange-traded funds pass test of their resilience,2020-03-04
H2O’s auditor flags trades with Windhorst-linked broker,2020-03-04
Pension fund giants team up in attack on ‘short-termism’,2020-03-04
ETFs/coronavirus: RobinHood’s big misfire,2020-03-03
Fidelity marks ‘strong year’ with record results,2020-03-03
Value of M&A in asset management sector plunges to $13.5bn  ,2020-03-03
Don’t believe the hype about AI and fund management,2020-03-03
Investec pushes on with Ninety One IPO,2020-03-02
Energy’s stranded assets are causing concern,2020-03-02
Cyber security: are fund managers keeping up with regulators?,2020-03-02
Asset managers demand companies take action on gender diversity,2020-03-02
Janus Henderson chief earns $8.4m despite outflows and share price fall,2020-03-01
Fund groups suffer heavy outflows as coronavirus spreads,2020-03-01
Frenzy in private debt pushes assets beyond $800bn,2020-03-01
Carrying out a successful mega-deal,2020-03-01
Ex-Woodford fund shrinks 16% since reopening,2020-02-29
CFA chief on failing the ‘world’s hardest exams’ ,2020-02-29
Companies warned over lack of progress on board diversity,2020-02-29
Private investors in trading surge as coronavirus sparks market correction ,2020-02-28
Activist takes aim at Liberty-controlled Belgian telecoms group,2020-02-28
BlackRock highlights changing role of sustainable investments,2020-02-28
The political debate on US energy is not connected to reality,2020-02-28
Campaign for Clear Pension Charges,2020-02-28
Outflows from Invesco’s flagship loan fund near $10bn,2020-02-28
Junk bond funds suffer worst outflows in more than a year,2020-02-28
Watchdog tells asset managers to drop Libor products,2020-02-27
Hedge funds feel the pain after raising ‘long’ bets,2020-02-27
US companies challenged on stakeholder commitments,2020-02-27
US investors confront home truths about private prison holdings,2020-02-27
BlackRock co-founder Barbara Novick to step down,2020-02-26
M&G investors to remain locked in property fund ,2020-02-25
"A decade on, did Man Group’s $1.6bn bet on GLG pay off?",2020-02-25
Private equity returns: fee glee,2020-02-24
Jupiter and La Banque Postale rank among top climate performers,2020-02-24
The daunting task of decarbonising investment portfolios,2020-02-24
Asset managers seek refuge in each other’s arms,2020-02-24
BlackRock’s black box: the tech hub of modern finance,2020-02-24
Time for companies to count environmental and social outcomes,2020-02-24
Big investor push drives demand for environmental expertise,2020-02-24
Fund managers need to look again at infrastructure,2020-02-24
Wanted: chief executive for Norway’s $1.2tn oil fund,2020-02-24
Alphabet faces investor backlash over human rights policies,2020-02-24
Luxembourg regulator accused of failing to protect investors,2020-02-23
Risks build in world’s largest bond funds,2020-02-23
UK’s top pension scheme tackles Barclays on climate change ,2020-02-22
Marathon man brings new mindset to Aegon Asset Management,2020-02-22
BlackRock trims 30-year Treasuries after rally,2020-02-21
Coronavirus may be worse than Wall St is wagering,2020-02-21
Low-carbon fund is UK best seller in January,2020-02-21
US housing finance is stuck in a complex knot of contradictions,2020-02-21
‘Monstrous’ run for green stocks stokes bubble fears,2020-02-21
UK companies face closer scrutiny on disclosing climate risks,2020-02-20
Climate campaigners turn their fire on financial world,2020-02-20
GAM waives bonuses for executives after dismal year,2020-02-20
What happens if my broker fails?,2020-02-20
Odey/hedge funds: Sirius money,2020-02-19
Inside story of Jupiter and Merian’s marriage of convenience,2020-02-19
Investors wait on GAM as fund house slims down,2020-02-19
Franklin swells assets to $1.5tn with Legg Mason deal,2020-02-18
Franklin/Legg Mason: at full Peltz,2020-02-18
US’s passive investing juggernauts break new ground in Britain,2020-02-18
Interactive Investor to acquire Share Centre,2020-02-17
City has fallen out of love with investment bankers,2020-02-17
Michael Spencer taken to the cleaners by Laundrapp demise,2020-02-17
Jupiter chief defends stock picking after Merian acquisition,2020-02-17
Credit Suisse sets sights on rejoining Europe’s top ETF providers,2020-02-17
Sustainalytics chief: ‘We are past the time of voluntary disclosures’,2020-02-17
Goldman Sachs offers ‘basket’ for China stock bets,2020-02-17
Hedge fund Lansdowne hit by failed bet on UK recovery,2020-02-17
Former MEP warns of fresh raid on fund managers’ EU business models,2020-02-16
How will the EU reshape fund managers’ regulations after Brexit?,2020-02-16
Why UK universities are courting overseas investors,2020-02-16
Chinese asset managers prop up coronavirus-hit funds,2020-02-15
Richard Buxton bets on Brexit bounce and new chancellor,2020-02-15
Jupiter in advanced talks to buy Merian Global Investors,2020-02-15
Where the fund manager consolidation narrative goes wrong,2020-02-14
Invesco tops list of poorly performing funds,2020-02-14
T Rowe Price calls its WeWork investment a ‘debacle’,2020-02-14
Investors reluctant to break up with their wealth manager ,2020-02-14
Burford faces long wait over $1bn Argentina claim,2020-02-14
Finance on Instagram: what’s not to like? ,2020-02-14
UK university pension fund closes stockpicking team,2020-02-13
Canadian healthcare investment group picks London for fund listing,2020-02-12
Box ticking is bad for corporate governance,2020-02-12
Hargreaves claims Woodford-invested funds offered ‘value’,2020-02-12
Hedge fund co-founder returns to London from New York,2020-02-12
Pension plans under more pressure on climate risks,2020-02-12
Index fund votes: take back control,2020-02-11
UK active fund sales plummet on coronavirus fears,2020-02-11
Stockpickers turn to big data to arrest decline,2020-02-11
Inflation-linked bonds hold steady despite impending £100bn RPI hit,2020-02-11
Why nobody should listen to NMC’s talk of bids,2020-02-10
What’s really in your ETF basket? ,2020-02-10
US must dial down the fizz in the opaque world of private capital,2020-02-10
More than €1tn of investor money is stuck in ‘zombie’ funds,2020-02-10
Tech stockpicker raises $6bn for hybrid fund,2020-02-10
"Hedge fund ‘Masters of Mayfair’ are no more, says Man chief",2020-02-09
The SEC is wrong to hobble shareholder proposals,2020-02-09
Santander fintech guru trades punk rock for asset management ,2020-02-09
Hong Kong turmoil triggers Singapore fund licence surge,2020-02-09
Heads will roll as more fund chiefs face the chop ,2020-02-08
Big investors ignore proxy advisers on controversial votes,2020-02-08
"BlackRock, Schroders and SLA back cuts in stock exchange trading hours  ",2020-02-07
How passive investment dulls the green wave,2020-02-07
Markets react to the coronavirus,2020-02-07
Spooked UK and US investors retreat to cash ,2020-02-07
Coronavirus strikes World Bank’s 2017 catastrophe bonds,2020-02-07
Hargreaves Lansdown founder to sell £500m of shares,2020-02-06
BlackRock rebukes Siemens on its environmental record,2020-02-06
A little ETF rule change that could make a big difference,2020-02-06
Direxion launches high-risk sustainable investment ETF  ,2020-02-06
Vanguard moves into private equity with HarbourVest partnership,2020-02-05
Brookfield: inside the $500bn secretive investment firm,2020-02-05
‘Sustainable’ emerging market stocks outstrip indices,2020-02-05
Barrick Gold chief hits at fund managers over new-found ESG focus,2020-02-04
Renewable energy investor raises more than $1bn,2020-02-04
Janus Henderson reports jump in assets despite heavy outflows,2020-02-04
ESG focus widens gaps between winners and losers,2020-02-04
UBS and BlackRock call time on great US stock rally,2020-02-04
ABP targets climate neutral investment portfolio by 2050,2020-02-03
Big investors battle SEC on shareholder resolution changes,2020-02-03
"Fink, Dimon and Zuckerberg face re-election vote protest",2020-02-03
Pension funds’ puzzling fondness for buyouts,2020-02-02
ISS chief on his battle with corporate America and the SEC,2020-02-02
Asset managers enjoy bumper 16% pay surge,2020-02-02
Investors give up stocks for bonds despite frothy returns,2020-02-01
Pension crisis: US seeks to save flawed state benefits system,2020-02-01
Woodford Income Focus fund to reopen in February,2020-01-31
New business dips at Hargreaves Lansdown ,2020-01-31
T-Bonds: fill your boots while you can,2020-01-31
Hedge funds are still searching for the next big thing,2020-01-31
Loeb slams Washington ‘swamp’ in tussle over SEC rule,2020-01-31
Europeans make record investments in sustainable funds ,2020-01-30
Why asset managers cannot be passive on climate change,2020-01-30
GAM fined by Swiss exchange after accounting misstatement,2020-01-30
Church of England joins passive push with climate index,2020-01-30
M&G extends property fund suspension,2020-01-30
Latin and Greek have no place in the investment world ,2020-01-30
Negative-yielding debt pushes investors into gold,2020-01-30
Woodford’s investors face £10m in winding-up costs,2020-01-29
Relations between UK executives and investors ‘at low point’,2020-01-29
Brewin Dolphin’s chief executive to depart wealth manager,2020-01-29
Woodford payouts: the key facts for investors ,2020-01-29
US stocks look set to continue their outperformance,2020-01-29
Trapped Woodford investors told of steep losses,2020-01-28
State Street vows to turn up the heat on ESG,2020-01-28
Retiring chief fund lobbyist fires parting shot at industry,2020-01-28
Star stockpicker Darwall apologises for Wirecard exposure,2020-01-28
Why some big investors are tiring of hedge funds,2020-01-28
Top UK pension scheme threatens managers over climate risk,2020-01-27
AI will rewrite the future of fund management,2020-01-27
Fidelity head Anne Richards on becoming the fund house to fear,2020-01-27
Are investors too bullish on listed European managers?,2020-01-27
"Cartoon, January 27",2020-01-27
"Movers and shakers, January 27 ",2020-01-27
BlackRock hit by backlash in France,2020-01-26
Investors pull $43bn from hedge funds in 2019,2020-01-26
Investor inaction: a story behind Australia’s wildfires ,2020-01-25
UK active fund managers suffer bloodbath in 2019,2020-01-25
Invesco’s Barnett boosts fund liquidity amid heavy outflows,2020-01-24
How fees eat into passive fund investments,2020-01-24
Infrastructure funds have become a way around   decarbonisation targets ,2020-01-24
Renaissance Technologies founder names son co-chair,2020-01-23
Investors are asking the wrong questions on sustainability,2020-01-23
Waiting for value to shine,2020-01-22
City watchdog pledges tougher line with asset managers,2020-01-22
ValueAct/Jeff Ubben: nice guys finish up,2020-01-22
Amundi: scale whale,2020-01-22
Xavier Rolet steps down as chief of hedge fund CQS,2020-01-22
The new kings of the bond market,2020-01-22
Hedge fund Monterone buys out early-stage investor,2020-01-22
A vital prop is wobbling for Japan’s stock market,2020-01-21
Amundi pays €430m to acquire Sabadell Asset Management,2020-01-21
MSCI acquires Burgiss stake for $190m,2020-01-21
Investors worry more about US election than trade war,2020-01-21
Calpers and the ‘illiquidity premium’,2020-01-21
FundRock Partners receives £4.4m emergency funding to stay afloat,2020-01-20
Larry Fink rules on the best global standards for climate risk reporting,2020-01-20
Fairer treatment of older workers would soothe pensions crisis,2020-01-20
UK bond chief expresses doubts on green gilts,2020-01-20
The index providers are quietly building up enormous powers,2020-01-20
"Cartoon, January 20",2020-01-20
Record sums deployed into sustainable investment funds,2020-01-20
"Movers and shakers, January 20 ",2020-01-20
Boom in emerging market corporate debt stirs fears,2020-01-19
Africa looms large for UK’s development finance unit,2020-01-19
Oxford Sciences Innovation parts ways with chief executive,2020-01-19
FCA blindsided by investment fund suspensions ,2020-01-19
Don’t expect the earth from fund managers on climate change,2020-01-19
Big Australian investors under scrutiny over climate change,2020-01-18
Wall St banks escalate asset management battle ,2020-01-18
State Street: custody battle,2020-01-17
‘Woodford effect’ weighs on stock market minnows ,2020-01-17
A demographic trap and low growth are Putin’s biggest challenges,2020-01-17
GAM issues third profit warning in less than two years,2020-01-17
Tax boost for maturing child trust funds ,2020-01-17
Systematic funds suffer ‘quant winter’,2020-01-17
ARK Invest’s enthusiastic EV predictions don’t add up,2020-01-16
The GPIF and the complexity of stewardship,2020-01-16
Hedge fund veteran looks to cash in on biotech boom,2020-01-16
Ashmore/Mark Coombs: hold music,2020-01-15
Companies faced more activist investors than ever in 2019,2020-01-15
BlackRock attracts record inflows as stock markets soar,2020-01-15
Fund managers must embrace AI disruption,2020-01-15
What Trigger’s broom can teach us about investment ,2020-01-15
The fallacy behind passive fund management,2020-01-15
BlackRock seeks to regain lost ground in climate fight ,2020-01-14
BlackRock needs to deliver on climate pledges,2020-01-14
BlackRock shakes up business to focus on sustainable investing,2020-01-14
How will Vanguard shape corporate America?,2020-01-14
How do I solve my transatlantic inheritance tax problem?,2020-01-14
Chinese companies face tougher ESG disclosures,2020-01-13
2020s will not be kind to active fund managers,2020-01-13
Half UK universities commit to divesting from fossil fuels,2020-01-13
Creativity will pay for next-gen asset managers,2020-01-13
Voya’s investment chief on ‘overlooked’ female fund managers,2020-01-13
ETF providers end 2019 on high with record assets,2020-01-13
"Cartoon, January 13",2020-01-13
"Movers and shakers, January 13",2020-01-13
Fidelity boss calls for fund rules change after Woodford collapse,2020-01-12
Asset managers compete in ‘frenzy’ to gain China foothold,2020-01-12
Vanguard smashes through $6tn assets barrier,2020-01-12
Vanguard and the financial system: too big to be healthy?,2020-01-12
FCA begins probe of asset management’s crucial ACD market,2020-01-11
Biggest asset managers attacked over role in climate change,2020-01-11
Trapped Woodford investors face delay to first repayment,2020-01-10
Basel derivative rules point to more pain for fund managers,2020-01-10
Coffey’s Siberian mine bet highlights liquidity dangers,2020-01-10
Traders across Europe face up to cost of failure,2020-01-10
Bond funds had record inflow as Iran crisis spiralled,2020-01-10
"US insurance/Voya: roll up, roll up",2020-01-09
Vanguard set to enter UK investment advice industry,2020-01-09
Britain’s railway mess will not be sorted until pensions are reformed,2020-01-09
Argentine election shock wrongfoots hedge funds in 2019,2020-01-09
Index funds smash through the $10tn-in-assets mark,2020-01-08
Ignoring climate risk costs more than tackling it,2020-01-08
Franklin Templeton: active failure,2020-01-07
Terry Smith collects £16m after Fundsmith profits soar 25%,2020-01-07
Woodford and partner shared £13.8m in dividends in final year,2020-01-07
Franklin Templeton heads for sixth year of outflows,2020-01-07
UK savers give investment funds a boost after election,2020-01-07
Medical cannabis: dope hope,2020-01-06
ISS downgrades knock 1% off market value for US companies,2020-01-06
Are Reits as attractive as we all first thought?,2020-01-06
"Trade, US election and volatility: risks and opportunities in 2020",2020-01-06
Private equity managers scoop bigger pay and bonus awards,2020-01-06
"Movers and shakers, January 6",2020-01-06
"Cartoon, January 6",2020-01-06
Passive investing boom reaches Europe as assets hit $1tn,2020-01-05
Fund CIOs call US-China tensions biggest challenge for 2020,2020-01-05
High demand prompts launch of Europe’s first cannabis ETF,2020-01-05
 Winklevoss twins on crypto’s allure for the ETF world,2020-01-04
Shareholders demand British bosses increase ‘skin in the game’,2020-01-04
Gold funds dazzle in list of 2019’s top performers,2020-01-03
Would your finances pass the 10 year challenge? ,2020-01-03
US-China financial war is just beginning to take shape,2020-01-03
Active fund managers pray for turnround as exodus continues,2020-01-03
Private equity giants vow to show their ESG credentials in 2020,2020-01-03
Time for investors to rethink government bonds,2020-01-02
Stockpickers need to prove they are worth it,2020-01-02
Japan’s GPIF is right — short selling is downright irresponsible,2020-01-02
It is time to bin the efficient markets hypothesis,2020-01-01
HSBC pins asset management growth on ETFs ,2019-12-31
Bond ETFs gain traction in the great rotation to passive,2019-12-30
Mercia contrite over small investors left out of fundraising,2019-12-29
Hedge funds record best year since 2013 but still trail market,2019-12-27
Invesco is worst-selling fund manager in a year to forget,2019-12-26
Anglo seeks to ease fears over fossil fuel lobby groups ,2019-12-22
How asset managers turned into business agitators,2019-12-22
Aberdeen Standard to take over Woodford Income Focus fund,2019-12-20
The responsible capitalists,2019-12-20
Lowest-rated US bonds end the year with a bang,2019-12-19
Japan acts to avert ETF market liquidity squeeze,2019-12-19
Farmland-focused trust launches $300m UK float,2019-12-19
State Street takes hit from TD Ameritrade-Schwab merger,2019-12-18
"Hong Kong protests spark $5bn fund outflow, BoE says",2019-12-18
Investors pull record amounts out of US stock funds,2019-12-17
BoE eyes curbs on open-ended property funds,2019-12-16
Bond funds revel in white-hot year for fixed income,2019-12-16
Small-cap managers sharpen liquidity focus post-Woodford ,2019-12-16
UK fund industry has had a year to forget — especially the regulator,2019-12-16
MSCI flags risks of small pool of women on multiple boards,2019-12-16
UK antitrust body approves fiduciary management standards,2019-12-16
UK property funds’ cash holdings vary widely,2019-12-16
VanEck chief: I’ve become ‘an ETF guy’,2019-12-16
"Cartoon, December 16",2019-12-16
"Movers and shakers, December 16",2019-12-16
"Liquidity, Brexit and job cuts spell tricky 2020 for fund groups",2019-12-15
Nuns take on BlackRock over climate change,2019-12-15
ESG controversies wipe $500bn off value of US companies,2019-12-14
Johnson win sparks fund industry debate over post-Brexit regulation,2019-12-14
Stockpickers take a starring role when shares collapse,2019-12-13
Repayments to Woodford fund investors to start in January,2019-12-13
Private investors react bullishly to election result ,2019-12-13
Repo and swaps markets point to further volatility,2019-12-13
Beware the liquidity iceberg,2019-12-13
Securities dealing taxes:  FTT would be OTT,2019-12-12
Big investors turn screw over climate pollution disclosure ,2019-12-12
UK property funds suffer worst week of redemptions since Brexit vote,2019-12-12
Investment does not have to ruin the planet ,2019-12-12
Index investors should not be passive owners when it comes to ESG,2019-12-12
Short sellers under fire from CIO of world’s largest pension fund,2019-12-12
Woodford protégé too much of a large-cap lookalike,2019-12-11
Invesco fund manager Mark Barnett sacked from investment trust,2019-12-11
"Fund managers shun Saudi, China upgrades",2019-12-11
BlackRock strives for moral high ground with Wiseman firing,2019-12-11
VCTs attract highest number of investors in a decade,2019-12-11
Neil Woodford closes office as part of business wind down,2019-12-10
Fund managers push against the flow in global macro,2019-12-10
Global investor group urges action on climate change,2019-12-09
"Enlightened ESG investors engage, but retain right to divest",2019-12-09
"Movers and shakers, December 9 ",2019-12-09
Mifid II creates ‘existential threat’ for small research groups,2019-12-09
Calpers investment chief talks about private equity and yoga,2019-12-09
"Cartoon, December 9",2019-12-09
Latin America’s fund market tipped to double by 2025,2019-12-09
Leading US university endowments struggle to beat tracker funds,2019-12-08
FCA probes funds worth £15bn over links to Woodford,2019-12-08
M&G property fund clients paid £100m in fees since Brexit vote,2019-12-08
Insurer-owned asset managers lag behind independent fund houses,2019-12-07
UK property investors pull cash at fastest rate this year,2019-12-07
Morningstar’s ‘world’ tag masks heavy US weighting,2019-12-06
A fifth of UK fund managers make reporting errors under Mifid II rules,2019-12-06
Why some hedge funds are warming towards Europe,2019-12-06
Wealth managers: why you don’t always get what you pay for,2019-12-06
How to invest when staid stocks command huge valuations,2019-12-06
UK property funds come under pressure ,2019-12-06
Vanguard to launch UK’s cheapest pension,2019-12-06
Argentina’s Peronists will not be a pushover for Burford ,2019-12-06
DIY stock indices pose challenge to heavyweights,2019-12-06
BlackRock’s Mark Wiseman ousted over relationship,2019-12-05
Aberdeen property fund hit by surge of withdrawals,2019-12-05
The battle over green investment hots up,2019-12-05
EU regulator says Mifid II has failed on data costs,2019-12-05
AJ Bell reports record profit a year after float,2019-12-05
UK property funds: M&G the Unready,2019-12-05
Cheap is not always cheerful in value investing,2019-12-05
Direct lending has a transparency problem,2019-12-05
Investment groups seek global tax disclosures,2019-12-05
M&G suspends £2.5bn fund on Brexit and retail woes,2019-12-04
GAM split: Bluebell would,2019-12-04
GAM accused of accounting ‘misstatement’ by Swiss bourse,2019-12-04
Fidelity’s head of $2.8tn asset management arm to retire,2019-12-03
Bridgewater’s co-chief Eileen Murray to leave hedge fund,2019-12-03
Government Pension Investment Fund: eat my shorts,2019-12-03
World’s biggest pension fund strikes blow against short-sellers,2019-12-03
TCI does more than green funds on climate,2019-12-02
Hundreds of jobs under threat at GAM,2019-12-02
When extreme weather threat needs a stilted response,2019-12-02
Bond ETFs outshine equity rivals in 2019,2019-12-02
Pension funds warn over QE damage ,2019-12-02
US regulators divided on use of derivatives in investment products,2019-12-02
"Cartoon, December 2",2019-12-02
Lack of inflows expected to hinder fund houses’ growth in next 5 years,2019-12-02
"Movers and shakers, December 2 ",2019-12-02
Banks urged to clean up government bond sale practices,2019-12-02
Hedge fund TCI vows to punish directors over climate change,2019-12-01
Nuns berate SEC over planned shareholder rules,2019-12-01
Assets held in exchange traded funds surge to record $6tn,2019-12-01
Investors alarmed ahead of UK election,2019-11-30
Investors rebel over US director re-elections,2019-11-30
Invesco revamps UK equity leadership after outflows,2019-11-29
GAM’s head of investments to quit Swiss asset manager,2019-11-29
Baselheads are intent on crushing  European project finance,2019-11-29
European investors back call for shorter trading day,2019-11-28
How investment analysts became data miners,2019-11-28
US distressed debt flashes warning sign for investors,2019-11-28
